Sheet: U12表1-1-2基坑围护
A1: 表1-1-2 单位工程报价汇总表
A2: 建设单位和工程名称：杭州市中医院丁桥分院工程
A3: 单位工程名称：基坑围护
B4: 内容 | C4: 报价合计 (元) | D4: 累计完成百分比 | E4: 至上期末累计完成 | F4: 至上期末监理审核完成（元） | G4: 本期完成 (元) | H4: 本期监理审核（元）
A6: 一 | B6: 分部分项工程量清单 | C6: 38587638 | D6: =(RC[2]+RC[3])/RC[-1] -> 1.0078471763418118 | E6: =RC[1]+RC[2] -> 38890442 | F6: 38021808 | G6: 868634 | K6: =RC[-4]/RC[-8] -> 2.2510680752213959E-2
A7: 二 | B7: 措施项目清单（1+2） | C7: 259850 | D7: =(RC[2]+RC[3])/RC[-1] -> 1 | F7: =181375+78475 -> 259850 | G7: 0 | K7: =(R[-1]C[-3])/R[-1]C[-8] -> 0
A8: 1 | B8: 组织措施项目清单
A9: 2 | B9: 技术措施项目清单 | C9: 259850 | D9: =(RC[2]+RC[3])/RC[-1] -> 1 | F9: 259850 | G9: 0
A10: 三 | B10: 其他项目清单
A11: 四 | B11: 规费[3+4+5] | C11: 2211209 | D11: =(RC[2]+RC[3])/RC[-1] -> 1.0016851779727742 | F11: 2178784 | G11: =R[1]C+R[2]C+R[3]C -> 36151.280700000003 | K11: =(R[-5]C[-3]+R[-5]C[-5])/R[-5]C[-8] -> 0.9853364955895979
A12: 3 | B12: 排污费、社保费、公积金 | C12: 2164455 | D12: =(RC[2]+RC[3])/RC[-1] -> 1.0015629800573354 | F12: 2132717 | G12: =2164455-2129334 -> 35121
A13: 4 | B13: 危险作业意外伤害保险费
A14: 5 | B14: 民工工伤保险费[（一+二+三+3+4）*费 率] | C14: 46754 | F14: 46068 | G14: =(R[-8]C+R[-7]C+R[-4]C+R[-2]C)*0.114% -> 1030.2807
A15: 五 | B15: 税金[（一+二+三+四）*费率] | C15: 1468670 | F15: 1447134 | G15: =(R[-9]C+R[-8]C+R[-5]C+R[-4]C)*3.577% -> 32364.169490638997
A16: 六 | B16: 总报价（一+二+三+四+五） | C16: 42527366 | F16: 41923946 | G16: =R[-1]C+R[-5]C+R[-6]C+R[-9]C+R[-10]C -> 937149.45019063901
A17: 总报价(大写) | B17: =R[-1]C[5] -> 937149.45019063901 | H17: 元整
B20: 项目经理： | C20: 日期： | F20: 监理审核人： | H20: 日期：

Sheet: 3#病房楼
A1: 表1-1-2 单位工程报价汇总表
A2: 建设单位和工程名称：杭州市中医院丁桥分院工程
A3: 单位工程名称：3#病房楼
B4: 内容 | C4: 报价合计 (元) | D4: 累计完成百分比 | E4: 至上期末累计完成 | F4: 至上期末监理审核完成（元） | G4: 本期完成 (元) | J4: 本期监理审核（元）
G5: 建筑工程 | H5: 安装工程 | I5: 合计 | J5: 建筑工程 | K5: 安装工程 | L5: 合计
A6: 一 | B6: 分部分项工程量清单 | C6: 11745594 | D6: =(RC[2]+RC[8])/RC[-1] -> 0.53766987008064471 | E6: =RC[1]+RC[2] -> 6850517 | F6: =5048365+867487 -> 5915852 | G6: 934665 | J6: 399400 | K6: 0 | L6: =RC[-2]+RC[-1] -> 399400 | M6: =(RC[-3])/RC[-10] -> 3.4004240228293264E-2
A7: 二 | B7: 措施项目清单（1+2） | C7: 3190564 | D7: =(RC[2]+RC[8])/RC[-1] -> 0.86175767043068252 | E7: =RC[1]+RC[2] -> 3118678 | F7: =2049834+461694 -> 2511528 | G7: 607150 | J7: =R[2]C -> 237965 | K7: 0 | L7: =R[2]C -> 237965 | M7: =(R[-1]C[-6])/R[-1]C[-10] -> 7.9575796677460495E-2
A8: 1 | B8: 组织措施项目清单
A9: 2 | B9: 技术措施项目清单 | C9: 3190564 | D9: =(RC[2]+RC[8])/RC[-1] -> 0.86175767043068252 | E9: =RC[1]+RC[2] -> 3118678 | F9: =R[-2]C -> 2511528 | G9: =R[-2]C -> 607150 | J9: 237965 | K9: 0 | L9: =RC[-2] -> 237965
A10: 三 | B10: 其他项目清单
A11: 四 | B11: 规费[3+4+5] | C11: 534153 | D11: =(RC[2]+RC[6])/RC[-1] -> 0.53766886349663223 | E11: =RC[1]+RC[2] -> 311942.29110322107 | F11: 269034 | G11: =R[1]C+R[2]C+R[3]C -> 42908.291103221083 | J11: =R[1]C+R[3]C -> 18163.436443316554
A12: 3 | B12: 排污费、社保费、公积金 | C12: 516536 | D12: =(RC[2]+RC[6])/RC[-1] -> 0.53766987008064471 | E12: =RC[1]+RC[2] -> 301264.76371258876 | F12: 260161 | G12: =RC[-4]*R[-5]C[6] -> 41103.763712588734 | J12: =RC[-7]*RC[3]-RC[-4] -> 17564.844011975918 | M12: =(R[-6]C[-1]+R[-6]C[-7])/R[-6]C[-10] -> 0.53766987008064471
A13: 4 | B13: 危险作业意外伤害保险费
A14: 5 | B14: 民工工伤保险费[（一+二+三+3+4）*费 率] | C14: 17616 | D14: =(RC[2]+RC[6])/RC[-1] -> 0.53766987008064471 | E14: =RC[1]+RC[2] -> 10677.527390632351 | F14: 8873 | G14: =(R[-8]C+R[-7]C+R[-4]C+R[-2]C)*0.114% -> 1804.5273906323509 | J14: =RC[-7]*R[-2]C[3]-RC[-4] -> 598.59243134063763
A15: 五 | B15: 税金[（一+二+三+四）*费率] | C15: 553373 | D15: =(RC[2]+RC[6])/RC[-1] -> 0.53766987008064471 | E15: =RC[1]+RC[2] -> 335400.55212276219 | F15: 278715 | G15: =(R[-9]C+R[-8]C+R[-5]C+R[-4]C)*3.577% -> 56685.552122762208 | J15: =RC[-7]*R[-3]C[3]-RC[-4] -> 18816.98901613662
A16: 六 | B16: 总报价（一+二+三+四+五） | C16: 16023684 | D16: =(RC[2]+RC[6])/RC[-1] -> 0.59813220389639821 | E16: =RC[1]+RC[2] -> 10551344.843225984 | F16: 8909936 | G16: =R[-1]C+R[-5]C+R[-6]C+R[-9]C+R[-10]C -> 1641408.8432259834 | J16: =R[-10]C[2]+R[-9]C[2]+R[-5]C+R[-1]C -> 674345.42545945314
A17: 总报价(大写)： | C17: =R[-1]C[4] -> 1641408.8432259834 | J17: 元整
B19: 项目经理： | C19: 日期： | F19: 监理审核人： | H19: 日期：

Sheet: 2#病房楼
A1: 表1-1-2 单位工程报价汇总表
A2: 工程名称：杭州市中医院丁桥分院工程
A3: 单位工程名称：2#病房楼
B4: 内容 | C4: 报价合计 (元) | D4: 累计完成百分比 | E4: 至上期末累计完成 | F4: 至上期末监理审核完成（元） | G4: 本期完成 (元) | J4: 本期监理审核（元）
G5: 建筑工程 | H5: 安装工程 | I5: 合计 | J5: 建筑工程 | K5: 安装工程 | L5: 合计
A6: 一 | B6: 分部分项工程量清单 | C6: 11972843 | D6: =(RC[2]+RC[8])/RC[-1] -> 0.48310630983802261 | E6: =RC[1]+RC[2] -> 6498006 | F6: =2774830+769088+979894+723524 -> 5247336 | G6: 1250670 | J6: 536820 | K6: 0 | L6: =RC[-2] -> 536820 | M6: =(RC[-3])/RC[-10] -> 4.4836468664961195E-2
A7: 二 | B7: 措施项目清单（1+2） | C7: 3202770 | D7: =(RC[2]+RC[8])/RC[-1] -> 0.80790815450375764 | E7: =RC[1]+RC[2] -> 3053526 | F7: =1962140+351511 -> 2313651 | G7: 739875 | J7: =R[2]C -> 273893 | K7: 0 | L7: =RC[-2] -> 273893 | M7: =(R[-1]C[-6])/R[-1]C[-10] -> 0.1044588991937838
A8: 1 | B8: 组织措施项目清单
A9: 2 | B9: 技术措施项目清单 | C9: 3202770 | D9: =(RC[2]+RC[8])/RC[-1] -> 0.80790815450375764 | E9: =RC[1]+RC[2] -> 3053526 | F9: =R[-2]C -> 2313651 | G9: =R[-2]C -> 739875 | J9: 273893 | K9: 0 | L9: =RC[-2] -> 273893
A10: 三 | B10: 其他项目清单
A11: 四 | B11: 规费[3+4+5] | C11: 548057 | D11: =(RC[2]+RC[6])/RC[-1] -> 0.48310914367886371 | E11: =RC[1]+RC[2] -> 297909.84237089613 | F11: 240198.29 | G11: =R[1]C+R[2]C+R[3]C -> 57711.552370896148 | J11: =R[1]C+R[3]C -> 24573.057957206987 | M11: =(R[-5]C[-1]+R[-5]C[-7])/R[-5]C[-10] -> 0.48310630983802261
A12: 3 | B12: 排污费、社保费、公积金 | C12: 530153 | D12: =(RC[2]+RC[6])/RC[-1] -> 0.48310630983802261 | E12: =RC[1]+RC[2] -> 287729.19878428208 | F12: 232350 | G12: =RC[-4]*R[-5]C[6] -> 55379.198784282067 | J12: =RC[-7]*R[-1]C[3]-RC[-4] -> 23770.259479557193
A13: 4 | B13: 危险作业意外伤害保险费
A14: 5 | B14: 民工工伤保险费[（一+二+三+3+4）*费率] | C14: 17905 | D14: =(RC[2]+RC[6])/RC[-1] -> 0.48310630983802266 | E14: =RC[1]+RC[2] -> 10179.573586614082 | F14: 7847.22 | G14: =(R[-8]C+R[-7]C+R[-4]C+R[-2]C)*0.114% -> 2332.3535866140815 | J14: =RC[-7]*R[-3]C[3]-RC[-4] -> 802.79847764979513
A15: 五 | B15: 税金[（一+二+三+四）*费率] | C15: 562436 | D15: =(RC[2]+RC[6])/RC[-1] -> 0.48310630983802261 | E15: =RC[1]+RC[2] -> 319764.87687830697 | F15: 246498.74 | G15: =(R[-9]C+R[-8]C+R[-5]C+R[-4]C)*3.577% -> 73266.136878306948 | J15: =RC[-7]*R[-4]C[3]-RC[-4] -> 25217.640480058093
A16: 六 | B16: 总报价（一+二+三+四+五） | C16: 16286106 | D16: =(RC[2]+RC[6])/RC[-1] -> 0.54698082699678274 | E16: 0 | F16: =R[-10]C+R[-9]C+R[-5]C+R[-1]C -> 8047684.0300000003 | G16: =R[-1]C+R[-5]C+R[-6]C+R[-9]C+R[-10]C -> 2121522.6892492031 | J16: =R[-10]C[2]+R[-9]C[2]+R[-5]C+R[-1]C -> 860503.69843726512
A17: 总报价(大写)： | C17: =R[-1]C[4] -> 2121522.6892492031 | J17: 元整
B19: 项目经理： | D19: 日期： | H19: 监理审核人： | J19: 日期：

Sheet: 1#病房楼
A1: 表1-1-2 单位工程报价汇总表
A2: 工程名称：杭州市中医院丁桥分院工程
A3: 单位工程名称：1#病房楼
B4: 内容 | C4: 报价合计 (元) | D4: 累计完成百分比 | E4: 至上期末累计完成 | F4: 至上期末监理审核完成（元） | G4: 本期完成 (元) | J4: 本期监理审核（元）
G5: 建筑工程 | H5: 安装工程 | I5: 合计 | J5: 建筑工程 | K5: 安装工程 | L5: 合计
A6: 一 | B6: 分部分项工程量清单 | C6: 12173652 | D6: =(RC[2]+RC[8])/RC[-1] -> 0.46876459093787137 | E6: =RC[1]+RC[2] -> 6276642 | F6: =1496833+1037896+1028054+1275019 -> 4837802 | G6: 1438840 | J6: 868775 | K6: 0 | L6: =RC[-2] -> 868775 | N6: =(RC[-4])/RC[-11] -> 7.1365190987881036E-2
A7: 二 | B7: 措施项目清单（1+2） | C7: 3215349 | D7: =(RC[2]+RC[8])/RC[-1] -> 0.81223624558329433 | E7: =RC[1]+RC[2] -> 2847506 | F7: =641079+385264+575846+432801 -> 2034990 | G7: 812516 | J7: =R[2]C -> 576633 | K7: 0 | L7: =RC[-2] -> 576633 | N7: =(R[-1]C[-7])/R[-1]C[-11] -> 0.11819296296624875
A8: 1 | B8: 组织措施项目清单
A9: 2 | B9: 技术措施项目清单 | C9: 3215349 | D9: =(RC[2]+RC[8])/RC[-1] -> 0.81223624558329433 | E9: =RC[1]+RC[2] -> 2847506 | F9: =R[-2]C -> 2034990 | G9: =R[-2]C -> 812516 | J9: 576633 | K9: 0 | L9: =RC[-2] -> 576633
A10: 三 | B10: 其他项目清单
A11: 四 | B11: 规费[3+4+5] | C11: 554566 | D11: =(RC[2]+RC[6])/RC[-1] -> 0.46876677282424739 | E11: =RC[1]+RC[2] -> 286423.82730391022 | F11: 220385 | G11: =R[1]C+R[2]C+R[3]C -> 66038.827303910221 | J11: =R[1]C+R[3]C -> 39577.114138051576
A12: 3 | B12: 排污费、社保费、公积金 | C12: 536411 | D12: =(RC[2]+RC[6])/RC[-1] -> 0.46876459093787137 | E12: =RC[1]+RC[2] -> 276569.00545768847 | F12: 213169 | G12: =RC[-4]*R[-5]C[7] -> 63400.005457688458 | J12: =RC[-7]*RC[4]-RC[-4] -> 38281.482989574521 | N12: =(R[-6]C[-2]+R[-6]C[-8])/R[-6]C[-11] -> 0.46876459093787137
A13: 4 | B13: 危险作业意外伤害保险费
A14: 5 | B14: 民工工伤保险费[（一+二+三+3+4）*费 率] | C14: 18155 | D14: =(RC[2]+RC[6])/RC[-1] -> 0.46876459093787137 | E14: =RC[1]+RC[2] -> 9853.6118462217655 | F14: 7214.79 | G14: =(R[-8]C+R[-7]C+R[-4]C+R[-2]C)*0.114% -> 2638.8218462217651 | J14: =RC[-7]*R[-2]C[4]-RC[-4] -> 1295.6311484770549
A15: 五 | B15: 税金[（一+二+三+四）*费率] | C15: 570301 | D15: =(RC[2]+RC[6])/RC[-1] -> 0.46876459093787137 | E15: =RC[1]+RC[2] -> 309530.21297266084 | F15: 226637 | G15: =(R[-9]C+R[-8]C+R[-5]C+R[-4]C)*3.577% -> 82893.212972660855 | J15: =RC[-7]*R[-3]C[4]-RC[-4] -> 40699.914976458997
A16: 六 | B16: 总报价（一+二+三+四+五） | C16: 16513869 | D16: =(RC[2]+RC[6])/RC[-1] -> 0.53564061996098622 | E16: =RC[1]+RC[2] -> 9720102.0402765721 | F16: 7319814 | G16: =R[-1]C+R[-5]C+R[-6]C+R[-9]C+R[-10]C -> 2400288.0402765712 | J16: =R[-10]C[2]+R[-9]C[2]+R[-5]C+R[-1]C -> 1525685.0291145106
A17: 总报价(大写)： | C17: =R[-1]C[4] -> 2400288.0402765712 | J17: 元整
B19: 项目经理： | D19: 日期： | H19: 监理审核人： | J19: 日期：

Sheet: 地下室汇总表
A1: 表1-1-2 单位工程报价汇总表
A2: 建设单位和工程名称：杭州市中医院丁桥分院工程
A3: 单位工程名称：地下室
B4: 内容 | C4: 报价合计 (元) | D4: 累计完成百分比 | E4: 至上期末累计完成（元） | F4: 至上期末监理审核完成（元） | G4: 本期完成 (元) | J4: 本期监理审核（元）
G5: 建筑工程 | H5: 安装工程 | I5: 合计 | J5: 建筑工程 | K5: 安装工程 | L5: 合计
A6: 一 | B6: 分部分项工程量清单 | C6: 133067926 | D6: =(RC[2]+RC[8])/RC[-1] -> 0.66340080328598494 | E6: =RC[1]+RC[2] -> 88510974 | F6: =86723647+388869+269420+420464 -> 87802400 | G6: 708574 | J6: 474969 | K6: 0 | L6: =RC[-2]+RC[-1] -> 474969 | N6: =(RC[-4])/RC[-11] -> 3.5693725323411142E-3
A7: 二 | B7: 措施项目清单（1+2） | C7: 8059041 | D7: =(RC[2]+RC[8])/RC[-1] -> 0.86811023793029474 | E7: =RC[2]+RC[1] -> 8092973 | F7: =6154936+332500+485700+10000 -> 6983136 | G7: 1109837 | J7: 13000 | K7: 0 | L7: =RC[-2]+RC[-1] -> 13000 | N7: =(R[-1]C[-7])/R[-1]C[-11] -> 5.3249045153074678E-3
A8: 1 | B8: 组织措施项目清单
A9: 2 | B9: 技术措施项目清单 | C9: 8059041 | D9: =(RC[2]+RC[8])/RC[-1] -> 0.86811023793029474 | E9: =RC[2]+RC[1] -> 8092973 | F9: =R[-2]C -> 6983136 | G9: =R[-2]C -> 1109837 | J9: 13000 | K9: 0 | L9: =RC[-2] -> 13000
A10: 三 | B10: 其他项目清单
A11: 四 | B11: 规费[3+4+5] | C11: 3178583 | D11: =(RC[2]+RC[6])/RC[-1] -> 0.66248813245121352 | E11: =RC[2]+RC[1] -> 2112569.9436234804 | F11: 2094428 | G11: =R[1]C+R[2]C+R[3]C -> 18141.943623480613 | J11: =R[1]C+R[3]C -> 11345.515511175763 | N11: =(R[-5]C[-2]+R[-5]C[-8])/R[-5]C[-11] -> 0.66340080328598494
A12: 3 | B12: 排污费、社保费、公积金 | C12: 3014262 | D12: =(RC[2]+RC[6])/RC[-1] -> 0.66340080328598494 | E12: =RC[2]+RC[1] -> 2004955.6573341198 | F12: 1988905 | G12: =RC[-4]*R[-5]C[7] -> 16050.657334119718 | J12: =RC[-7]*R[-1]C[4]-RC[-4] -> 10758.832114419434
A13: 4 | B13: 危险作业意外伤害保险费
A14: 5 | B14: 民工工伤保险费[（一+二+三+3+4）*费率] | C14: 164321 | D14: =(RC[2]+RC[6])/RC[-1] -> 0.66340080328598494 | E14: =RC[2]+RC[1] -> 110515.2862893609 | F14: 108424 | G14: =(R[-8]C+R[-7]C+R[-4]C+R[-2]C)*0.114% -> 2091.2862893608963 | J14: =RC[-7]*R[-3]C[4]-RC[-4] -> 586.68339675632888
A15: 五 | B15: 税金[（一+二+三+四）*费率] | C15: 5161810 | D15: =(RC[2]+RC[6])/RC[-1] -> 0.66340080328598494 | E15: =RC[2]+RC[1] -> 3471617.498793412 | F15: 3405924 | G15: =(R[-9]C+R[-8]C+R[-5]C+R[-4]C)*3.577% -> 65693.498793411898 | J15: =RC[-7]*R[-4]C[4]-RC[-4] -> 18424.900409630034
A16: 六 | B16: 总报价（一+二+三+四+五） | C16: 149467359 | D16: =(RC[2]+RC[6])/RC[-1] -> 0.67428520909318279 | F16: 100265890 | G16: =R[-1]C+R[-5]C+R[-6]C+R[-9]C+R[-10]C -> 1902246.4424168924 | J16: =R[-10]C[2]+R[-9]C[2]+R[-5]C+R[-1]C -> 517739.41592080577
A17: 总报价(大写)： | C17: =R[-1]C[4] -> 1902246.4424168924 | J17: 元整
B20: 项目经理： | D20: 日期： | H20: 监理审核人： | J20: 日期：

Sheet: 行政科研楼
A1: 表1-1-2 单位工程报价汇总表
A2: 工程名称：杭州市中医院丁桥分院工程
A3: 单位工程名称：行政科研楼
B4: 内容 | C4: 报价合计 (元) | D4: 累计完成百分比 | E4: 至上期末累计完成 | F4: 至上期末监理审核完成（元） | G4: 本期完成(元) | J4: 本期监理审核（元）
G5: 建筑工程 | H5: 安装工程 | I5: 合计 | J5: 建筑工程 | K5: 安装工程 | L5: 合计
A6: 一 | B6: 分部分项工程量清单 | C6: 11844594 | D6: =(RC[2]+RC[8])/RC[-1] -> 0.51909098783799601 | E6: =RC[1]+RC[2] -> 6571942 | F6: =2806931+1067407+920310+604874 -> 5399522 | G6: 1172420 | J6: 748900 | K6: 0 | L6: =RC[-2] -> 748900 | M6: =RC[-3]/RC[-10] -> 6.3227156625208086E-2
A7: 二 | B7: 措施项目清单（1+2） | C7: 3214549 | D7: =(RC[2]+RC[8])/RC[-1] -> 0.88806516870640329 | E7: =RC[1]+RC[2] -> 3018759 | F7: =1279390+297252+709940+188257 -> 2474839 | G7: 543920 | J7: 379890 | K7: 0 | L7: =RC[-2] -> 379890 | M7: =(R[-1]C[-6])/R[-1]C[-10] -> 9.8983553172020927E-2
A8: 1 | B8: 组织措施项目清单
A9: 2 | B9: 技术措施项目清单 | C9: 3214549 | D9: =(RC[2]+RC[8])/RC[-1] -> 0.88806516870640329 | E9: =RC[1]+RC[2] -> 3018759 | F9: =R[-2]C -> 2474839 | G9: =R[-2]C -> 543920 | J9: 379890 | K9: 0 | L9: =RC[-2] -> 379890
A10: 三 | B10: 其他项目清单
A11: 四 | B11: 规费[3+4+5] | C11: 526031 | D11: =(RC[2]+RC[6])/RC[-1] -> 0.51909288886664273 | E11: =RC[1]+RC[2] -> 292124.73934271565 | F11: 239799 | G11: =R[1]C+R[2]C+R[3]C -> 52325.739342715635 | J11: =R[1]C+R[3]C -> 33259.9514234089 | M11: =(R[-5]C[-1]+R[-5]C[-7])/R[-5]C[-10] -> 0.51909098783799601
A12: 3 | B12: 排污费、社保费、公积金 | C12: 508284 | D12: =(RC[2]+RC[6])/RC[-1] -> 0.51909098783799601 | E12: =RC[1]+RC[2] -> 282019.75634048751 | F12: 231708 | G12: =RC[-4]*R[-5]C[6] -> 50311.756340487482 | J12: =RC[-7]*R[-1]C[3]-RC[-4] -> 32137.643662247981
A13: 4 | B13: 危险作业意外伤害保险费
A14: 5 | B14: 民工工伤保险费[（一+二+三+3+4）*费率] | C14: 17747 | D14: =(RC[2]+RC[6])/RC[-1] -> 0.51909098783799601 | E14: =RC[1]+RC[2] -> 10103.983002228155 | F14: 8090 | G14: =(R[-8]C+R[-7]C+R[-4]C+R[-2]C)*0.114% -> 2013.9830022281556 | J14: =RC[-7]*R[-3]C[3]-RC[-4] -> 1122.3077611609151
A15: 五 | B15: 税金[（一+二+三+四）*费率] | C15: 557482 | D15: =(RC[2]+RC[6])/RC[-1] -> 0.51909098783799601 | E15: =RC[1]+RC[2] -> 317401.17349628895 | F15: 254136 | G15: =(R[-9]C+R[-8]C+R[-5]C+R[-4]C)*3.577% -> 63265.173496288931 | J15: =RC[-7]*R[-4]C[3]-RC[-4] -> 35247.882081901713
A16: 六 | B16: 总报价（一+二+三+四+五） | C16: 16142655 | D16: =(RC[2]+RC[6])/RC[-1] -> 0.58949620328906926 | E16: =RC[1]+RC[2] -> 10150666.912839005 | F16: 8318736 | G16: =R[-1]C+R[-5]C+R[-6]C+R[-9]C+R[-10]C -> 1831930.9128390045 | J16: =R[-10]C[2]+R[-9]C[2]+R[-5]C+R[-1]C -> 1197297.8335053106
A17: 总报价(大写)： | C17: =R[-1]C[4] -> 1831930.9128390045 | J17: 元整
B19: 项目经理： | D19: 日期： | H19: 监理审核人： | J19: 日期：

Sheet: 门诊医技楼
A1: 表1-1-2 单位工程报价汇总表
A2: 建设单位和工程名称：杭州市中医院丁桥分院工程
A3: 单位工程名称：门诊医技楼
B4: 内容 | C4: 报价合计 (元) | D4: 累计完成百分比 | E4: 至上期末累计完成 | F4: 至上期末监理审核完成（元） | G4: 本期完成 (元) | H4: 本期监理审核（元）
A6: 一 | B6: 分部分项工程量清单 | C6: 42468641 | D6: =(RC[2]+RC[4])/RC[-1] -> 0.35937342567660691 | E6: =RC[1] -> 14496914 | F6: =13359551+1137363 -> 14496914 | G6: 1632488 | H6: 765187 | K6: =(RC[-3])/RC[-8] -> 1.8017694514877461E-2
A7: 二 | B7: 措施项目清单（1+2） | C7: 7448752 | D7: =(RC[2]+RC[4])/RC[-1] -> 0.87789994887734213 | E7: 3378273 | F7: =4772843+1028545 -> 5801388 | G7: 702882 | H7: 737871 | K7: =(R[-1]C[-4])/R[-1]C[-8] -> 3.8439845532142178E-2
A8: 1 | B8: 组织措施项目清单
A9: 2 | B9: 技术措施项目清单 | C9: 7448752 | D9: =(RC[2]+RC[4])/RC[-1] -> 0.87789994887734213 | E9: =R[-2]C -> 3378273 | F9: =R[-2]C -> 5801388 | G9: =R[-2]C -> 702882 | H9: 737871
A10: 三 | B10: 其他项目清单
A11: 四 | B11: 规费[3+4+5] | C11: 1586597 | D11: =(RC[2]+RC[4])/RC[-1] -> 0.35937342567660691 | E11: =R[1]C+R[3]C -> 200686 | F11: 541594 | G11: =R[1]C+R[2]C+R[3]C -> 61463.40224182784 | H11: =R[1]C+R[3]C -> 28586.799058227505
A12: 3 | B12: 排污费、社保费、公积金 | C12: 1527949 | D12: =(RC[2]+RC[4])/RC[-1] -> 0.35937342567660691 | E12: 186378 | F12: 521574 | G12: =RC[-4]*R[-5]C[4] -> 58734.12354099111 | H12: =RC[-5]*RC[3]-RC[-2] -> 27530.266389145865 | K12: =(R[-6]C[-3]+R[-6]C[-5])/R[-6]C[-8] -> 0.35937342567660691
A13: 4 | B13: 危险作业意外伤害保险费
A14: 5 | B14: 民工工伤保险费[（一+二+三+3+4）*费率] | C14: 58648 | D14: =(RC[2]+RC[4])/RC[-1] -> 0.35937342567660685 | E14: 14308 | F14: 20020 | G14: =(R[-8]C+R[-7]C+R[-4]C+R[-2]C)*0.114% -> 2729.2787008367295 | H14: =RC[-5]*R[-2]C[3]-RC[-2] -> 1056.5326690816401
A15: 五 | B15: 税金[（一+二+三+四）*费率] | C15: 1842298 | D15: =(RC[2]+RC[4])/RC[-1] -> 0.35937342567660691 | E15: 0 | F15: 1246476 | G15: =(R[-9]C+R[-8]C+R[-5]C+R[-4]C)*3.577% -> 85734.730798190169 | H15: =RC[-5]*R[-3]C[3]-RC[-2] -> -584403.05662283849
A16: 六 | B16: 总报价（一+二+三+四+五） | C16: 53346288 | D16: =(RC[2]+RC[4])/RC[-1] -> 0.43177537943099975 | E16: =R[-1]C+R[-5]C+R[-6]C+R[-9]C+R[-10]C -> 18075873 | F16: 22086372 | G16: =R[-1]C+R[-5]C+R[-6]C+R[-9]C+R[-10]C -> 2482568.1330400179 | H16: =R[-10]C+R[-9]C+R[-5]C+R[-1]C -> 947241.74243538908
A17: 总报价(大写)： | C17: =R[-1]C[4] -> 2482568.1330400179 | H17: 元整
A19: 项目经理： | C19: 日期： | E19: 监理审核人： | G19: 日期：

Sheet: 后勤服务楼
A1: 表1-1-2 单位工程报价汇总表
A2: 建设单位和工程名称：杭州市中医院丁桥分院工程
A3: 单位工程名称：后勤服务楼
B4: 内容 | C4: 报价合计 (元) | D4: 累计完成百分比 | E4: 至上期末累计完成 | F4: 至上期末监理审核完成（元） | G4: 本期完成 (元) | H4: 本期监理审核（元）
A6: 一 | B6: 分部分项工程量清单 | C6: 2903256 | D6: =(RC[3]+RC[2])/RC[-1] -> 0.38569178880539645 | E6: 559664 | F6: 559664 | G6: 560098 | H6: 525747 | K6: =(RC[-3])/RC[-8] -> 0.18108875001033323
A7: 二 | B7: 措施项目清单（1+2） | C7: 466807 | D7: =RC[3]/RC[-1] -> 0.55456109269998088 | E7: =R[2]C -> 284275 | F7: =R[2]C -> 284275 | G7: 258873 | H7: 75047 | K7: =(R[-1]C[-4])/R[-1]C[-8] -> 0.19292063806980853
A8: 1 | B8: 组织措施项目清单
A9: 2 | B9: 技术措施项目清单 | C9: 466807 | D9: =RC[3]/RC[-1] -> 0.66997924195652592 | E9: 284275 | F9: 284275 | G9: 312751 | H9: =R[-2]C -> 75047
A10: 三 | B10: 其他项目清单
A11: 四 | B11: 规费[3+4+5] | C11: 96231 | E11: 18551 | F11: 18551 | G11: =R[1]C+R[2]C+R[3]C -> 18757.411080140755 | H11: =R[1]C+R[3]C -> 17425.912108680739
A12: 3 | B12: 排污费、社保费、公积金 | C12: 92284 | E12: 17790 | F12: 17790 | G12: =RC[-4]*R[-5]C[4] -> 17803.488163634211 | H12: =RC[-5]*RC[3]-RC[-2] -> 16711.287080436588 | K12: =(R[-6]C[-3]+R[-6]C[-5])/R[-6]C[-8] -> 0.37385990074592113
A13: 4 | B13: 危险作业意外伤害保险费
A14: 5 | B14: 民工工伤保险费[（一+二+三+3+4）*费 率] | C14: 3947 | D14: =RC[3]/RC[-1] -> 0.24168302926438889 | E14: 761 | F14: 761 | G14: =(R[-8]C+R[-7]C+R[-4]C+R[-2]C)*0.114% -> 953.92291650654295 | H14: =R[-2]C[3]*RC[-5]-RC[-2] -> 714.6250282441506
A15: 五 | B15: 税金[（一+二+三+四）*费率] | C15: 123989 | D15: =RC[3]/RC[-1] -> 0.24167906237115092 | E15: 23902 | F15: 23902 | G15: =(R[-9]C+R[-8]C+R[-5]C+R[-4]C)*3.577% -> 29965.54526433663 | H15: =R[-3]C[3]*RC[-5]-RC[-2] -> 22452.515233586011
A16: 六 | B16: 总报价（一+二+三+四+五） | C16: 3590283 | E16: =R[-10]C+R[-9]C+R[-5]C+R[-1]C -> 886392 | F16: 886391 | G16: =R[-1]C+R[-5]C+R[-6]C+R[-9]C+R[-10]C -> 867693.95634447737 | H16: =R[-10]C+R[-9]C+R[-5]C+R[-1]C -> 640672.42734226666
A17: 总报价(大写)： | C17: =R[-1]C[4] -> 867693.95634447737 | H17: 元整
A19: 项目经理： | C19: 日期： | E19: 监理审核人： | G19: 日期：

Sheet: 高压氧仓楼
A1: 表1-1-2 单位工程报价汇总表
A2: 建设单位和工程名称：杭州市中医院丁桥分院工程
A3: 单位工程名称：高压氧仓楼
B4: 内容 | C4: 报价合计 (元) | D4: 累计完成百分比 | E4: 至上期末累计完成 | F4: 至上期末监理审核完成（元） | G4: 本期完成 (元) | H4: 本期监理审核（元）
A6: 一 | B6: 分部分项工程量清单 | C6: 486995 | D6: =(RC[3]+RC[2])/RC[-1] -> 0.50845285885892055 | E6: 0 | F6: 183810 | G6: 63804 | H6: 63805 | K6: =(RC[-3])/RC[-8] -> 0.13101777225638866
A7: 二 | B7: 措施项目清单（1+2） | C7: 88936 | D7: =RC[3]/RC[-1] -> 0.22142889268687596 | E7: =R[2]C -> 0 | F7: =R[2]C -> 68751 | G7: =R[2]C -> 19693 | H7: =R[1]C+R[2]C -> 10778 | K7: =(R[-1]C[-4])/R[-1]C[-8] -> 0.13101571884721608
A8: 1 | B8: 组织措施项目清单
A9: 2 | B9: 技术措施项目清单 | C9: 88936 | D9: =RC[3]/RC[-1] -> 0.22142889268687596 | E9: 0 | F9: 68751 | G9: 19693 | H9: 10778
A10: 三 | B10: 其他项目清单
A11: 四 | B11: 规费[3+4+5] | C11: 18441 | E11: 0 | F11: 6960 | G11: =R[1]C+R[2]C+R[3]C -> 2425.2030036836927 | H11: =R[1]C+R[3]C -> 2415.4170371359055
A12: 3 | B12: 排污费、社保费、公积金 | C12: 17764 | E12: 0 | F12: 6705 | G12: =RC[-4]*R[-5]C[4] -> 2327.3632296019464 | H12: =RC[3]*RC[-5]-RC[-2] -> 2327.1930615304063 | K12: =(R[-6]C[-3]+R[-6]C[-5])/R[-6]C[-8] -> 0.50845491226809314
A13: 4 | B13: 危险作业意外伤害保险费
A14: 5 | B14: 民工工伤保险费[（一+二+三+3+4）*费 率] | C14: 677 | D14: =RC[3]/RC[-1] -> 0.14451960721085114 | E14: 0 | F14: 256 | G14: =(R[-8]C+R[-7]C+R[-4]C+R[-2]C)*0.114% -> 97.839774081746214 | H14: =R[-2]C[3]*RC[-5]-RC[-2] -> 88.223975605499049
A15: 五 | B15: 税金[（一+二+三+四）*费率] | C15: 21261 | D15: =RC[3]/RC[-1] -> 0.14455750912194937 | E15: 0 | F15: 8025 | G15: =(R[-9]C+R[-8]C+R[-5]C+R[-4]C)*3.577% -> 3073.4372014417654 | H15: =R[-3]C[3]*RC[-5]-RC[-2] -> 2785.2598897319276
A16: 六 | B16: 总报价（一+二+三+四+五） | C16: 615632 | E16: =R[-1]C+R[-5]C+R[-6]C+R[-9]C+R[-10]C -> 0 | F16: 267546 | G16: =R[-1]C+R[-5]C+R[-6]C+R[-9]C+R[-10]C -> 88995.640205125455 | H16: =R[-10]C+R[-9]C+R[-5]C+R[-1]C -> 79783.676926867833
A17: 总报价(大写)： | C17: =R[-1]C[4] -> 88995.640205125455 | H17: 元整

Sheet: 发热门诊楼
A1: 表1-1-2 单位工程报价汇总表
A2: 建设单位和工程名称：杭州市中医院丁桥分院工程
A3: 单位工程名称：发热门诊楼
B4: 内容 | C4: 报价合计 (元) | D4: 累计完成百分比 | E4: 至上期末累计完成 | F4: 至上期末监理审核完成（元） | G4: 本期完成 (元) | H4: 本期监理审核（元）
A6: 一 | B6: 分部分项工程量清单 | C6: 1294892 | D6: =(RC[3]+RC[2])/RC[-1] -> 4.3976640522916194E-2 | E6: 0 | F6: 0 | G6: 56945 | H6: 45810 | K6: =(RC[-5]+RC[-3])/RC[-8] -> 3.5377467773374152E-2
A7: 二 | B7: 措施项目清单（1+2） | C7: 167124 | D7: =RC[3]/RC[-1] -> 7.8444747612551158E-2 | E7: 0 | F7: 0 | G7: 13110 | H7: =R[2]C -> 13110 | K7: =(R[-1]C[-4])/R[-1]C[-8] -> 4.3976640522916194E-2
A8: 1 | B8: 组织措施项目清单
A9: 2 | B9: 技术措施项目清单 | C9: 167124 | D9: =RC[3]/RC[-1] -> 7.8444747612551158E-2 | E9: 0 | F9: 0 | G9: 13110 | H9: 13110
A10: 三 | B10: 其他项目清单
A11: 四 | B11: 规费[3+4+5] | C11: 49525 | E11: 0 | F11: 0 | G11: =R[1]C+R[2]C+R[3]C -> 2184.5185991863414 | H11: =R[1]C+R[3]C -> 1752.069091476355
A12: 3 | B12: 排污费、社保费、公积金 | C12: 47804 | E12: 0 | F12: 0 | G12: =RC[-4]*R[-5]C[4] -> 2102.2593235574859 | H12: =RC[3]*RC[-5] -> 1691.1844694383781 | K12: =R[-6]C[-3]/R[-6]C[-8] -> 3.5377467773374152E-2
A13: 4 | B13: 危险作业意外伤害保险费
A14: 5 | B14: 民工工伤保险费[（一+二+三+3+4）*费 率] | C14: 1721 | D14: =RC[3]/RC[-1] -> 4.7797371080101993E-2 | E14: 0 | F14: 0 | G14: =(R[-8]C+R[-7]C+R[-4]C+R[-2]C)*0.114% -> 82.259275628855534 | H14: =R[-2]C[3]*RC[-5] -> 60.884622037976918
A15: 五 | B15: 税金[（一+二+三+四）*费率] | C15: 54068 | D15: =RC[3]/RC[-1] -> 4.7791809948451856E-2 | E15: 0 | F15: 0 | G15: =(R[-9]C+R[-8]C+R[-5]C+R[-4]C)*3.577% -> 2584.007580292895 | H15: =R[-3]C[3]*RC[-5] -> 1912.7889275707937
A16: 六 | B16: 总报价（一+二+三+四+五） | C16: 1565609 | E16: 0 | F16: 0 | G16: =R[-1]C+R[-5]C+R[-6]C+R[-9]C+R[-10]C -> 74823.526179479231 | H16: =R[-10]C+R[-9]C+R[-5]C+R[-1]C -> 62584.858019047148
A17: 总报价(大写)： | C17: =R[-1]C[4] -> 74823.526179479231 | H17: 元整