Sheet: 地下室建筑
A2: 表1-2 分部分项工程量清单及计价表( 号清单)
A3: 单位及专业工程名称：地下室-建筑工程
A4: 序号 | B4: 项目编码 | C4: 项目名称 | D4: 项目特征 描述 | E4: 计量 单位 | F4: 清单工程量 | G4: 上报完成工程量 | H4: 至上月累计审核工程量 | I4: 监理审核工程量 | J4: 综合单价 (元) | K4: 合价(元)
K5: 申报合价 | L5: 监理审核
A6: 3 | B6: 010103001004 | C6: 土（石）方回填 | D6: 基础施工时，底层回填所用土方应清 除草皮，树根和垃圾等杂物，在最优 含水量状态下分层夯实，每层填土厚 度一般不大于300，回填土应在结构 施工完成以前进行；压实系数不应小 于0.94；取土回填土方运距自行考虑 | E6: m3 | F6: 5201.47 | G6: 500 | H6: 4701.47 | I6: 500 | J6: 4.41 | K6: =SUM(RC[-4]*RC[-1]) -> 2205 | L6: =RC[-3]*RC[-2] -> 2205
A7: 52 | B7: 010302001046 | C7: 实心砖墙 | D7: 240厚KP5型页岩砖（MU10），M7.5水 泥砂浆砌筑，砌体容重≤14KN/m3 | E7: m3 | F7: 25.14 | G7: 0 | H7: 25.14 | I7: 0 | J7: 390.3 | K7: =SUM(RC[-4]*RC[-1]) -> 0 | L7: =RC[-3]*RC[-2] -> 0
A8: 53 | B8: 010302001047 | C8: 实心砖墙 | D8: 200厚KP5型页岩砖（MU10），M7.5水 泥砂浆砌筑，砌体容重≤14KN/m3 | E8: m3 | F8: 2143.16 | G8: 100 | H8: 2043.16 | I8: 100 | J8: 374.6 | K8: =SUM(RC[-4]*RC[-1]) -> 37460 | L8: =RC[-3]*RC[-2] -> 37460
A9: 54 | B9: 010302001048 | C9: 实心砖墙 | D9: 100厚KP5型页岩砖（MU10），M7.5水 泥砂浆砌筑，砌体容重≤14KN/m3 | E9: m3 | F9: 6.07 | G9: 0 | H9: 6.07 | I9: 0 | J9: 399.87 | K9: =SUM(RC[-4]*RC[-1]) -> 0 | L9: =RC[-3]*RC[-2] -> 0
A10: 55 | B10: 010302001049 | C10: 实心砖墙 | D10: 240厚Mu7.5粘土实心砖，M5.0水泥砂 浆砌筑 | E10: m3 | F10: 41.97 | G10: 41.97 | H10: 0 | I10: 41.97 | J10: 393.7 | K10: =SUM(RC[-4]*RC[-1]) -> 16523.589 | L10: =RC[-3]*RC[-2] -> 16523.589
A11: 56 | B11: 010302001050 | C11: 实心砖墙 | D11: 240厚MU10水 泥实心砖，M7.5水泥砂浆砌筑 | E11: m3 | F11: 50 | G11: 50 | H11: 0 | I11: 50 | J11: 392.86 | K11: =SUM(RC[-4]*RC[-1]) -> 19643 | L11: =RC[-3]*RC[-2] -> 19643
A12: 57 | B12: 010304001001 | C12: 空心砖墙、砌块墙 | D12: （人防结构做法）240厚MU15混凝土 实心砌块，M10水泥砂浆砌筑 | E12: m3 | F12: 29.43 | G12: 29.43 | H12: 0 | I12: 29.43 | J12: 407.96 | K12: =SUM(RC[-4]*RC[-1]) -> 12006.262799999999 | L12: =RC[-3]*RC[-2] -> 12006.262799999999
A13: 58 | B13: 010304001002 | C13: 空心砖墙、砌块墙 | D13: （人防结构做法）200厚MU15混凝土 实心砌块，M10水泥砂浆砌筑 | E13: m3 | F13: 144.38 | G13: 144.38 | H13: 0 | I13: 144.38 | J13: 419.2 | K13: =SUM(RC[-4]*RC[-1]) -> 60524.095999999998 | L13: =RC[-3]*RC[-2] -> 60524.095999999998
A14: 66 | B14: 010401006006 | C14: 垫层 | D14: 1：1：6水泥焦垫层 | E14: m3 | F14: 21.17 | G14: 21.17 | H14: 0 | I14: 21.17 | J14: 279.24 | K14: =SUM(RC[-4]*RC[-1]) -> 5911.5108000000009 | L14: =RC[-3]*RC[-2] -> 5911.5108000000009
A15: 67 | B15: 010401006007 | C15: 垫层 | D15: 汽车坡道C25现浇砼填实 | E15: m3 | F15: 573.77 | G15: 573.77 | H15: 0 | I15: 473.77 | J15: 384.29 | K15: =SUM(RC[-4]*RC[-1]) -> 220494.07330000002 | L15: =RC[-3]*RC[-2] -> 182065.07329999999
A16: 68 | B16: 010401006008 | C16: 垫层 | D16: 自行车坡道C20现浇砼填实 | E16: m3 | F16: 56.69 | G16: 56.69 | H16: 0 | I16: 36.69 | J16: 370.59 | K16: =SUM(RC[-4]*RC[-1]) -> 21008.747099999997 | L16: =RC[-3]*RC[-2] -> 13596.947099999998
A17: 71 | B17: 010402001030 | C17: 矩形柱 | D17: C25现浇砼构造柱 | E17: m3 | F17: 111.7 | G17: 0 | H17: 111.7 | I17: 0 | J17: 473.24 | K17: =SUM(RC[-4]*RC[-1]) -> 0 | L17: =RC[-3]*RC[-2] -> 0
A18: 79 | B18: 010403004011 | C18: 圈梁 | D18: C25现浇砼圈梁 | E18: m3 | F18: 95.14 | G18: 0 | H18: 95.14 | I18: 0 | J18: 422.28 | K18: =SUM(RC[-4]*RC[-1]) -> 0 | L18: =RC[-3]*RC[-2] -> 0
A19: 80 | B19: 010403005010 | C19: 过梁 | D19: C25现浇砼过梁 | E19: m3 | F19: 0.66 | G19: 0 | H19: 0.66 | I19: 0 | J19: 422.28 | K19: =SUM(RC[-4]*RC[-1]) -> 0 | L19: =RC[-3]*RC[-2] -> 0
A20: 82 | B20: 010404001027 | C20: 直形墙 | D20: （外墙）C35现浇砼直形墙；抗裂防 水混凝土，抗渗等级为P6；混凝土中 需掺加 0.9kg/m3的聚丙烯抗裂纤维 | E20: m3 | F20: 1753.32 | G20: 110 | H20: 1643.32 | I20: 0 | J20: 458.19 | K20: =SUM(RC[-4]*RC[-1]) -> 50400.9 | L20: =RC[-3]*RC[-2] -> 0
A21: 83 | B21: 010404001028 | C21: 直形墙 | D21: （人防外墙、防爆波电缆井）C35现 浇砼直形墙；抗渗等级为P6；采用内 掺膨胀剂的补偿收缩混凝土，膨胀剂 性能应满足《混凝土外加剂应用技术 规范》（GB50119-2013），限制膨胀 率大于等于0.022%（水中14d），另 需掺适量的合成纤维 | E21: m3 | F21: 532.44 | G21: 30 | H21: 502.44 | I21: 0 | J21: 488.28 | K21: =SUM(RC[-4]*RC[-1]) -> 14648.4 | L21: =RC[-3]*RC[-2] -> 0
A22: 86 | B22: 010404001031 | C22: 直形墙 | D22: （除外墙、主楼）C35现浇砼直形墙 ；抗渗防裂混凝土，抗渗等级P6 | E22: m3 | F22: 4129.22 | G22: 210 | H22: 3919.22 | I22: 0 | J22: 457.47 | K22: =SUM(RC[-4]*RC[-1]) -> 96068.700000000012 | L22: =RC[-3]*RC[-2] -> 0
A23: 88 | B23: 010404001033 | C23: 直形墙 | D23: （人防内墙）C35现浇砼直形墙；抗 渗等级P6 | E23: m3 | F23: 1126.07 | G23: 70 | H23: 1056.07 | I23: 0 | J23: 457.47 | K23: =SUM(RC[-4]*RC[-1]) -> 32022.9 | L23: =RC[-3]*RC[-2] -> 0
A24: 95 | B24: 010408001003 | C24: 后浇带 | D24: C40现浇砼筏板后浇带；抗裂防水混 凝土，抗渗等级为P6；采用加膨胀剂 的补偿收缩混凝土，混凝土的限制膨 胀率（水中14天）2.0~2.2x10-4,限 制干缩率（水中14天空气中28天）≤ 3.0x10-4。用于补偿收缩混凝土的膨 胀剂掺量不宜大于12%，不宜小于6% ；填充用膨胀混凝土的膨胀剂掺量不 宜大于15%，不宜小于10%；采用补偿 收缩混凝土（每立方混凝土中用45kg 膨胀剂按比例替换胶凝材料） | E24: m3 | F24: 698.78 | G24: 80 | H24: 618.78 | I24: 0 | J24: 483.23 | K24: =SUM(RC[-4]*RC[-1]) -> 38658.400000000001 | L24: =RC[-3]*RC[-2] -> 0
B25: 合计 | K25: =SUM(R[-19]C:R[-1]C) -> 627575.57900000014 | L25: =SUM(R[-19]C:R[-1]C) -> 349935.47899999993
C27: 项目经理： | D27: 日期： | G27: 监理审核人： | J27: 日期：

Sheet: 3#病房楼
A1: 表1-2 分部分项工程量清单及计价表( 号清单)
A2: 单位及专业工程名称：3#病房楼-建筑工程
A3: 序号 | B3: 项目编码 | C3: 项目名称 | D3: 项目特征 描述 | E3: 计量 单位 | F3: 清单工程量 | G3: 上报完成工程量 | H3: 至上月累计审核工程量 | I3: 监理审核工程量 | J3: 综合单价 (元) | K3: 合价(元)
K4: 申报合价 | L4: 监理审核
A5: 1 | B5: 010302001011 | C5: 实心砖墙 | D5: 200厚KP5型页岩砖（MU7.5），M5.0 混合砂浆砌筑，砌体容重≤14KN/m3 | E5: m3 | F5: 2093.33 | G5: 850 | H5: 1243.33 | I5: 550 | J5: 375.18 | K5: =SUM(RC[-4]*RC[-1]) -> 318903 | L5: =RC[-3]*RC[-2] -> 206349 | N5: =RC[-6]+RC[-5] -> 1793.33
A6: 2 | B6: 010302001012 | C6: 实心砖墙 | D6: 100厚KP5型页岩砖（MU7.5），M5.0 水泥砂浆砌筑，砌体容重≤14KN/m3 | E6: m3 | F6: 15.97 | G6: 5.97 | H6: 7.97 | I6: 6 | J6: 400.4 | K6: =SUM(RC[-4]*RC[-1]) -> 2390.3879999999999 | L6: =RC[-3]*RC[-2] -> 2402.3999999999996 | N6: =RC[-6]+RC[-5] -> 13.969999999999999
A7: 3 | B7: 010302001013 | C7: 实心砖墙 | D7: 100厚KP5型页岩砖（MU10），M7.5水 泥砂浆砌筑，砌体容重≤14KN/m3 | E7: m3 | F7: 744.35 | G7: 330 | H7: 414.35 | I7: 330 | J7: 399.87 | K7: =SUM(RC[-4]*RC[-1]) -> 131957.1 | L7: =RC[-3]*RC[-2] -> 131957.1 | N7: =RC[-6]+RC[-5] -> 744.35
A8: 4 | B8: 010302001014 | C8: 实心砖墙 | D8: 240厚KP5型页岩砖（MU10），M7.5水 泥砂浆砌筑，砌体容重≤14KN/m3 | E8: m3 | F8: 750.46 | G8: 250 | H8: 400.46 | I8: 250 | J8: 390.3 | K8: =SUM(RC[-4]*RC[-1]) -> 97575 | L8: =RC[-3]*RC[-2] -> 97575 | N8: =RC[-6]+RC[-5] -> 650.46
A9: 5 | B9: 010302001015 | C9: 实心砖墙 | D9: 200厚KP5型页岩砖（MU10），M7.5水 泥砂浆砌筑，砌体容重≤14KN/m3 | E9: m3 | F9: 81.64 | G9: 40 | H9: 41.64 | I9: 30 | J9: 374.6 | K9: =SUM(RC[-4]*RC[-1]) -> 14984 | L9: =RC[-3]*RC[-2] -> 11238 | N9: =RC[-6]+RC[-5] -> 71.64
A10: 6 | B10: 010402001009 | C10: 矩形柱 | D10: C25现浇砼构造柱 | E10: m3 | F10: 112.83 | G10: 42 | H10: 60.83 | I10: 42 | J10: 473.24 | K10: =SUM(RC[-4]*RC[-1]) -> 19876.080000000002 | L10: =RC[-3]*RC[-2] -> 19876.080000000002 | N10: =RC[-6]+RC[-5] -> 102.83
A11: 12 | B11: 010403004003 | C11: 圈梁 | D11: C25现浇砼圈梁 | E11: m3 | F11: 11.83 | G11: 6 | H11: 5.83 | I11: 6 | J11: 422.28 | K11: =SUM(RC[-4]*RC[-1]) -> 2533.6799999999998 | L11: =RC[-3]*RC[-2] -> 2533.6799999999998 | N11: =RC[-6]+RC[-5] -> 11.83
A12: 13 | B12: 010403005003 | C12: 过梁 | D12: C25现浇砼过梁 | E12: m3 | F12: 24.19 | G12: 12 | H12: 12.19 | I12: 12 | J12: 422.28 | K12: =SUM(RC[-4]*RC[-1]) -> 5067.3599999999997 | L12: =RC[-3]*RC[-2] -> 5067.3599999999997 | N12: =RC[-6]+RC[-5] -> 24.189999999999998
A13: 序号16为2015年12月份工程款中代建单位当期暂扣，至今未予支付，要求当期支付
A14: 16 | B14: 010404001011 | C14: 直形墙 | D14: C35现浇砼直形墙 | E14: m3 | F14: 376.17 | G14: 196.17 | H14: 180 | I14: 0 | J14: 457.47 | K14: =SUM(RC[-4]*RC[-1]) -> 89741.889899999995 | L14: =RC[-3]*RC[-2] -> 0
A15: 21 | B15: 010405003014 | C15: 平板 | D15: C30素砼翻边 | E15: m3 | F15: 34.39 | G15: 4 | H15: 34.39 | I15: 0 | J15: 418.48 | K15: =SUM(RC[-4]*RC[-1]) -> 1673.92 | L15: =RC[-3]*RC[-2] -> 0
A16: 23 | B16: 010405006003 | C16: 栏板 | D16: C30现浇砼栏板 | E16: m3 | F16: 9.9 | G16: 0 | H16: 9.9 | I16: 0 | J16: 486.43 | K16: =SUM(RC[-4]*RC[-1]) -> 0 | L16: =RC[-3]*RC[-2] -> 0
A17: 24 | B17: 010405007003 | C17: 天沟、挑檐板 | D17: C30现浇砼挑檐板 | E17: m3 | F17: 367.96 | G17: 200 | H17: 167.96 | I17: 100 | J17: 455.68 | K17: =SUM(RC[-4]*RC[-1]) -> 91136 | L17: =RC[-3]*RC[-2] -> 45568
A18: 25 | B18: 010405008003 | C18: 雨篷、阳台板 | D18: C30现浇砼雨篷板 | E18: m3 | F18: 0.25 | G18: 0.25 | H18: 0.25 | I18: 0 | J18: 438.8 | K18: =SUM(RC[-4]*RC[-1]) -> 109.7 | L18: =RC[-3]*RC[-2] -> 0
A19: 26 | B19: 010406001003 | C19: 直形楼梯 | D19: C30现浇砼直形楼梯 | E19: m2 | F19: 675.17 | G19: 100 | H19: 675.17 | I19: 0 | J19: 103.91 | K19: =SUM(RC[-4]*RC[-1]) -> 10391 | L19: =RC[-3]*RC[-2] -> 0
A20: 27 | B20: 010407001005 | C20: 其他构件 | D20: C25现浇砼窗台板 | E20: m3 | F20: 49.52 | G20: 15.52 | H20: 25.52 | I20: 24 | J20: 467.58 | K20: =SUM(RC[-4]*RC[-1]) -> 7256.8415999999997 | L20: =RC[-3]*RC[-2] -> 11221.92
A21: 30 | B21: 010416001005 | C21: 现浇混凝土钢筋 | D21: 一级圆钢（HPB300）综合，包括墙体 拉结筋；包括钢筋制作安装，非绑扎 接头的安装（如焊接和机械连接） | E21: t | F21: 18.997 | G21: 1 | H21: 18.977 | I21: 0.02 | J21: 4039.21 | K21: =SUM(RC[-4]*RC[-1]) -> 4039.21 | L21: =RC[-3]*RC[-2] -> 80.784199999999998
A22: 31 | B22: 010416001006 | C22: 现浇混凝土钢筋 | D22: 三级螺纹钢（HRB400E）综合；包括 钢筋制作安装，非绑扎接头的安装（ 如焊接和机械连接） | E22: t | F22: 834.411 | G22: 3 | H22: 832.41 | I22: 2 | J22: 3657.01 | K22: =SUM(RC[-4]*RC[-1]) -> 10971.03 | L22: =RC[-3]*RC[-2] -> 7314.02
A23: 32 | B23: 010417002003 | C23: 预埋铁件 | D23: 预埋铁件，含防锈漆 | E23: t | F23: 3.82 | G23: 3.82 | H23: 3.82 | I23: 0 | J23: 7679.36 | K23: =SUM(RC[-4]*RC[-1]) -> 29335.155199999997 | L23: =RC[-3]*RC[-2] -> 0
A24: 合 计 | K24: =SUM(R[-19]C:R[-1]C) -> 837941.35470000003 | L24: =SUM(R[-19]C:R[-1]C) -> 541183.34420000005
B26: 项目经理： | D26: 日期： | G26: 监理审核人： | J26: 日期：

Sheet: 2#病房楼
A1: 表1-2 分部分项工程量清单及计价表( 号清单)
A2: 单位及专业工程名称：2#病房楼-建筑工程
A3: 序号 | B3: 项目编码 | C3: 项目名称 | D3: 项目特征 描述 | E3: 计量 单位 | F3: 清单工程量 | G3: 上报完成工程量 | H3: 至上月累计审核工程量 | I3: 监理审核工程量 | J3: 综合单价 (元) | K3: 合价(元)
K4: 申报合价 | L4: 监理审核
A5: 1 | B5: 010302001011 | C5: 实心砖墙 | D5: 200厚KP5型页岩砖（MU7.5），M5.0 混合砂浆砌筑，砌体容重≤14KN/m3 | E5: m3 | F5: 2093.33 | G5: 1250 | H5: 843.33 | I5: 400 | J5: 375.18 | K5: =SUM(RC[-4]*RC[-1]) -> 468975 | L5: =RC[-3]*RC[-2] -> 150072 | N5: =RC[-6]+RC[-5] -> 1243.33
A6: 2 | B6: 010302001012 | C6: 实心砖墙 | D6: 100厚KP5型页岩砖（MU7.5），M5.0 水泥砂浆砌筑，砌体容重≤14KN/m3 | E6: m3 | F6: 15.97 | G6: 9 | H6: 6.97 | I6: 3 | J6: 400.4 | K6: =SUM(RC[-4]*RC[-1]) -> 3603.6 | L6: =RC[-3]*RC[-2] -> 1201.1999999999998 | N6: =RC[-6]+RC[-5] -> 9.9699999999999989
A7: 3 | B7: 010302001013 | C7: 实心砖墙 | D7: 100厚KP5型页岩砖（MU10），M7.5水 泥砂浆砌筑，砌体容重≤14KN/m3 | E7: m3 | F7: 744.35 | G7: 450 | H7: 294.35000000000002 | I7: 150 | J7: 399.87 | K7: =SUM(RC[-4]*RC[-1]) -> 179941.5 | L7: =RC[-3]*RC[-2] -> 59980.5 | N7: =RC[-6]+RC[-5] -> 444.35
A8: 4 | B8: 010302001014 | C8: 实心砖墙 | D8: 240厚KP5型页岩砖（MU10），M7.5水 泥砂浆砌筑，砌体容重≤14KN/m3 | E8: m3 | F8: 750.46 | G8: 450 | H8: 300.45999999999998 | I8: 150 | J8: 390.3 | K8: =SUM(RC[-4]*RC[-1]) -> 175635 | L8: =RC[-3]*RC[-2] -> 58545 | N8: =RC[-6]+RC[-5] -> 450.46
A9: 5 | B9: 010302001015 | C9: 实心砖墙 | D9: 200厚KP5型页岩砖（MU10），M7.5水 泥砂浆砌筑，砌体容重≤14KN/m3 | E9: m3 | F9: 81.64 | G9: 50 | H9: 31.64 | I9: 20 | J9: 374.6 | K9: =SUM(RC[-4]*RC[-1]) -> 18730 | L9: =RC[-3]*RC[-2] -> 7492 | N9: =RC[-6]+RC[-5] -> 51.64
A10: 6 | B10: 010402001009 | C10: 矩形柱 | D10: C25现浇砼构造柱 | E10: m3 | F10: 130.53 | G10: 71 | H10: 52.83 | I10: 55.7 | J10: 473.24 | K10: =SUM(RC[-4]*RC[-1]) -> 33600.04 | L10: =RC[-3]*RC[-2] -> 26359.468000000001 | N10: =RC[-6]+RC[-5] -> 108.53
A11: 12 | B11: 010403004003 | C11: 圈梁 | D11: C25现浇砼圈梁 | E11: m3 | F11: 11.83 | G11: 7 | H11: 4.83 | I11: 7 | J11: 422.28 | K11: =SUM(RC[-4]*RC[-1]) -> 2955.96 | L11: =RC[-3]*RC[-2] -> 2955.96 | N11: =RC[-6]+RC[-5] -> 11.83
A12: 13 | B12: 010403005003 | C12: 过梁 | D12: C25现浇砼过梁 | E12: m3 | F12: 24.19 | G12: 15 | H12: 9.19 | I12: 15 | J12: 422.28 | K12: =SUM(RC[-4]*RC[-1]) -> 6334.2 | L12: =RC[-3]*RC[-2] -> 6334.2 | N12: =RC[-6]+RC[-5] -> 24.189999999999998
A13: 16 | B13: 010404001007 | C13: 直形墙 | D13: C35现浇砼直形墙 | E13: m3 | F13: 376.16 | G13: 0 | H13: 376.16 | I13: 0 | J13: 457.47 | K13: =SUM(RC[-4]*RC[-1]) -> 0 | L13: =RC[-3]*RC[-2] -> 0 | N13: =RC[-6]+RC[-5] -> 376.16
A14: 23 | B14: 010405006003 | C14: 栏板 | D14: C30现浇砼栏板 | E14: m3 | F14: 9.9 | G14: 9.9 | H14: 0 | I14: 9.9 | J14: 486.43 | K14: =SUM(RC[-4]*RC[-1]) -> 4815.6570000000002 | L14: =RC[-3]*RC[-2] -> 4815.6570000000002 | N14: =RC[-6]+RC[-5] -> 9.9
A15: 24 | B15: 010405007003 | C15: 天沟、挑檐板 | D15: C30现浇砼挑檐板 | E15: m3 | F15: 367.96 | G15: 367.96 | H15: 0 | I15: 167.96 | J15: 455.68 | K15: =SUM(RC[-4]*RC[-1]) -> 167672.0128 | L15: =RC[-3]*RC[-2] -> 76536.012800000011 | N15: =RC[-6]+RC[-5] -> 167.96
A16: 25 | B16: 010405008003 | C16: 雨篷、阳台板 | D16: C30现浇砼雨篷板 | E16: m3 | F16: 0.25 | G16: 0.25 | H16: 0 | I16: 0.25 | J16: 438.8 | K16: =SUM(RC[-4]*RC[-1]) -> 109.7 | L16: =RC[-3]*RC[-2] -> 109.7 | N16: =RC[-6]+RC[-5] -> 0.25
A17: 27 | B17: 010407001005 | C17: 其他构件 | D17: C25现浇砼窗台板 | E17: m3 | F17: 49.52 | G17: 30 | H17: 19.52 | I17: 30 | J17: 467.58 | K17: =SUM(RC[-4]*RC[-1]) -> 14027.4 | L17: =RC[-3]*RC[-2] -> 14027.4 | N17: =RC[-6]+RC[-5] -> 49.519999999999996
A18: 31 | B18: 010416001004 | C18: 现浇混凝土钢筋 | D18: 三级螺纹钢（HRB400E）综合；包括 钢筋制作安装，非绑扎接头的安装（ 如焊接和机械连接） | E18: t | F18: 820.557 | G18: 20 | H18: 800.56 | I18: 20 | J18: 3657.01 | K18: =SUM(RC[-4]*RC[-1]) -> 73140.200000000012 | L18: =RC[-3]*RC[-2] -> 73140.200000000012 | N18: =RC[-6]+RC[-5] -> 820.56
A19: 32 | B19: 010417002002 | C19: 预埋铁件 | D19: 预埋铁件，含防锈漆 | E19: t | F19: 3.69 | G19: 0 | H19: 3.69 | I19: 0 | J19: 7679.36 | K19: =SUM(RC[-4]*RC[-1]) -> 0 | L19: =RC[-3]*RC[-2] -> 0 | N19: =RC[-6]+RC[-5] -> 3.69
A20: 合 计 | K20: =SUM(R[-15]C:R[-1]C) -> 1149540.2697999997 | L20: =SUM(R[-15]C:R[-1]C) -> 481569.29780000012
B22: 项目经理： | D22: 日期： | G22: 监理审核人： | J22: 日期：

Sheet: 1#病房楼
A1: 表1-2 分部分项工程量清单及计价表( 号清单)
A2: 单位及专业工程名称：1#病房楼-建筑工程
A3: 序号 | B3: 项目编码 | C3: 项目名称 | D3: 项目特征 描述 | E3: 计量 单位 | F3: 清单工程量 | G3: 上报完成工程量 | H3: 至上月累计审核工程量 | I3: 监理审核工程量 | J3: 综合单价 (元) | K3: 合价(元)
K4: 申报合价 | L4: 监理审核
A5: 1 | B5: 010302001001 | C5: 实心砖墙 | D5: 200厚KP5型页岩砖（MU7.5），M5.0 混合砂浆砌筑，砌体容重≤14KN/m3 | E5: m3 | F5: 2101.83 | G5: 1050 | H5: 851.83 | I5: 400 | J5: 375.18 | K5: =SUM(RC[-4]*RC[-1]) -> 393939 | L5: =RC[-3]*RC[-2] -> 150072 | N5: =RC[-6]+RC[-5] -> 1251.83
A6: 2 | B6: 010302001002 | C6: 实心砖墙 | D6: 100厚KP5型页岩砖（MU7.5），M5.0 水泥砂浆砌筑，砌体容重≤14KN/m3 | E6: m3 | F6: 16.03 | G6: 8 | H6: 7.03 | I6: 3 | J6: 400.4 | K6: =SUM(RC[-4]*RC[-1]) -> 3203.2 | L6: =RC[-3]*RC[-2] -> 1201.1999999999998 | N6: =RC[-6]+RC[-5] -> 10.030000000000001
A7: 3 | B7: 010302001003 | C7: 实心砖墙 | D7: 100厚KP5型页岩砖（MU10），M7.5水 泥砂浆砌筑，砌体容重≤14KN/m3 | E7: m3 | F7: 747.11 | G7: 400 | H7: 297.11 | I7: 150 | J7: 399.87 | K7: =SUM(RC[-4]*RC[-1]) -> 159948 | L7: =RC[-3]*RC[-2] -> 59980.5 | N7: =RC[-6]+RC[-5] -> 447.11
A8: 4 | B8: 010302001004 | C8: 实心砖墙 | D8: 240厚KP5型页岩砖（MU10），M7.5水 泥砂浆砌筑，砌体容重≤14KN/m3 | E8: m3 | F8: 746.94 | G8: 400 | H8: 296.94 | I8: 150 | J8: 390.3 | K8: =SUM(RC[-4]*RC[-1]) -> 156120 | L8: =RC[-3]*RC[-2] -> 58545 | N8: =RC[-6]+RC[-5] -> 446.94
A9: 5 | B9: 010302001005 | C9: 实心砖墙 | D9: 200厚KP5型页岩砖（MU10），M7.5水 泥砂浆砌筑，砌体容重≤14KN/m3 | E9: m3 | F9: 78.209999999999994 | G9: 30 | H9: 35.21 | I9: 13 | J9: 374.6 | K9: =SUM(RC[-4]*RC[-1]) -> 11238 | L9: =RC[-3]*RC[-2] -> 4869.8 | N9: =RC[-6]+RC[-5] -> 48.21
A10: 6 | B10: 010402001001 | C10: 矩形柱 | D10: C25现浇砼构造柱 | E10: m3 | F10: 136.66 | G10: 60 | H10: 56.66 | I10: 60 | J10: 473.24 | K10: =SUM(RC[-4]*RC[-1]) -> 28394.400000000001 | L10: =RC[-3]*RC[-2] -> 28394.400000000001 | N10: =RC[-6]+RC[-5] -> 116.66
A11: 12 | B11: 010403004001 | C11: 圈梁 | D11: C25现浇砼圈梁 | E11: m3 | F11: 12.11 | G11: 6 | H11: 5.1100000000000003 | I11: 5 | J11: 422.28 | K11: =SUM(RC[-4]*RC[-1]) -> 2533.6799999999998 | L11: =RC[-3]*RC[-2] -> 2111.3999999999996 | N11: =RC[-6]+RC[-5] -> 10.11
A12: 13 | B12: 010403005001 | C12: 过梁 | D12: C25现浇砼过梁 | E12: m3 | F12: 28.47 | G12: 13 | H12: 11.47 | I12: 14 | J12: 422.28 | K12: =SUM(RC[-4]*RC[-1]) -> 5489.6399999999994 | L12: =RC[-3]*RC[-2] -> 5911.92 | N12: =RC[-6]+RC[-5] -> 25.47
K13: =SUM(RC[-4]*RC[-1]) -> 0 | L13: =RC[-3]*RC[-2] -> 0 | N13: =RC[-6]+RC[-5] -> 0
A14: 23 | B14: 010405006001 | C14: 栏板 | D14: C30现浇砼栏板 | E14: m3 | F14: 9.9 | G14: 9.9 | H14: 0 | I14: 9.9 | J14: 486.43 | K14: =SUM(RC[-4]*RC[-1]) -> 4815.6570000000002 | L14: =RC[-3]*RC[-2] -> 4815.6570000000002 | N14: =RC[-6]+RC[-5] -> 9.9
A15: 24 | B15: 010405007001 | C15: 天沟、挑檐板 | D15: C30现浇砼挑檐板 | E15: m3 | F15: 333.99 | G15: 333.99 | H15: 0 | I15: 233.99 | J15: 455.68 | K15: =SUM(RC[-4]*RC[-1]) -> 152192.5632 | L15: =RC[-3]*RC[-2] -> 106624.5632 | N15: =RC[-6]+RC[-5] -> 233.99
A16: 27 | B16: 010407001001 | C16: 其他构件 | D16: C25现浇砼窗台板 | E16: m3 | F16: 49.52 | G16: 29 | H16: 20.52 | I16: 19 | J16: 467.58 | K16: =SUM(RC[-4]*RC[-1]) -> 13559.82 | L16: =RC[-3]*RC[-2] -> 8884.02 | N16: =RC[-6]+RC[-5] -> 39.519999999999996
A17: 28 | B17: 010407001002 | C17: 其他构件 | D17: C25细石砼封堵 | E17: m3 | F17: 2.89 | G17: 2.89 | H17: 0 | I17: 0 | J17: 467.58 | K17: =SUM(RC[-4]*RC[-1]) -> 1351.3062 | L17: =RC[-3]*RC[-2] -> 0 | N17: =RC[-6]+RC[-5] -> 0
A18: 31 | B18: 010416001002 | C18: 现浇混凝土钢筋 | D18: 三级螺纹钢（HRB400E）综合；包括 钢筋制作安装，非绑扎接头的安装（ 如焊接和机械连接） | E18: t | F18: 819.417 | G18: 20 | H18: 799.42 | I18: 20 | J18: 3657.01 | K18: =SUM(RC[-4]*RC[-1]) -> 73140.200000000012 | L18: =RC[-3]*RC[-2] -> 73140.200000000012 | N18: =RC[-6]+RC[-5] -> 819.42
A19: 合 计 | K19: =SUM(R[-14]C:R[-1]C) -> 1005925.4664 | L19: =SUM(R[-14]C:R[-1]C) -> 504550.6602000001
B21: 项目经理： | D21: 日期： | G21: 监理审核人： | J21: 日期：

Sheet: 行政科研楼
A1: 表1-2 分部分项工程量清单及计价表( 号清单)
A2: 单位及专业工程名称：行政科研楼-建筑工程
A3: 序号 | B3: 项目编码 | C3: 项目名称 | D3: 项目特征 描述 | E3: 计量 单位 | F3: 清单工程量 | G3: 上报完成工程量 | H3: 至上月累计审核工程量 | I3: 监理审核工程量 | J3: 综合单价 (元) | K3: 合价(元)
K4: 申报合价 | L4: 监理审核
A5: 1 | B5: 010302001030 | C5: 实心砖墙 | D5: 240厚KP5型页岩砖（MU7.5），M5.0 混合砂浆砌筑，砌体容重≤14KN/m3 | E5: m3 | F5: 233.05 | G5: 100 | H5: 133.05000000000001 | I5: 50 | J5: 390.3 | K5: =SUM(RC[-4]*RC[-1]) -> 39030 | L5: =RC[-3]*RC[-2] -> 19515 | N5: =RC[-6]+RC[-5] -> 183.05
A6: 2 | B6: 010302001031 | C6: 实心砖墙 | D6: 200厚KP5型页岩砖（MU7.5），M5.0 混合砂浆砌筑，砌体容重≤14KN/m3 | E6: m3 | F6: 2413.91 | G6: 1450 | H6: 963.91 | I6: 1200 | J6: 375.18 | K6: =SUM(RC[-4]*RC[-1]) -> 544011 | L6: =RC[-3]*RC[-2] -> 450216 | N6: =RC[-6]+RC[-5] -> 2163.91
A7: 3 | B7: 010302001032 | C7: 实心砖墙 | D7: 100厚KP5型页岩砖（MU7.5），M5.0 混合砂浆砌筑，砌体容重≤14KN/m3 | E7: m3 | F7: 93.61 | G7: 40 | H7: 53.61 | I7: 25 | J7: 399.87 | K7: =SUM(RC[-4]*RC[-1]) -> 15994.8 | L7: =RC[-3]*RC[-2] -> 9996.75 | N7: =RC[-6]+RC[-5] -> 78.61
A8: 4 | B8: 010302001033 | C8: 实心砖墙 | D8: 240厚KP5型页岩砖（MU10），M7.5水 泥砂浆砌筑，砌体容重≤14KN/m3 | E8: m3 | F8: 750.78 | G8: 300 | H8: 450.78 | I8: 250 | J8: 390.3 | K8: =SUM(RC[-4]*RC[-1]) -> 117090 | L8: =RC[-3]*RC[-2] -> 97575 | N8: =RC[-6]+RC[-5] -> 700.78
A9: 5 | B9: 010302001034 | C9: 实心砖墙 | D9: 200厚KP5型页岩砖（MU10），M7.5水 泥砂浆砌筑，砌体容重≤14KN/m3 | E9: m3 | F9: 128.8 | G9: 50 | H9: 78.8 | I9: 30 | J9: 374.6 | K9: =SUM(RC[-4]*RC[-1]) -> 18730 | L9: =RC[-3]*RC[-2] -> 11238 | N9: =RC[-6]+RC[-5] -> 108.8
A10: 6 | B10: 010302001035 | C10: 实心砖墙 | D10: 100厚KP5型页岩砖（MU10），M7.5水 泥砂浆砌筑，砌体容重≤14KN/m3 | E10: m3 | F10: 187.22 | G10: 150 | H10: 107.72 | I10: 50 | J10: 399.87 | K10: =SUM(RC[-4]*RC[-1]) -> 59980.5 | L10: =RC[-3]*RC[-2] -> 19993.5 | N10: =RC[-6]+RC[-5] -> 157.72
A11: 7 | B11: 010402001018 | C11: 矩形柱 | D11: C25现浇砼构造柱 | E11: m3 | F11: 111.25 | G11: 50 | H11: 51.25 | I11: 35 | J11: 473.24 | K11: =SUM(RC[-4]*RC[-1]) -> 23662 | L11: =RC[-3]*RC[-2] -> 16563.400000000001 | N11: =RC[-6]+RC[-5] -> 86.25
I12: 0 | K12: =SUM(RC[-4]*RC[-1]) -> 0 | L12: =RC[-3]*RC[-2] -> 0 | N12: =RC[-6]+RC[-5] -> 0
A13: 13 | B13: 010403004006 | C13: 圈梁 | D13: C25现浇砼圈梁 | E13: m3 | F13: 104.79 | G13: 50 | H13: 54.79 | I13: 30 | J13: 422.28 | K13: =SUM(RC[-4]*RC[-1]) -> 21114 | L13: =RC[-3]*RC[-2] -> 12668.4 | N13: =RC[-6]+RC[-5] -> 84.789999999999992
A14: 14 | B14: 010403005006 | C14: 过梁 | D14: C25现浇砼过梁 | E14: m3 | F14: 20.15 | G14: 10 | H14: 10.15 | I14: 6 | J14: 422.28 | K14: =SUM(RC[-4]*RC[-1]) -> 4222.7999999999993 | L14: =RC[-3]*RC[-2] -> 2533.6799999999998 | N14: =RC[-6]+RC[-5] -> 16.149999999999999
A15: 22 | B15: 010405003022 | C15: 平板 | D15: C20素砼翻边 | E15: m3 | F15: 2.24 | G15: 0 | H15: 2.2400000000000002 | I15: 0 | J15: 388.34 | K15: =SUM(RC[-4]*RC[-1]) -> 0 | L15: =RC[-3]*RC[-2] -> 0 | N15: =RC[-6]+RC[-5] -> 2.2400000000000002
A16: 25 | B16: 010405006005 | C16: 栏板 | D16: C30现浇砼栏板 | E16: m3 | F16: 8.22 | G16: 8.2200000000000006 | H16: 0 | I16: 8.2200000000000006 | J16: 486.43 | K16: =SUM(RC[-4]*RC[-1]) -> 3998.4546000000005 | L16: =RC[-3]*RC[-2] -> 3998.4546000000005 | N16: =RC[-6]+RC[-5] -> 8.2200000000000006
A17: 26 | B17: 010405008006 | C17: 雨篷、阳台板 | D17: C30现浇砼雨篷板 | E17: m3 | F17: 2.33 | G17: 2.33 | H17: 0 | I17: 2.33 | J17: 438.8 | K17: =SUM(RC[-4]*RC[-1]) -> 1022.4040000000001 | L17: =RC[-3]*RC[-2] -> 1022.4040000000001 | N17: =RC[-6]+RC[-5] -> 2.33
A18: 28 | B18: 010407001010 | C18: 其他构件 | D18: C25现浇砼窗台板 | E18: m3 | F18: 46.42 | G18: 20 | H18: 26.42 | I18: 20 | J18: 467.58 | K18: =SUM(RC[-4]*RC[-1]) -> 9351.6 | L18: =RC[-3]*RC[-2] -> 9351.6 | N18: =RC[-6]+RC[-5] -> 46.42
A19: 29 | B19: 010407001011 | C19: 其他构件 | D19: C25细石砼封堵 | E19: m3 | F19: 8.26 | G19: 8.26 | H19: 0 | I19: 0 | J19: 467.58 | K19: =SUM(RC[-4]*RC[-1]) -> 3862.2107999999998 | L19: =RC[-3]*RC[-2] -> 0 | N19: =RC[-6]+RC[-5] -> 0
A20: 31 | B20: 010416001012 | C20: 现浇混凝土钢筋 | D20: 三级螺纹钢(HRB400E)综合；包括钢 筋制作安装，非绑扎接头的安装(如 焊接和机械连接) | E20: t | F20: 748.011 | G20: 6 | H20: 744.01 | I20: 4 | J20: 3657.01 | K20: =SUM(RC[-4]*RC[-1]) -> 21942.06 | L20: =RC[-3]*RC[-2] -> 14628.04 | N20: =RC[-6]+RC[-5] -> 748.01
A21: 合 计 | K21: =SUM(R[-16]C:R[-1]C) -> 884011.82940000016 | L21: =SUM(R[-16]C:R[-1]C) -> 669300.22860000015
B23: 项目经理： | D23: 日期： | G23: 监理审核人： | J23: 日期：

Sheet: 门诊医技楼
A1: 表1-2 分部分项工程量清单及计价表( 号清单)
A2: 单位及专业工程名称：门诊医技楼-建筑工程
A3: 序号 | B3: 项目编码 | C3: 项目名称 | D3: 项目特征 描述 | E3: 计量 单位 | F3: 清单工程量 | G3: 上报完成工程量 | H3: 至上月累计审核工程量 | I3: 监理审核工程量 | J3: 综合单价 (元) | K3: 合价(元)
K4: 申报合价 | L4: 监理审核
A5: 13 | B5: 010402001014 | C5: 矩形柱 | D5: C35现浇砼矩形柱 | E5: m3 | F5: 1165.53 | G5: 100 | H5: 1065.53 | I5: 100 | J5: 464.92 | K5: =SUM(RC[-4]*RC[-1]) -> 46492 | L5: =RC[-3]*RC[-2] -> 46492 | N5: =RC[-6]+RC[-5] -> 1165.53
A6: 15 | B6: 010403002007 | C6: 矩形梁 | D6: C30现浇砼矩形梁 | E6: m3 | F6: 6586.12 | G6: 336 | H6: 6250.12 | I6: 336 | J6: 417.26 | K6: =SUM(RC[-4]*RC[-1]) -> 140199.35999999999 | L6: =RC[-3]*RC[-2] -> 140199.35999999999 | N6: =RC[-6]+RC[-5] -> 6586.12
A7: 18 | B7: 010404001013 | C7: 直形墙 | D7: C35现浇砼女儿墙 | E7: m3 | F7: 327.01 | G7: 327.01 | H7: 0 | I7: 277.01 | J7: 454.99 | K7: =SUM(RC[-4]*RC[-1]) -> 148786.27989999999 | L7: =RC[-3]*RC[-2] -> 126036.77989999999 | N7: =RC[-6]+RC[-5] -> 277.01
A8: 19 | B8: 010404001014 | C8: 直形墙 | D8: C35现浇砼直形墙 | E8: m3 | F8: 88.37 | G8: 0 | H8: 88.37 | I8: 0 | J8: 457.47 | K8: =SUM(RC[-4]*RC[-1]) -> 0 | L8: =RC[-3]*RC[-2] -> 0 | N8: =RC[-6]+RC[-5] -> 88.37
A9: 21 | B9: 010405003016 | C9: 平板 | D9: C30现浇砼平板 | E9: m3 | F9: 6500.17 | G9: 250 | H9: 6250.17 | I9: 250 | J9: 418.48 | K9: =SUM(RC[-4]*RC[-1]) -> 104620 | L9: =RC[-3]*RC[-2] -> 104620 | N9: =RC[-6]+RC[-5] -> 6500.17
A10: 23 | B10: 010405006004 | C10: 栏板 | D10: C30现浇砼栏板 | E10: m3 | F10: 10.14 | G10: 10.14 | H10: 0 | I10: 10.14 | J10: 486.43 | K10: =SUM(RC[-4]*RC[-1]) -> 4932.4002 | L10: =RC[-3]*RC[-2] -> 4932.4002 | N10: =RC[-6]+RC[-5] -> 10.14
A11: 24 | B11: 010405008004 | C11: 雨篷、阳台板 | D11: C30现浇砼雨篷板 | E11: m3 | F11: 9.04 | G11: 9.0399999999999991 | H11: 0 | I11: 9.0399999999999991 | J11: 438.8 | K11: =SUM(RC[-4]*RC[-1]) -> 3966.752 | L11: =RC[-3]*RC[-2] -> 3966.752 | N11: =RC[-6]+RC[-5] -> 9.0399999999999991
A12: 22 | B12: 010405003017 | C12: 平板 | D12: C30素砼翻边 | E12: m3 | F12: 34.32 | G12: 3 | H12: 34.32 | I12: 0 | J12: 418.48 | K12: =SUM(RC[-4]*RC[-1]) -> 1255.44 | L12: =RC[-3]*RC[-2] -> 0 | N12: =RC[-6]+RC[-5] -> 34.32
A13: 26 | B13: 010407001007 | C13: 其他构件 | D13: C25现浇砼窗台板 | E13: m3 | F13: 64.66 | G13: 64.66 | H13: 0 | I13: 0 | J13: 467.58 | K13: =SUM(RC[-4]*RC[-1]) -> 30233.722799999996 | L13: =RC[-3]*RC[-2] -> 0 | N13: =RC[-6]+RC[-5] -> 0
A14: 27 | B14: 010407001008 | C14: 其他构件 | D14: C25细石砼封堵 | E14: m3 | F14: 8.67 | G14: 8.67 | H14: 0 | I14: 0 | J14: 467.58 | K14: =SUM(RC[-4]*RC[-1]) -> 4053.9186 | L14: =RC[-3]*RC[-2] -> 0 | N14: =RC[-6]+RC[-5] -> 0
A15: 29 | B15: 010408001001 | C15: 后浇带 | D15: C35现浇砼梁后浇带；混凝土拌和料 要求：采用微膨胀砼（膨胀剂按45kg /m3考虑） | E15: m3 | F15: 22.99 | G15: 10 | H15: 12.99 | I15: 10 | J15: 465.41 | K15: =SUM(RC[-4]*RC[-1]) -> 4654.1000000000004 | L15: =RC[-3]*RC[-2] -> 4654.1000000000004 | N15: =RC[-6]+RC[-5] -> 22.990000000000002
A16: 30 | B16: 010408001002 | C16: 后浇带 | D16: C35现浇砼板后浇带；混凝土拌和料 要求：采用微膨胀砼（膨胀剂按45kg /m3考虑） | E16: m3 | F16: 82.95 | G16: 40 | H16: 42.95 | I16: 40 | J16: 465.41 | K16: =SUM(RC[-4]*RC[-1]) -> 18616.400000000001 | L16: =RC[-3]*RC[-2] -> 18616.400000000001 | N16: =RC[-6]+RC[-5] -> 82.95
A17: 31 | B17: 010416001007 | C17: 现浇混凝土钢筋 | D17: 一级圆钢(HPB300)综合，包括墙体拉 结筋；包括钢筋制作安装，非绑扎接 头的安装(如焊接和机械连接) | E17: t | F17: 51.271 | G17: 5 | H17: 46.271000000000001 | I17: 3 | J17: 4039.21 | K17: =SUM(RC[-4]*RC[-1]) -> 20196.05 | L17: =RC[-3]*RC[-2] -> 12117.630000000001 | N17: =RC[-6]+RC[-5] -> 49.271000000000001
A18: 32 | B18: 010416001008 | C18: 现浇混凝土钢筋 | D18: 三级螺纹钢(HRB400E)综合；包括钢 筋制作安装，非绑扎接头的安装(如 焊接和机械连接) | E18: t | F18: 2512.763 | G18: 100 | H18: 2412.7600000000002 | I18: 70 | J18: 3657.01 | K18: =SUM(RC[-4]*RC[-1]) -> 365701 | L18: =RC[-3]*RC[-2] -> 255990.7 | N18: =RC[-6]+RC[-5] -> 2482.7600000000002
A19: 合 计 | K19: =SUM(R[-14]C:R[-1]C) -> 893707.42349999992 | L19: =SUM(R[-14]C:R[-1]C) -> 717626.12209999992
B21: 项目经理： | D21: 日期： | G21: 监理审核人： | J21: 日期：

Sheet: 后勤服务楼.
A1: 表1-2 分部分项工程量清单及计价表( 号清单)
A2: 单位及专业工程名称：后勤服务楼-建筑工程
A3: 序号 | B3: 项目编码 | C3: 项目名称 | D3: 项目特征 描述 | E3: 计量 单位 | F3: 清单工程量 | G3: 上报完成工程量 | H3: 至上月累计审核工程量 | I3: 监理审核工程量 | J3: 综合单价 (元) | K3: 合价(元)
K4: 申报合价 | L4: 监理审核
A5: 1 | B5: 010302001039 | C5: 实心砖墙 | D5: 240厚KP5型页岩砖（MU10），M7.5水 泥砂浆砌筑，砌体容重≤14KN/m3 | E5: m3 | F5: 140.57 | G5: 100.57 | H5: 0 | I5: 50.57 | J5: 390.3 | K5: =SUM(RC[-4]*RC[-1]) -> 39252.470999999998 | L5: =RC[-3]*RC[-2] -> 19737.471000000001 | N5: =RC[-6]+RC[-5] -> 50.57
A6: 2 | B6: 010302001040 | C6: 实心砖墙 | D6: 200厚KP5型页岩砖（MU7.5），M5.0 混合砂浆砌筑，砌体容重≤14KN/m3 | E6: m3 | F6: 409.7 | G6: 350.7 | H6: 0 | I6: 209.7 | J6: 375.18 | K6: =SUM(RC[-4]*RC[-1]) -> 131575.62599999999 | L6: =RC[-3]*RC[-2] -> 78675.245999999999 | N6: =RC[-6]+RC[-5] -> 209.7
A7: 3 | B7: 010302001041 | C7: 实心砖墙 | D7: 100厚KP5型页岩砖（MU10），M5.0水 泥砂浆砌筑，砌体容重≤14KN/m3 | E7: m3 | F7: 3.7 | G7: 3.7 | H7: 0 | I7: 1.7 | J7: 398.35 | K7: =SUM(RC[-4]*RC[-1]) -> 1473.8950000000002 | L7: =RC[-3]*RC[-2] -> 677.19500000000005 | N7: =RC[-6]+RC[-5] -> 1.7
A8: 4 | B8: 010302006001 | C8: 零星砌砖 | D8: 砖砌台阶：具体做法详图纸，包括水 泥砂浆抹灰 | E8: m2 | F8: 10.02 | G8: 0 | H8: 0 | I8: 0 | J8: 188.22 | K8: =SUM(RC[-4]*RC[-1]) -> 0 | L8: =RC[-3]*RC[-2] -> 0 | N8: =RC[-6]+RC[-5] -> 0
A9: 9 | B9: 010403004008 | C9: 圈梁 | D9: C25现浇砼圈梁 | E9: m3 | F9: 16.9 | G9: 0 | H9: 0 | I9: 6.9 | J9: 422.28 | K9: =SUM(RC[-4]*RC[-1]) -> 0 | L9: =RC[-3]*RC[-2] -> 2913.732 | N9: =RC[-6]+RC[-5] -> 6.9
A10: 10 | B10: 010403005007 | C10: 过梁 | D10: C25现浇砼过梁 | E10: m3 | F10: 3.52 | G10: 0 | H10: 0 | I10: 1.52 | J10: 422.28 | K10: =SUM(RC[-4]*RC[-1]) -> 0 | L10: =RC[-3]*RC[-2] -> 641.86559999999997 | N10: =RC[-6]+RC[-5] -> 1.52
A11: 12 | B11: 010405003027 | C11: 平板 | D11: C30现浇砼板 | E11: m3 | F11: 381 | G11: 20 | H11: 361 | I11: 20 | J11: 418.48 | K11: =SUM(RC[-4]*RC[-1]) -> 8369.6 | L11: =RC[-3]*RC[-2] -> 8369.6 | N11: =RC[-6]+RC[-5] -> 381
A12: 15 | B12: 010405006007 | C12: 栏板 | D12: C30现浇砼栏板 | E12: m3 | F12: 15.34 | G12: 15.34 | H12: 0 | I12: 15.34 | J12: 486.43 | K12: =SUM(RC[-4]*RC[-1]) -> 7461.8361999999997 | L12: =RC[-3]*RC[-2] -> 7461.8361999999997 | N12: =RC[-6]+RC[-5] -> 15.34
A13: 16 | B13: 010405008007 | C13: 雨篷、阳台板 | D13: C30现浇砼雨篷板 | E13: m3 | F13: 0.75 | G13: 0.75 | H13: 0 | I13: 0.75 | J13: 438.8 | K13: =SUM(RC[-4]*RC[-1]) -> 329.1 | L13: =RC[-3]*RC[-2] -> 329.1 | N13: =RC[-6]+RC[-5] -> 0.75
A14: 21 | B14: 010416001015 | C14: 现浇混凝土钢筋 | D14: 一级圆钢（HPB300）综合，包括墙体 拉结筋；包括钢筋制作安装，非绑扎 接头的安装（如焊接和机械连接） | E14: t | F14: 5.581 | G14: 1 | H14: 4.5810000000000004 | I14: 1 | J14: 4039.21 | K14: =SUM(RC[-4]*RC[-1]) -> 4039.21 | L14: =RC[-3]*RC[-2] -> 4039.21 | N14: =RC[-6]+RC[-5] -> 5.5810000000000004
A15: 22 | B15: 010416001016 | C15: 现浇混凝土钢筋 | D15: 三级螺纹钢（HRB400E）综合；包括 钢筋制作安装，非绑扎接头的安装（ 如焊接和机械连接） | E15: t | F15: 171.455 | G15: 6 | H15: 165.45500000000001 | I15: 6 | J15: 3657.01 | K15: =SUM(RC[-4]*RC[-1]) -> 21942.06 | L15: =RC[-3]*RC[-2] -> 21942.06 | N15: =RC[-6]+RC[-5] -> 171.45500000000001
A16: 合 计 | K16: =SUM(R[-11]C:R[-1]C) -> 214443.79819999996 | L16: =SUM(R[-11]C:R[-1]C) -> 144787.31580000004
B18: 项目经理： | D18: 日期： | G18: 监理审核人： | J18: 日期：

Sheet: 后勤服务楼
A1: 表1-2 分部分项工程量清单及计价表( 号清单)
A2: 单位及专业工程名称：后勤服务楼-建筑工程
A3: 序号 | B3: 项目编码 | C3: 项目名称 | D3: 项目特征 描述 | E3: 计量 单位 | F3: 清单工程量 | G3: 上报完成工程量 | H3: 至上月累计审核工程量 | I3: 监理审核工程量 | J3: 综合单价 (元) | K3: 合价(元)
K4: 申报合价 | L4: 监理审核
A5: 6 | B5: 010402001025 | C5: 矩形柱 | D5: C30现浇砼矩形柱 | E5: m3 | F5: 157.14 | G5: 79 | H5: 78.14 | I5: 79 | J5: 443.91 | K5: =SUM(RC[-4]*RC[-1]) -> 35068.89 | L5: =RC[-3]*RC[-2] -> 35068.89
A6: 7 | B6: 010402001026 | C6: 矩形柱 | D6: C35现浇砼矩形柱 | E6: m3 | F6: 2.5 | G6: 0 | H6: 2.5 | I6: 0 | J6: 464.92 | K6: =SUM(RC[-4]*RC[-1]) -> 0 | L6: =RC[-3]*RC[-2] -> 0
A7: 8 | B7: 010403002012 | C7: 矩形梁 | D7: C30现浇砼矩形梁 | E7: m3 | F7: 491.34 | G7: 246 | H7: 245.34 | I7: 246 | J7: 417.26 | K7: =SUM(RC[-4]*RC[-1]) -> 102645.95999999999 | L7: =RC[-3]*RC[-2] -> 102645.95999999999
A8: 9 | B8: 010403004008 | C8: 圈梁 | D8: C25现浇砼圈梁 | E8: m3 | F8: 16.9 | G8: 0 | H8: 0 | I8: 0 | J8: 422.28 | K8: =SUM(RC[-4]*RC[-1]) -> 0 | L8: =RC[-3]*RC[-2] -> 0
A9: 10 | B9: 010403005007 | C9: 过梁 | D9: C25现浇砼过梁 | E9: m3 | F9: 3.52 | G9: 0 | H9: 0 | I9: 0 | J9: 422.28 | K9: =SUM(RC[-4]*RC[-1]) -> 0 | L9: =RC[-3]*RC[-2] -> 0
A10: 11 | B10: 010404001023 | C10: 直形墙 | D10: C30现浇砼直形墙 | E10: m3 | F10: 47.09 | G10: 23 | H10: 24.09 | I10: 23 | J10: 436.46 | K10: =SUM(RC[-4]*RC[-1]) -> 10038.58 | L10: =RC[-3]*RC[-2] -> 10038.58
A11: 12 | B11: 010405003027 | C11: 平板 | D11: C30现浇砼板 | E11: m3 | F11: 381 | G11: 191 | H11: 190 | I11: 171 | J11: 418.48 | K11: =SUM(RC[-4]*RC[-1]) -> 79929.680000000008 | L11: =RC[-3]*RC[-2] -> 71560.08
A12: 13 | B12: 010405003028 | C12: 平板 | D12: C20素砼翻边 | E12: m3 | F12: 0.4 | G12: 0.4 | H12: 0 | I12: 0.4 | J12: 388.34 | K12: =SUM(RC[-4]*RC[-1]) -> 155.33600000000001 | L12: =RC[-3]*RC[-2] -> 155.33600000000001
A13: 14 | B13: 010405003029 | C13: 平板 | D13: C30素砼翻边 | E13: m3 | F13: 0.44 | G13: 0 | H13: 0.44 | I13: 0 | J13: 418.48 | K13: =SUM(RC[-4]*RC[-1]) -> 0 | L13: =RC[-3]*RC[-2] -> 0
A14: 15 | B14: 010405006007 | C14: 栏板 | D14: C30现浇砼栏板 | E14: m3 | F14: 15.34 | G14: 0 | H14: 0 | I14: 0 | J14: 486.43 | K14: =SUM(RC[-4]*RC[-1]) -> 0 | L14: =RC[-3]*RC[-2] -> 0
A15: 16 | B15: 010405008007 | C15: 雨篷、阳台板 | D15: C30现浇砼雨篷板 | E15: m3 | F15: 0.75 | G15: 0 | H15: 0 | I15: 0 | J15: 438.8 | K15: =SUM(RC[-4]*RC[-1]) -> 0 | L15: =RC[-3]*RC[-2] -> 0
A16: 17 | B16: 010406001008 | C16: 直形楼梯 | D16: C30现浇砼直形楼梯 | E16: m2 | F16: 108.27 | G16: 54.27 | H16: 54 | I16: 54.27 | J16: 103.91 | K16: =SUM(RC[-4]*RC[-1]) -> 5639.1957000000002 | L16: =RC[-3]*RC[-2] -> 5639.1957000000002
A17: 21 | B17: 010416001015 | C17: 现浇混凝土钢筋 | D17: 一级圆钢（HPB300）综合，包括墙体 拉结筋；包括钢筋制作安装，非绑扎 接头的安装（如焊接和机械连接） | E17: t | F17: 5.581 | G17: 3 | H17: 2.581 | I17: 2 | J17: 4039.21 | K17: =SUM(RC[-4]*RC[-1]) -> 12117.630000000001 | L17: =RC[-3]*RC[-2] -> 8078.42
A18: 22 | B18: 010416001016 | C18: 现浇混凝土钢筋 | D18: 三级螺纹钢（HRB400E）综合；包括 钢筋制作安装，非绑扎接头的安装（ 如焊接和机械连接） | E18: t | F18: 171.455 | G18: 86 | H18: 85.454999999999998 | I18: 80 | J18: 3657.01 | K18: =SUM(RC[-4]*RC[-1]) -> 314502.86000000004 | L18: =RC[-3]*RC[-2] -> 292560.80000000005
A19: 23 | B19: 010417002008 | C19: 预埋铁件 | D19: 预埋铁件，含防锈漆 | E19: t | F19: 0.35 | G19: 0 | H19: 0.35 | I19: 0 | J19: 7679.36 | K19: =SUM(RC[-4]*RC[-1]) -> 0 | L19: =RC[-3]*RC[-2] -> 0
A20: 合 计 | K20: =SUM(R[-15]C:R[-1]C) -> 560098.13170000003 | L20: =SUM(R[-15]C:R[-1]C) -> 525747.26170000003
B22: 项目经理： | D22: 日期： | G22: 监理审核人： | J22: 日期：

Sheet: 高压氧仓楼
A1: 表1-2 分部分项工程量清单及计价表( 号清单)
A2: 单位及专业工程名称：高压氧仓楼-建筑工程
A3: 序号 | B3: 项目编码 | C3: 项目名称 | D3: 项目特征 描述 | E3: 计量 单位 | F3: 清单工程量 | G3: 上报完成工程量 | H3: 至上月累计审核工程量 | I3: 监理审核工程量 | J3: 综合单价 (元) | K3: 合价(元)
K4: 申报合价 | L4: 监理审核
A5: 1 | B5: 010302001036 | C5: 实心砖墙 | D5: 200厚KP5型页岩砖（MU7.5），M5.0 混合砂浆砌筑，砌体容重≤14KN/m3 | E5: m3 | F5: 101.38 | G5: 101.38 | H5: 0 | I5: 101.38 | J5: 375.18 | K5: =SUM(RC[-4]*RC[-1]) -> 38035.748399999997 | L5: =RC[-3]*RC[-2] -> 38035.748399999997
A6: 2 | B6: 010302001037 | C6: 实心砖墙 | D6: 100厚KP5型页岩砖（MU7.5），M5.0 混合砂浆砌筑，砌体容重≤14KN/m3 | E6: m3 | F6: 4.87 | G6: 4.87 | H6: 0 | I6: 4.87 | J6: 399.87 | K6: =SUM(RC[-4]*RC[-1]) -> 1947.3669 | L6: =RC[-3]*RC[-2] -> 1947.3669
A7: 3 | B7: 010302001038 | C7: 实心砖墙 | D7: 240厚KP5型页岩砖（MU10），M7.5水 泥砂浆砌筑，砌体容重≤14KN/m3 | E7: m3 | F7: 30.42 | G7: 30.42 | H7: 0 | I7: 30.42 | J7: 390.3 | K7: =SUM(RC[-4]*RC[-1]) -> 11872.926000000001 | L7: =RC[-3]*RC[-2] -> 11872.926000000001
A8: 4 | B8: 010402001022 | C8: 矩形柱 | D8: C25现浇砼构造柱 | E8: m3 | F8: 5.58 | G8: 5.58 | H8: 0 | I8: 5.58 | J8: 473.24 | K8: =SUM(RC[-4]*RC[-1]) -> 2640.6792 | L8: =RC[-3]*RC[-2] -> 2640.6792
A9: 8 | B9: 010404001022 | C9: 直形墙 | D9: C30现浇砼女儿墙 | E9: m3 | F9: 18.96 | G9: 18.96 | H9: 0 | I9: 18.96 | J9: 436.46 | K9: =SUM(RC[-4]*RC[-1]) -> 8275.2816000000003 | L9: =RC[-3]*RC[-2] -> 8275.2816000000003
A10: 10 | B10: 010405003026 | C10: 平板 | D10: C20素砼翻边 | E10: m3 | F10: 0.83 | G10: 0.83 | H10: 0 | I10: 0.83 | J10: 388.34 | K10: =SUM(RC[-4]*RC[-1]) -> 322.32219999999995 | L10: =RC[-3]*RC[-2] -> 322.32219999999995
A11: 11 | B11: 010405006006 | C11: 栏板 | D11: C30现浇砼栏板 | E11: m3 | F11: 1.46 | G11: 1.46 | H11: 0 | I11: 1.46 | J11: 486.43 | K11: =SUM(RC[-4]*RC[-1]) -> 710.18780000000004 | L11: =RC[-3]*RC[-2] -> 710.18780000000004
A12: 合 计 | K12: =SUM(R[-7]C:R[-1]C) -> 63804.5121 | L12: =SUM(R[-7]C:R[-1]C) -> 63804.5121