Sheet: 地下室建筑
A1: 表1-2 分部分项工程量清单及计价表( 号清单)
A2: 单位及专业工程名称：地下室-建筑工程
A3: 序号 | B3: 项目编码 | C3: 项目名称 | D3: 项目特征 描述 | E3: 计量 单位 | F3: 清单工程量 | G3: 上报完成工程量 | H3: 至上月累计审核工程量 | I3: 监理审核工程量 | J3: 综合单价 (元) | K3: 合价(元)
K4: 申报合价 | L4: 监理审核
A5: 3 | B5: 010103001004 | C5: 土（石）方回填 | D5: 基础施工时，底层回填所用土方应清 除草皮，树根和垃圾等杂物，在最优 含水量状态下分层夯实，每层填土厚 度一般不大于300，回填土应在结构 施工完成以前进行；压实系数不应小 于0.94；取土回填土方运距自行考虑 | E5: m3 | F5: 5201.47 | G5: 500 | H5: 4701.47 | I5: 0 | J5: 4.41 | K5: =SUM(RC[-4]*RC[-1]) -> 2205 | L5: =RC[-3]*RC[-2] -> 0
A6: 52 | B6: 010302001046 | C6: 实心砖墙 | D6: 240厚KP5型页岩砖（MU10），M7.5水 泥砂浆砌筑，砌体容重≤14KN/m3 | E6: m3 | F6: 25.14 | G6: 15 | H6: 10.14 | I6: 15 | J6: 390.3 | K6: =SUM(RC[-4]*RC[-1]) -> 5854.5 | L6: =RC[-3]*RC[-2] -> 5854.5
A7: 53 | B7: 010302001047 | C7: 实心砖墙 | D7: 200厚KP5型页岩砖（MU10），M7.5水 泥砂浆砌筑，砌体容重≤14KN/m3 | E7: m3 | F7: 2143.16 | G7: 1000 | H7: 1043.1600000000001 | I7: 1000 | J7: 374.6 | K7: =SUM(RC[-4]*RC[-1]) -> 374600 | L7: =RC[-3]*RC[-2] -> 374600
A8: 54 | B8: 010302001048 | C8: 实心砖墙 | D8: 100厚KP5型页岩砖（MU10），M7.5水 泥砂浆砌筑，砌体容重≤14KN/m3 | E8: m3 | F8: 6.07 | G8: 2 | H8: 3.07 | I8: 3 | J8: 399.87 | K8: =SUM(RC[-4]*RC[-1]) -> 799.74 | L8: =RC[-3]*RC[-2] -> 1199.6100000000001
A9: 71 | B9: 010402001030 | C9: 矩形柱 | D9: C25现浇砼构造柱 | E9: m3 | F9: 111.7 | G9: 111.7 | H9: 0 | I9: 111.7 | J9: 473.24 | K9: =SUM(RC[-4]*RC[-1]) -> 52860.908000000003 | L9: =RC[-3]*RC[-2] -> 52860.908000000003
A10: 79 | B10: 010403004011 | C10: 圈梁 | D10: C25现浇砼圈梁 | E10: m3 | F10: 95.14 | G10: 95.14 | H10: 0 | I10: 95.14 | J10: 422.28 | K10: =SUM(RC[-4]*RC[-1]) -> 40175.7192 | L10: =RC[-3]*RC[-2] -> 40175.7192
A11: 80 | B11: 010403005010 | C11: 过梁 | D11: C25现浇砼过梁 | E11: m3 | F11: 0.66 | G11: 0.66 | H11: 0 | I11: 0.66 | J11: 422.28 | K11: =SUM(RC[-4]*RC[-1]) -> 278.70479999999998 | L11: =RC[-3]*RC[-2] -> 278.70479999999998
A12: 以下序号82、83、86、88为2015年11月份进度款中暂扣工程量，现申请重新计量支付
A13: 82 | B13: 010404001027 | C13: 直形墙 | D13: （外墙）C35现浇砼直形墙；抗裂防 水混凝土，抗渗等级为P6；混凝土中 需掺加 0.9kg/m3的聚丙烯抗裂纤维 | E13: m3 | F13: 1753.32 | G13: 110 | H13: 1643.32 | I13: 0 | J13: 458.19 | K13: =SUM(RC[-4]*RC[-1]) -> 50400.9 | L13: 0
A14: 83 | B14: 010404001028 | C14: 直形墙 | D14: （人防外墙、防爆波电缆井）C35现 浇砼直形墙；抗渗等级为P6；采用内 掺膨胀剂的补偿收缩混凝土，膨胀剂 性能应满足《混凝土外加剂应用技术 规范》（GB50119-2013），限制膨胀 率大于等于0.022%（水中14d），另 需掺适量的合成纤维 | E14: m3 | F14: 532.44 | G14: 30 | H14: 502.44 | I14: 0 | J14: 488.28 | K14: =SUM(RC[-4]*RC[-1]) -> 14648.4 | L14: 0
A15: 86 | B15: 010404001031 | C15: 直形墙 | D15: （除外墙、主楼）C35现浇砼直形墙 ；抗渗防裂混凝土，抗渗等级P6 | E15: m3 | F15: 4129.22 | G15: 210 | H15: 3919.22 | I15: 0 | J15: 457.47 | K15: =SUM(RC[-4]*RC[-1]) -> 96068.700000000012 | L15: 0
A16: 88 | B16: 010404001033 | C16: 直形墙 | D16: （人防内墙）C35现浇砼直形墙；抗 渗等级P6 | E16: m3 | F16: 1126.07 | G16: 70 | H16: 1056.07 | I16: 0 | J16: 457.47 | K16: =SUM(RC[-4]*RC[-1]) -> 32022.9 | L16: 0
A17: 95 | B17: 010408001003 | C17: 后浇带 | D17: C40现浇砼筏板后浇带；抗裂防水混 凝土，抗渗等级为P6；采用加膨胀剂 的补偿收缩混凝土，混凝土的限制膨 胀率（水中14天）2.0~2.2x10-4,限 制干缩率（水中14天空气中28天）≤ 3.0x10-4。用于补偿收缩混凝土的膨 胀剂掺量不宜大于12%，不宜小于6% ；填充用膨胀混凝土的膨胀剂掺量不 宜大于15%，不宜小于10%；采用补偿 收缩混凝土（每立方混凝土中用45kg 膨胀剂按比例替换胶凝材料） | E17: m3 | F17: 698.78 | G17: 80 | H17: 618.78 | I17: 0 | J17: 483.23 | K17: =SUM(RC[-4]*RC[-1]) -> 38658.400000000001 | L17: =RC[-3]*RC[-2] -> 0
B18: 合计 | K18: =SUM(R[-13]C:R[-1]C) -> 708573.87199999997 | L18: =SUM(R[-13]C:R[-1]C) -> 474969.44199999998
C20: 项目经理： | D20: 日期： | G20: 监理审核人： | J20: 日期：

Sheet: 基坑围护
A1: 表1-2 分部分项工程量清单及计价表( 号清单)
A2: 单位及专业工程名称：基坑围护-基坑围护工程
A3: 序号 | B3: 项目编码 | C3: 项目名称 | D3: 项目特征 描述 | E3: 计量 单位 | F3: 清单工程量 | G3: 上报完成工程量 | H3: 至上月累计审核工程量 | I3: 监理审核工程量 | J3: 综合单价 (元) | K3: 合价(元)
K4: 申报合价 | L4: 监理审核
A5: 以下序号42、43为2015年5月工程进度款代建单位审核过程中暂扣基坑围护钢筋项费用，经核对后发现至今未补充支付，故要求需重新计量支付。
A6: 42 | B6: 010416001023 | C6: 现浇混凝土钢筋 | D6: 一级圆钢（HPB300）综合；包括钢筋 制作安装，非绑扎接头的安装（如焊 接和机械连接） | E6: t | F6: 111.788 | G6: 30.79 | I6: 30.788 | J6: 4039.21 | K6: =SUM(RC[-4]*RC[-1]) -> 124367.27589999999 | L6: 0
A7: 43 | B7: 010416001024 | C7: 现浇混凝土钢筋 | D7: 三级螺纹钢（HRB400E）综合；包括 钢筋制作安装，非绑扎接头的安装（ 如焊接和机械连接） | E7: t | F7: 277.783 | G7: 77.78 | I7: 77.783000000000001 | J7: 3657.01 | K7: =SUM(RC[-4]*RC[-1]) -> 284442.2378 | L7: 0
A8: 以下补1为喷粉桩清单项目特征描述为D650@450与设计施工图D600@450不符，于2015年1月份、3月份、4月份进度款中分别按每米7.27元核减，施工单位认为在工程进度款中直接核减工程量不妥，此为工程量清单错误的修正，在施工过程中核减与合同条款、清单招标规范相违背，1）根据浙建[2016]2号文《关于规范建设工程施工招标文件计价条款的指导意见》中第一条第2点明确：招标人提供的工程量清单，其准确性和完整性应由招标人负责。2）《建设施工合同》专用条款第1.13条工程量清单错误的修正中明确调整合同价格的修正时间：除本合同专用条款另有约定外，合同单价不调整，工程量清单在工程结算审核时调整。故要求原暂扣核减的工程款预以重新计量支付。
A9: 补1 | C9: 喷粉装 | E9: m | F9: 63249.599999999999 | G9: 63249.599999999999 | J9: 7.27 | K9: =SUM(RC[-4]*RC[-1]) -> 459824.59199999995 | L9: =RC[-3]*RC[-2] -> 0
A10: 合 计 | K10: =SUM(R[-7]C:R[-1]C) -> 868634.10569999996 | L10: =SUM(R[-4]C:R[-3]C) -> 0
B11: 施工单位： | J11: 监理单位：
B12: 日期： | J12: 日期：

Sheet: 3#病房楼
A1: 表1-2 分部分项工程量清单及计价表( 号清单)
A2: 单位及专业工程名称：3#病房楼-建筑工程
A3: 序号 | B3: 项目编码 | C3: 项目名称 | D3: 项目特征 描述 | E3: 计量 单位 | F3: 清单工程量 | G3: 上报完成工程量 | H3: 至上月累计审核工程量 | I3: 监理审核工程量 | J3: 综合单价 (元) | K3: 合价(元)
K4: 申报合价 | L4: 监理审核
A5: 1 | B5: 010302001011 | C5: 实心砖墙 | D5: 200厚KP5型页岩砖（MU7.5），M5.0 混合砂浆砌筑，砌体容重≤14KN/m3 | E5: m3 | F5: 2093.33 | G5: 693.33 | H5: 693.33 | I5: 550 | J5: 375.18 | K5: =SUM(RC[-4]*RC[-1]) -> 260123.54940000002 | L5: =RC[-3]*RC[-2] -> 206349
A6: 2 | B6: 010302001012 | C6: 实心砖墙 | D6: 100厚KP5型页岩砖（MU7.5），M5.0 水泥砂浆砌筑，砌体容重≤14KN/m3 | E6: m3 | F6: 15.97 | G6: 5.97 | H6: 5.97 | I6: 2 | J6: 400.4 | K6: =SUM(RC[-4]*RC[-1]) -> 2390.3879999999999 | L6: =RC[-3]*RC[-2] -> 800.8
A7: 3 | B7: 010302001013 | C7: 实心砖墙 | D7: 100厚KP5型页岩砖（MU10），M7.5水 泥砂浆砌筑，砌体容重≤14KN/m3 | E7: m3 | F7: 744.35 | G7: 344.35 | H7: 264.35000000000002 | I7: 150 | J7: 399.87 | K7: =SUM(RC[-4]*RC[-1]) -> 137695.23450000002 | L7: =RC[-3]*RC[-2] -> 59980.5
A8: 4 | B8: 010302001014 | C8: 实心砖墙 | D8: 240厚KP5型页岩砖（MU10），M7.5水 泥砂浆砌筑，砌体容重≤14KN/m3 | E8: m3 | F8: 750.46 | G8: 250.46 | H8: 250.46 | I8: 150 | J8: 390.3 | K8: =SUM(RC[-4]*RC[-1]) -> 97754.538 | L8: =RC[-3]*RC[-2] -> 58545
A9: 5 | B9: 010302001015 | C9: 实心砖墙 | D9: 200厚KP5型页岩砖（MU10），M7.5水 泥砂浆砌筑，砌体容重≤14KN/m3 | E9: m3 | F9: 81.64 | G9: 31.64 | H9: 26.64 | I9: 15 | J9: 374.6 | K9: =SUM(RC[-4]*RC[-1]) -> 11852.344000000001 | L9: =RC[-3]*RC[-2] -> 5619
A10: 6 | B10: 010402001009 | C10: 矩形柱 | D10: C25现浇砼构造柱 | E10: m3 | F10: 112.83 | G10: 30.83 | H10: 30.83 | I10: 30 | J10: 473.24 | K10: =SUM(RC[-4]*RC[-1]) -> 14589.9892 | L10: =RC[-3]*RC[-2] -> 14197.2
A11: 10 | B11: 010403002005 | C11: 矩形梁 | D11: C30现浇砼矩形梁 | E11: m3 | F11: 1497.83 | G11: 242 | H11: 1475.83 | I11: 22 | J11: 417.26 | K11: =SUM(RC[-4]*RC[-1]) -> 100976.92 | L11: =RC[-3]*RC[-2] -> 9179.7199999999993
A12: 12 | B12: 010403004003 | C12: 圈梁 | D12: C25现浇砼圈梁 | E12: m3 | F12: 11.83 | G12: 5 | H12: 3.83 | I12: 2 | J12: 422.28 | K12: =SUM(RC[-4]*RC[-1]) -> 2111.3999999999996 | L12: =RC[-3]*RC[-2] -> 844.56
A13: 13 | B13: 010403005003 | C13: 过梁 | D13: C25现浇砼过梁 | E13: m3 | F13: 24.19 | G13: 8 | H13: 7.19 | I13: 5 | J13: 422.28 | K13: =SUM(RC[-4]*RC[-1]) -> 3378.24 | L13: =RC[-3]*RC[-2] -> 2111.3999999999996
A14: 16 | B14: 010404001011 | C14: 直形墙 | D14: C35现浇砼直形墙 | E14: m3 | F14: 376.17 | G14: 196.17 | H14: 180 | I14: 0 | J14: 457.47 | K14: =SUM(RC[-4]*RC[-1]) -> 89741.889899999995 | L14: =RC[-3]*RC[-2] -> 0
A15: 18 | B15: 010405003011 | C15: 平板 | D15: C30现浇砼板 | E15: m3 | F15: 1268.86 | G15: 180 | H15: 1208.8599999999999 | I15: 60 | J15: 418.48 | K15: =SUM(RC[-4]*RC[-1]) -> 75326.400000000009 | L15: =RC[-3]*RC[-2] -> 25108.800000000003
A16: 20 | B16: 010405003013 | C16: 平板 | D16: C20素砼翻边 | E16: m3 | F16: 2.62 | G16: 2.62 | H16: 0 | I16: 2.62 | J16: 388.34 | K16: =SUM(RC[-4]*RC[-1]) -> 1017.4508 | L16: =RC[-3]*RC[-2] -> 1017.4508
A17: 21 | B17: 010405003014 | C17: 平板 | D17: C30素砼翻边 | E17: m3 | F17: 34.39 | G17: 4 | H17: 34.39 | I17: 0 | J17: 418.48 | K17: =SUM(RC[-4]*RC[-1]) -> 1673.92 | L17: =RC[-3]*RC[-2] -> 0
A18: 23 | B18: 010405006003 | C18: 栏板 | D18: C30现浇砼栏板 | E18: m3 | F18: 9.9 | G18: 9.9 | H18: 9.9 | I18: 0 | J18: 486.43 | K18: =SUM(RC[-4]*RC[-1]) -> 4815.6570000000002 | L18: =RC[-3]*RC[-2] -> 0
A19: 24 | B19: 010405007003 | C19: 天沟、挑檐板 | D19: C30现浇砼挑檐板 | E19: m3 | F19: 367.96 | G19: 200 | H19: 167.96 | I19: 0 | J19: 455.68 | K19: =SUM(RC[-4]*RC[-1]) -> 91136 | L19: =RC[-3]*RC[-2] -> 0
A20: 25 | B20: 010405008003 | C20: 雨篷、阳台板 | D20: C30现浇砼雨篷板 | E20: m3 | F20: 0.25 | G20: 0.25 | H20: 0.25 | I20: 0 | J20: 438.8 | K20: =SUM(RC[-4]*RC[-1]) -> 109.7 | L20: =RC[-3]*RC[-2] -> 0
A21: 26 | B21: 010406001003 | C21: 直形楼梯 | D21: C30现浇砼直形楼梯 | E21: m2 | F21: 675.17 | G21: 100 | H21: 675.17 | I21: 0 | J21: 103.91 | K21: =SUM(RC[-4]*RC[-1]) -> 10391 | L21: =RC[-3]*RC[-2] -> 0
A22: 27 | B22: 010407001005 | C22: 其他构件 | D22: C25现浇砼窗台板 | E22: m3 | F22: 49.52 | G22: 15.52 | H22: 15.52 | I22: 10 | J22: 467.58 | K22: =SUM(RC[-4]*RC[-1]) -> 7256.8415999999997 | L22: =RC[-3]*RC[-2] -> 4675.8
A23: 30 | B23: 010416001005 | C23: 现浇混凝土钢筋 | D23: 一级圆钢（HPB300）综合，包括墙体 拉结筋；包括钢筋制作安装，非绑扎 接头的安装（如焊接和机械连接） | E23: t | F23: 18.997 | G23: 1 | H23: 18.977 | I23: 0 | J23: 4039.21 | K23: =SUM(RC[-4]*RC[-1]) -> 4039.21 | L23: =RC[-3]*RC[-2] -> 0
A24: 31 | B24: 010416001006 | C24: 现浇混凝土钢筋 | D24: 三级螺纹钢（HRB400E）综合；包括 钢筋制作安装，非绑扎接头的安装（ 如焊接和机械连接） | E24: t | F24: 834.411 | G24: 5 | H24: 829.41 | I24: 3 | J24: 3657.01 | K24: =SUM(RC[-4]*RC[-1]) -> 18285.050000000003 | L24: =RC[-3]*RC[-2] -> 10971.03
A25: 32 | B25: 010417002003 | C25: 预埋铁件 | D25: 预埋铁件，含防锈漆 | E25: t | F25: 3.82 | G25: 0 | H25: 3.82 | I25: 0 | J25: 7679.36 | K25: =SUM(RC[-4]*RC[-1]) -> 0 | L25: =RC[-3]*RC[-2] -> 0
A26: 合 计 | K26: =SUM(R[-21]C:R[-1]C) -> 934665.72240000009 | L26: =SUM(R[-21]C:R[-1]C) -> 399400.26079999999
B28: 项目经理： | D28: 日期： | G28: 监理审核人： | J28: 日期：

Sheet: 2#病房楼
A1: 表1-2 分部分项工程量清单及计价表( 号清单)
A2: 单位及专业工程名称：2#病房楼-建筑工程
A3: 序号 | B3: 项目编码 | C3: 项目名称 | D3: 项目特征 描述 | E3: 计量 单位 | F3: 清单工程量 | G3: 上报完成工程量 | H3: 至上月累计审核工程量 | I3: 监理审核工程量 | J3: 综合单价 (元) | K3: 合价(元)
K4: 申报合价 | L4: 监理审核
A5: 1 | B5: 010302001011 | C5: 实心砖墙 | D5: 200厚KP5型页岩砖（MU7.5），M5.0 混合砂浆砌筑，砌体容重≤14KN/m3 | E5: m3 | F5: 2093.33 | G5: 1100 | H5: 293.33 | I5: 550 | J5: 375.18 | K5: =SUM(RC[-4]*RC[-1]) -> 412698 | L5: =RC[-3]*RC[-2] -> 206349
A6: 2 | B6: 010302001012 | C6: 实心砖墙 | D6: 100厚KP5型页岩砖（MU7.5），M5.0 水泥砂浆砌筑，砌体容重≤14KN/m3 | E6: m3 | F6: 15.97 | G6: 8 | H6: 2.97 | I6: 4 | J6: 400.4 | K6: =SUM(RC[-4]*RC[-1]) -> 3203.2 | L6: =RC[-3]*RC[-2] -> 1601.6
A7: 3 | B7: 010302001013 | C7: 实心砖墙 | D7: 100厚KP5型页岩砖（MU10），M7.5水 泥砂浆砌筑，砌体容重≤14KN/m3 | E7: m3 | F7: 744.35 | G7: 500 | H7: 144.35 | I7: 150 | J7: 399.87 | K7: =SUM(RC[-4]*RC[-1]) -> 199935 | L7: =RC[-3]*RC[-2] -> 59980.5
A8: 4 | B8: 010302001014 | C8: 实心砖墙 | D8: 240厚KP5型页岩砖（MU10），M7.5水 泥砂浆砌筑，砌体容重≤14KN/m3 | E8: m3 | F8: 750.46 | G8: 400 | H8: 150.46 | I8: 150 | J8: 390.3 | K8: =SUM(RC[-4]*RC[-1]) -> 156120 | L8: =RC[-3]*RC[-2] -> 58545
A9: 5 | B9: 010302001015 | C9: 实心砖墙 | D9: 200厚KP5型页岩砖（MU10），M7.5水 泥砂浆砌筑，砌体容重≤14KN/m3 | E9: m3 | F9: 81.64 | G9: 45 | H9: 11.64 | I9: 20 | J9: 374.6 | K9: =SUM(RC[-4]*RC[-1]) -> 16857 | L9: =RC[-3]*RC[-2] -> 7492
A10: 6 | B10: 010402001009 | C10: 矩形柱 | D10: C25现浇砼构造柱 | E10: m3 | F10: 130.53 | G10: 60 | H10: 12.83 | I10: 40 | J10: 473.24 | K10: =SUM(RC[-4]*RC[-1]) -> 28394.400000000001 | L10: =RC[-3]*RC[-2] -> 18929.599999999999
A11: 7 | B11: 010402001010 | C11: 矩形柱 | D11: C30现浇砼矩形柱 | E11: m3 | F11: 113.66 | G11: 10 | H11: 103.66 | I11: 10 | J11: 443.91 | K11: =SUM(RC[-4]*RC[-1]) -> 4439.1000000000004 | L11: =RC[-3]*RC[-2] -> 4439.1000000000004
A12: 8 | B12: 010402001007 | C12: 矩形柱 | D12: C35现浇砼矩形柱 | E12: m3 | F12: 229.25 | G12: 0 | H12: 229.25 | I12: 0 | J12: 464.92 | K12: =SUM(RC[-4]*RC[-1]) -> 0 | L12: =RC[-3]*RC[-2] -> 0
A13: 10 | B13: 010403002003 | C13: 矩形梁 | D13: C30现浇砼矩形梁 | E13: m3 | F13: 1497.13 | G13: 100 | H13: 1397.13 | I13: 100 | J13: 417.26 | K13: =SUM(RC[-4]*RC[-1]) -> 41726 | L13: =RC[-3]*RC[-2] -> 41726
A14: 12 | B14: 010403004003 | C14: 圈梁 | D14: C25现浇砼圈梁 | E14: m3 | F14: 11.83 | G14: 6 | H14: 2.83 | I14: 2 | J14: 422.28 | K14: =SUM(RC[-4]*RC[-1]) -> 2533.6799999999998 | L14: =RC[-3]*RC[-2] -> 844.56
A15: 13 | B15: 010403005003 | C15: 过梁 | D15: C25现浇砼过梁 | E15: m3 | F15: 24.19 | G15: 8 | H15: 4.1900000000000004 | I15: 5 | J15: 422.28 | K15: =SUM(RC[-4]*RC[-1]) -> 3378.24 | L15: =RC[-3]*RC[-2] -> 2111.3999999999996
A16: 16 | B16: 010404001007 | C16: 直形墙 | D16: C35现浇砼直形墙 | E16: m3 | F16: 376.16 | G16: 0 | H16: 376.16 | I16: 0 | J16: 457.47 | K16: =SUM(RC[-4]*RC[-1]) -> 0 | L16: =RC[-3]*RC[-2] -> 0
A17: 18 | B17: 010405003006 | C17: 平板 | D17: C30现浇砼板 | E17: m3 | F17: 1352.43 | G17: 200 | H17: 1252.43 | I17: 100 | J17: 418.48 | K17: =SUM(RC[-4]*RC[-1]) -> 83696 | L17: =RC[-3]*RC[-2] -> 41848
A18: 20 | B18: 010405003008 | C18: 平板 | D18: C20素砼翻边 | E18: m3 | F18: 2.55 | G18: 2.5499999999999998 | H18: 0 | I18: 2.5499999999999998 | J18: 388.34 | K18: =SUM(RC[-4]*RC[-1]) -> 990.26699999999983 | L18: =RC[-3]*RC[-2] -> 990.26699999999983
A19: 21 | B19: 010405003009 | C19: 平板 | D19: C30素砼翻边 | E19: m3 | F19: 34.94 | G19: 3 | H19: 31.94 | I19: 3 | J19: 418.48 | K19: =SUM(RC[-4]*RC[-1]) -> 1255.44 | L19: =RC[-3]*RC[-2] -> 1255.44
A20: 23 | B20: 010405006003 | C20: 栏板 | D20: C30现浇砼栏板 | E20: m3 | F20: 9.9 | G20: 9.9 | H20: 0 | I20: 0 | J20: 486.43 | K20: =SUM(RC[-4]*RC[-1]) -> 4815.6570000000002 | L20: =RC[-3]*RC[-2] -> 0
A21: 24 | B21: 010405007003 | C21: 天沟、挑檐板 | D21: C30现浇砼挑檐板 | E21: m3 | F21: 367.96 | G21: 267.95999999999998 | H21: 0 | I21: 0 | J21: 455.68 | K21: =SUM(RC[-4]*RC[-1]) -> 122104.0128 | L21: =RC[-3]*RC[-2] -> 0
A22: 25 | B22: 010405008003 | C22: 雨篷、阳台板 | D22: C30现浇砼雨篷板 | E22: m3 | F22: 0.25 | G22: 0 | H22: 0 | I22: 0 | J22: 438.8 | K22: =SUM(RC[-4]*RC[-1]) -> 0 | L22: =RC[-3]*RC[-2] -> 0
A23: 26 | B23: 010406001002 | C23: 直形楼梯 | D23: C30现浇砼直形楼梯 | E23: m2 | F23: 675.17 | G23: 50 | H23: 625.16999999999996 | I23: 50 | J23: 103.91 | K23: =SUM(RC[-4]*RC[-1]) -> 5195.5 | L23: =RC[-3]*RC[-2] -> 5195.5
A24: 27 | B24: 010407001005 | C24: 其他构件 | D24: C25现浇砼窗台板 | E24: m3 | F24: 49.52 | G24: 20 | H24: 9.52 | I24: 10 | J24: 467.58 | K24: =SUM(RC[-4]*RC[-1]) -> 9351.6 | L24: =RC[-3]*RC[-2] -> 4675.8
A25: 30 | B25: 010416001003 | C25: 现浇混凝土钢筋 | D25: 一级圆钢（HPB300）综合，包括墙体 拉结筋；包括钢筋制作安装，非绑扎 接头的安装（如焊接和机械连接） | E25: t | F25: 20.026 | G25: 1 | H25: 19.03 | I25: 1 | J25: 4039.21 | K25: =SUM(RC[-4]*RC[-1]) -> 4039.21 | L25: =RC[-3]*RC[-2] -> 4039.21
A26: 31 | B26: 010416001004 | C26: 现浇混凝土钢筋 | D26: 三级螺纹钢（HRB400E）综合；包括 钢筋制作安装，非绑扎接头的安装（ 如焊接和机械连接） | E26: t | F26: 820.557 | G26: 41 | H26: 779.56 | I26: 21 | J26: 3657.01 | K26: =SUM(RC[-4]*RC[-1]) -> 149937.41 | L26: =RC[-3]*RC[-2] -> 76797.210000000006
A27: 32 | B27: 010417002002 | C27: 预埋铁件 | D27: 预埋铁件，含防锈漆 | E27: t | F27: 3.69 | G27: 0 | H27: 3.69 | I27: 0 | J27: 7679.36 | K27: =SUM(RC[-4]*RC[-1]) -> 0 | L27: =RC[-3]*RC[-2] -> 0
A28: 合 计 | K28: =SUM(R[-23]C:R[-1]C) -> 1250669.7167999998 | L28: =SUM(R[-23]C:R[-1]C) -> 536820.18699999992
B30: 项目经理： | D30: 日期： | G30: 监理审核人： | J30: 日期：

Sheet: 1#病房楼
A1: 表1-2 分部分项工程量清单及计价表( 号清单)
A2: 单位及专业工程名称：1#病房楼-建筑工程
A3: 序号 | B3: 项目编码 | C3: 项目名称 | D3: 项目特征 描述 | E3: 计量 单位 | F3: 清单工程量 | G3: 上报完成工程量 | H3: 至上月累计审核工程量 | I3: 监理审核工程量 | J3: 综合单价 (元) | K3: 合价(元)
K4: 申报合价 | L4: 监理审核
A5: 1 | B5: 010302001001 | C5: 实心砖墙 | D5: 200厚KP5型页岩砖（MU7.5），M5.0 混合砂浆砌筑，砌体容重≤14KN/m3 | E5: m3 | F5: 2101.83 | G5: 1100 | H5: 201.83 | I5: 650 | J5: 375.18 | K5: =SUM(RC[-4]*RC[-1]) -> 412698 | L5: =RC[-3]*RC[-2] -> 243867
A6: 2 | B6: 010302001002 | C6: 实心砖墙 | D6: 100厚KP5型页岩砖（MU7.5），M5.0 水泥砂浆砌筑，砌体容重≤14KN/m3 | E6: m3 | F6: 16.03 | G6: 8 | H6: 4.03 | I6: 3 | J6: 400.4 | K6: =SUM(RC[-4]*RC[-1]) -> 3203.2 | L6: =RC[-3]*RC[-2] -> 1201.1999999999998
A7: 3 | B7: 010302001003 | C7: 实心砖墙 | D7: 100厚KP5型页岩砖（MU10），M7.5水 泥砂浆砌筑，砌体容重≤14KN/m3 | E7: m3 | F7: 747.11 | G7: 400 | H7: 147.11000000000001 | I7: 150 | J7: 399.87 | K7: =SUM(RC[-4]*RC[-1]) -> 159948 | L7: =RC[-3]*RC[-2] -> 59980.5
A8: 4 | B8: 010302001004 | C8: 实心砖墙 | D8: 240厚KP5型页岩砖（MU10），M7.5水 泥砂浆砌筑，砌体容重≤14KN/m3 | E8: m3 | F8: 746.94 | G8: 400 | H8: 146.94 | I8: 150 | J8: 390.3 | K8: =SUM(RC[-4]*RC[-1]) -> 156120 | L8: =RC[-3]*RC[-2] -> 58545
A9: 5 | B9: 010302001005 | C9: 实心砖墙 | D9: 200厚KP5型页岩砖（MU10），M7.5水 泥砂浆砌筑，砌体容重≤14KN/m3 | E9: m3 | F9: 78.209999999999994 | G9: 50 | H9: 15.21 | I9: 20 | J9: 374.6 | K9: =SUM(RC[-4]*RC[-1]) -> 18730 | L9: =RC[-3]*RC[-2] -> 7492
A10: 6 | B10: 010402001001 | C10: 矩形柱 | D10: C25现浇砼构造柱 | E10: m3 | F10: 136.66 | G10: 60 | H10: 26.66 | I10: 30 | J10: 473.24 | K10: =SUM(RC[-4]*RC[-1]) -> 28394.400000000001 | L10: =RC[-3]*RC[-2] -> 14197.2
A11: 7 | B11: 010402001002 | C11: 矩形柱 | D11: C30现浇砼矩形柱 | E11: m3 | F11: 113.66 | G11: 30 | H11: 83.66 | I11: 30 | J11: 443.91 | K11: =SUM(RC[-4]*RC[-1]) -> 13317.300000000001 | L11: =RC[-3]*RC[-2] -> 13317.300000000001
A12: 10 | B12: 010403002001 | C12: 矩形梁 | D12: C30现浇砼矩形梁 | E12: m3 | F12: 1497.83 | G12: 195 | H12: 1302.83 | I12: 195 | J12: 417.26 | K12: =SUM(RC[-4]*RC[-1]) -> 81365.7 | L12: =RC[-3]*RC[-2] -> 81365.7
A13: 12 | B13: 010403004001 | C13: 圈梁 | D13: C25现浇砼圈梁 | E13: m3 | F13: 12.11 | G13: 6 | H13: 2.11 | I13: 3 | J13: 422.28 | K13: =SUM(RC[-4]*RC[-1]) -> 2533.6799999999998 | L13: =RC[-3]*RC[-2] -> 1266.8399999999999
A14: 13 | B14: 010403005001 | C14: 过梁 | D14: C25现浇砼过梁 | E14: m3 | F14: 28.47 | G14: 13 | H14: 5.47 | I14: 6 | J14: 422.28 | K14: =SUM(RC[-4]*RC[-1]) -> 5489.6399999999994 | L14: =RC[-3]*RC[-2] -> 2533.6799999999998
A15: 17 | B15: 010404001004 | C15: 直形墙 | D15: C40现浇砼直形墙 | E15: m3 | F15: 452.88 | G15: 0 | H15: 452.88 | I15: 0 | J15: 478.48 | K15: =SUM(RC[-4]*RC[-1]) -> 0 | L15: =RC[-3]*RC[-2] -> 0
K16: =SUM(RC[-4]*RC[-1]) -> 0 | L16: =RC[-3]*RC[-2] -> 0
A17: 18 | B17: 010405003001 | C17: 平板 | D17: C30现浇砼板 | E17: m3 | F17: 1350.13 | G17: 530 | H17: 820.13 | I17: 530 | J17: 418.48 | K17: =SUM(RC[-4]*RC[-1]) -> 221794.40000000002 | L17: =RC[-3]*RC[-2] -> 221794.40000000002
A18: 19 | B18: 010405003002 | C18: 平板 | D18: C35现浇砼板 | E18: m3 | F18: 150.79 | G18: 0 | H18: 150.79 | I18: 0 | J18: 439.49 | K18: =SUM(RC[-4]*RC[-1]) -> 0 | L18: =RC[-3]*RC[-2] -> 0
A19: 21 | B19: 010405003004 | C19: 平板 | D19: C30素砼翻边 | E19: m3 | F19: 35.67 | G19: 8 | H19: 27.67 | I19: 8 | J19: 418.48 | K19: =SUM(RC[-4]*RC[-1]) -> 3347.84 | L19: =RC[-3]*RC[-2] -> 3347.84
A20: 22 | B20: 010405003005 | C20: 平板 | D20: C35素砼翻边 | E20: m3 | F20: 4.9 | G20: 0 | H20: 4.9000000000000004 | I20: 0 | J20: 439.49 | K20: =SUM(RC[-4]*RC[-1]) -> 0 | L20: =RC[-3]*RC[-2] -> 0
A21: 23 | B21: 010405006001 | C21: 栏板 | D21: C30现浇砼栏板 | E21: m3 | F21: 9.9 | G21: 9.9 | H21: 0 | I21: 0 | J21: 486.43 | K21: =SUM(RC[-4]*RC[-1]) -> 4815.6570000000002 | L21: =RC[-3]*RC[-2] -> 0
A22: 24 | B22: 010405007001 | C22: 天沟、挑檐板 | D22: C30现浇砼挑檐板 | E22: m3 | F22: 333.99 | G22: 183.99 | H22: 0 | I22: 0 | J22: 455.68 | K22: =SUM(RC[-4]*RC[-1]) -> 83840.563200000004 | L22: =RC[-3]*RC[-2] -> 0
A23: 25 | B23: 010405008001 | C23: 雨篷、阳台板 | D23: C30现浇砼雨篷板 | E23: m3 | F23: 0.25 | G23: 0.25 | H23: 0 | I23: 0.25 | J23: 438.8 | K23: =SUM(RC[-4]*RC[-1]) -> 109.7 | L23: =RC[-3]*RC[-2] -> 109.7
A24: 26 | B24: 010406001001 | C24: 直形楼梯 | D24: C30现浇砼直形楼梯 | E24: m2 | F24: 675.17 | G24: 55 | H24: 620.16999999999996 | I24: 55 | J24: 103.91 | K24: =SUM(RC[-4]*RC[-1]) -> 5715.05 | L24: =RC[-3]*RC[-2] -> 5715.05
A25: 27 | B25: 010407001001 | C25: 其他构件 | D25: C25现浇砼窗台板 | E25: m3 | F25: 49.52 | G25: 34 | H25: 5.52 | I25: 15 | J25: 467.58 | K25: =SUM(RC[-4]*RC[-1]) -> 15897.72 | L25: =RC[-3]*RC[-2] -> 7013.7
A26: 28 | B26: 010407001002 | C26: 其他构件 | D26: C25细石砼封堵 | E26: m3 | F26: 2.89 | G26: 2.89 | H26: 0 | I26: 0 | J26: 467.58 | K26: =SUM(RC[-4]*RC[-1]) -> 1351.3062 | L26: =RC[-3]*RC[-2] -> 0
A27: 30 | B27: 010416001001 | C27: 现浇混凝土钢筋 | D27: 一级圆钢（HPB300）综合，包括墙体 拉结筋；包括钢筋制作安装，非绑扎 接头的安装（如焊接和机械连接） | E27: t | F27: 16.621 | G27: 1 | H27: 15.62 | I27: 1 | J27: 4039.21 | K27: =SUM(RC[-4]*RC[-1]) -> 4039.21 | L27: =RC[-3]*RC[-2] -> 4039.21
A28: 31 | B28: 010416001002 | C28: 现浇混凝土钢筋 | D28: 三级螺纹钢（HRB400E）综合；包括 钢筋制作安装，非绑扎接头的安装（ 如焊接和机械连接） | E28: t | F28: 819.417 | G28: 57 | H28: 762.42 | I28: 37 | J28: 3657.01 | K28: =SUM(RC[-4]*RC[-1]) -> 208449.57 | L28: =RC[-3]*RC[-2] -> 135309.37
A29: 32 | B29: 010417002001 | C29: 预埋铁件 | D29: 预埋铁件，含防锈漆 | E29: t | F29: 3.672 | G29: 1 | H29: 2.67 | I29: 1 | J29: 7679.36 | K29: =SUM(RC[-4]*RC[-1]) -> 7679.36 | L29: =RC[-3]*RC[-2] -> 7679.36
A30: 合 计 | K30: =SUM(R[-25]C:R[-1]C) -> 1438840.2964000001 | L30: =SUM(R[-25]C:R[-1]C) -> 868775.04999999993
B32: 项目经理： | D32: 日期： | G32: 监理审核人： | J32: 日期：

Sheet: 行政科研楼
A1: 表1-2 分部分项工程量清单及计价表( 号清单)
A2: 单位及专业工程名称：行政科研楼-建筑工程
A3: 序号 | B3: 项目编码 | C3: 项目名称 | D3: 项目特征 描述 | E3: 计量 单位 | F3: 清单工程量 | G3: 上报完成工程量 | H3: 至上月累计审核工程量 | I3: 监理审核工程量 | J3: 综合单价 (元) | K3: 合价(元)
K4: 申报合价 | L4: 监理审核
A5: 1 | B5: 010302001030 | C5: 实心砖墙 | D5: 240厚KP5型页岩砖（MU7.5），M5.0 混合砂浆砌筑，砌体容重≤14KN/m3 | E5: m3 | F5: 233.05 | G5: 180 | H5: 23.05 | I5: 110 | J5: 390.3 | K5: =SUM(RC[-4]*RC[-1]) -> 70254 | L5: =RC[-3]*RC[-2] -> 42933
A6: 2 | B6: 010302001031 | C6: 实心砖墙 | D6: 200厚KP5型页岩砖（MU7.5），M5.0 混合砂浆砌筑，砌体容重≤14KN/m3 | E6: m3 | F6: 2413.91 | G6: 1600 | H6: 213.91 | I6: 750 | J6: 375.18 | K6: =SUM(RC[-4]*RC[-1]) -> 600288 | L6: =RC[-3]*RC[-2] -> 281385
A7: 3 | B7: 010302001032 | C7: 实心砖墙 | D7: 100厚KP5型页岩砖（MU7.5），M5.0 混合砂浆砌筑，砌体容重≤14KN/m3 | E7: m3 | F7: 93.61 | G7: 60 | H7: 13.61 | I7: 40 | J7: 399.87 | K7: =SUM(RC[-4]*RC[-1]) -> 23992.2 | L7: =RC[-3]*RC[-2] -> 15994.8
A8: 4 | B8: 010302001033 | C8: 实心砖墙 | D8: 240厚KP5型页岩砖（MU10），M7.5水 泥砂浆砌筑，砌体容重≤14KN/m3 | E8: m3 | F8: 750.78 | G8: 400 | H8: 50.78 | I8: 400 | J8: 390.3 | K8: =SUM(RC[-4]*RC[-1]) -> 156120 | L8: =RC[-3]*RC[-2] -> 156120
A9: 5 | B9: 010302001034 | C9: 实心砖墙 | D9: 200厚KP5型页岩砖（MU10），M7.5水 泥砂浆砌筑，砌体容重≤14KN/m3 | E9: m3 | F9: 128.8 | G9: 70 | H9: 18.8 | I9: 60 | J9: 374.6 | K9: =SUM(RC[-4]*RC[-1]) -> 26222 | L9: =RC[-3]*RC[-2] -> 22476
A10: 6 | B10: 010302001035 | C10: 实心砖墙 | D10: 100厚KP5型页岩砖（MU10），M7.5水 泥砂浆砌筑，砌体容重≤14KN/m3 | E10: m3 | F10: 187.22 | G10: 90 | H10: 17.22 | I10: 90 | J10: 399.87 | K10: =SUM(RC[-4]*RC[-1]) -> 35988.300000000003 | L10: =RC[-3]*RC[-2] -> 35988.300000000003
A11: 7 | B11: 010402001018 | C11: 矩形柱 | D11: C25现浇砼构造柱 | E11: m3 | F11: 111.25 | G11: 71.25 | H11: 0 | I11: 51.25 | J11: 473.24 | K11: =SUM(RC[-4]*RC[-1]) -> 33718.35 | L11: =RC[-3]*RC[-2] -> 24253.55
A12: 8 | B12: 010402001019 | C12: 矩形柱 | D12: C30现浇砼矩形柱 | E12: m3 | F12: 205.13 | G12: 15 | H12: 190.13 | I12: 15 | J12: 443.91 | K12: =SUM(RC[-4]*RC[-1]) -> 6658.6500000000005 | L12: =RC[-3]*RC[-2] -> 6658.6500000000005
A13: 9 | B13: 010402001020 | C13: 矩形柱 | D13: C35现浇砼矩形柱 | E13: m3 | F13: 221.83 | G13: 0 | H13: 221.83 | I13: 0 | J13: 464.92 | K13: =SUM(RC[-4]*RC[-1]) -> 0 | L13: =RC[-3]*RC[-2] -> 0
A14: 11 | B14: 010403002009 | C14: 矩形梁 | D14: C30现浇砼矩形梁 | E14: m3 | F14: 1691.99 | G14: 50 | H14: 1641.99 | I14: 50 | J14: 417.26 | K14: =SUM(RC[-4]*RC[-1]) -> 20863 | L14: =RC[-3]*RC[-2] -> 20863
I15: 0 | K15: =SUM(RC[-4]*RC[-1]) -> 0 | L15: =RC[-3]*RC[-2] -> 0
A16: 13 | B16: 010403004006 | C16: 圈梁 | D16: C25现浇砼圈梁 | E16: m3 | F16: 104.79 | G16: 104.79 | H16: 0 | I16: 54.79 | J16: 422.28 | K16: =SUM(RC[-4]*RC[-1]) -> 44250.7212 | L16: =RC[-3]*RC[-2] -> 23136.7212
A17: 14 | B17: 010403005006 | C17: 过梁 | D17: C25现浇砼过梁 | E17: m3 | F17: 20.15 | G17: 15.15 | H17: 0 | I17: 10.15 | J17: 422.28 | K17: =SUM(RC[-4]*RC[-1]) -> 6397.5419999999995 | L17: =RC[-3]*RC[-2] -> 4286.1419999999998
A18: 15 | B18: 010404001017 | C18: 直形墙 | D18: C30现浇砼女儿墙 | E18: m3 | F18: 96.25 | G18: 96.25 | H18: 0 | I18: 96.25 | J18: 436.46 | K18: =SUM(RC[-4]*RC[-1]) -> 42009.275000000001 | L18: =RC[-3]*RC[-2] -> 42009.275000000001
A19: 16 | B19: 010404001018 | C19: 直形墙 | D19: C40现浇砼女儿墙 | E19: m3 | F19: 35.22 | G19: 35.22 | H19: 0 | I19: 35.22 | J19: 478.48 | K19: =SUM(RC[-4]*RC[-1]) -> 16852.065600000002 | L19: =RC[-3]*RC[-2] -> 16852.065600000002
A20: 20 | B20: 010405003020 | C20: 平板 | D20: C30现浇砼平板 | E20: m3 | F20: 1835.11 | G20: 40 | H20: 1795.11 | I20: 40 | J20: 418.48 | K20: =SUM(RC[-4]*RC[-1]) -> 16739.2 | L20: =RC[-3]*RC[-2] -> 16739.2
A21: 22 | B21: 010405003022 | C21: 平板 | D21: C20素砼翻边 | E21: m3 | F21: 2.24 | G21: 2.2400000000000002 | H21: 0 | I21: 2.2400000000000002 | J21: 388.34 | K21: =SUM(RC[-4]*RC[-1]) -> 869.88160000000005 | L21: =RC[-3]*RC[-2] -> 869.88160000000005
A22: 25 | B22: 010405006005 | C22: 栏板 | D22: C30现浇砼栏板 | E22: m3 | F22: 8.22 | G22: 8.2200000000000006 | H22: 0 | I22: 0 | J22: 486.43 | K22: =SUM(RC[-4]*RC[-1]) -> 3998.4546000000005 | L22: =RC[-3]*RC[-2] -> 0
A23: 26 | B23: 010405008006 | C23: 雨篷、阳台板 | D23: C30现浇砼雨篷板 | E23: m3 | F23: 2.33 | G23: 2.33 | H23: 0 | I23: 0 | J23: 438.8 | K23: =SUM(RC[-4]*RC[-1]) -> 1022.4040000000001 | L23: =RC[-3]*RC[-2] -> 0
A24: 28 | B24: 010407001010 | C24: 其他构件 | D24: C25现浇砼窗台板 | E24: m3 | F24: 46.42 | G24: 46.42 | H24: 0 | I24: 26.42 | J24: 467.58 | K24: =SUM(RC[-4]*RC[-1]) -> 21705.063600000001 | L24: =RC[-3]*RC[-2] -> 12353.463600000001
A25: 29 | B25: 010407001011 | C25: 其他构件 | D25: C25细石砼封堵 | E25: m3 | F25: 8.26 | G25: 8.26 | H25: 0 | I25: 0 | J25: 467.58 | K25: =SUM(RC[-4]*RC[-1]) -> 3862.2107999999998 | L25: =RC[-3]*RC[-2] -> 0
A26: 30 | B26: 010416001011 | C26: 现浇混凝土钢筋 | D26: 一级圆钢(HPB300)综合，包括墙体拉 结筋；包括钢筋制作安装，非绑扎接 头的安装(如焊接和机械连接) | E26: t | F26: 13.632 | G26: 1 | H26: 12.63 | I26: 1 | J26: 4039.21 | K26: =SUM(RC[-4]*RC[-1]) -> 4039.21 | L26: =RC[-3]*RC[-2] -> 4039.21
A27: 31 | B27: 010416001012 | C27: 现浇混凝土钢筋 | D27: 三级螺纹钢(HRB400E)综合；包括钢 筋制作安装，非绑扎接头的安装(如 焊接和机械连接) | E27: t | F27: 748.011 | G27: 10 | H27: 738.01 | I27: 6 | J27: 3657.01 | K27: =SUM(RC[-4]*RC[-1]) -> 36570.100000000006 | L27: =RC[-3]*RC[-2] -> 21942.06
A28: 合 计 | K28: =SUM(R[-23]C:R[-1]C) -> 1172420.6284000003 | L28: =SUM(R[-23]C:R[-1]C) -> 748900.31900000002
B30: 项目经理： | D30: 日期： | G30: 监理审核人： | J30: 日期：

Sheet: 发热门诊楼
A1: 表1-2 分部分项工程量清单及计价表( 号清单)
A2: 单位及专业工程名称：发热门诊楼-建筑工程
A3: 序号 | B3: 项目编码 | C3: 项目名称 | D3: 项目特征 描述 | E3: 计量 单位 | F3: 清单工程量 | G3: 上报完成工程量 | H3: 至上月累计审核工程量 | I3: 监理审核工程量 | J3: 综合单价 (元) | K3: 合价(元)
K4: 申报合价 | L4: 监理审核
A5: 1 | B5: 010101003003 | C5: 挖基础土方 | D5: 挖基础土方；开挖深度1米以内；土 壤类别详见地质报告；综合考虑土方 类别；包括凿桩头及桩头外运；土方 外运运距自行考虑 | E5: m3 | F5: 34.5 | G5: 34.5 | H5: 0 | I5: 34.5 | J5: 31.23 | K5: 1077.44 | L5: =RC[-3]*RC[-2] -> 1077.4349999999999
A6: 11 | B6: 010401001002 | C6: 带形基础 | D6: C25现浇砼带形基础 | E6: m3 | F6: 29.12 | G6: 29.12 | H6: 0 | I6: 0 | J6: 382.37 | K6: 11134.61 | L6: =RC[-3]*RC[-2] -> 0
A7: 12 | B7: 010401001003 | C7: 带形基础 | D7: C30现浇砼带形基础 | E7: m3 | F7: 67.05 | G7: 67.05 | H7: 0 | I7: 67.05 | J7: 398.82 | K7: 26740.880000000001 | L7: =RC[-3]*RC[-2] -> 26740.880999999998
A8: 13 | B8: 010401005002 | C8: 桩承台基础 | D8: C30现浇砼桩承台基础 | E8: m3 | F8: 25.73 | G8: 25.73 | H8: 0 | I8: 25.73 | J8: 398.82 | K8: 10261.64 | L8: =RC[-3]*RC[-2] -> 10261.6386
A9: 14 | B9: 010401006003 | C9: 垫层 | D9: C15现浇砼垫层 | E9: m3 | F9: 21.66 | G9: 21.66 | H9: 0 | I9: 21.66 | J9: 356.89 | K9: 7730.24 | L9: =RC[-3]*RC[-2] -> 7730.2374
A10: 合 计 | K10: =SUM(R[-5]C:R[-1]C) -> 56944.81 | L10: =SUM(R[-5]C:R[-1]C) -> 45810.191999999995

Sheet: 门诊医技楼
A1: 表1-2 分部分项工程量清单及计价表( 号清单)
A2: 单位及专业工程名称：门诊医技楼-建筑工程
A3: 序号 | B3: 项目编码 | C3: 项目名称 | D3: 项目特征 描述 | E3: 计量 单位 | F3: 清单工程量 | G3: 上报完成工程量 | H3: 至上月累计审核工程量 | I3: 监理审核工程量 | J3: 综合单价 (元) | K3: 合价(元)
K4: 申报合价 | L4: 监理审核
A5: 13 | B5: 010402001014 | C5: 矩形柱 | D5: C35现浇砼矩形柱 | E5: m3 | F5: 1165.53 | G5: 165 | H5: 1000.53 | I5: 65 | J5: 464.92 | K5: =SUM(RC[-4]*RC[-1]) -> 76711.8 | L5: =RC[-3]*RC[-2] -> 30219.8
A6: 15 | B6: 010403002007 | C6: 矩形梁 | D6: C30现浇砼矩形梁 | E6: m3 | F6: 6586.12 | G6: 936 | H6: 5750.12 | I6: 500 | J6: 417.26 | K6: =SUM(RC[-4]*RC[-1]) -> 390555.36 | L6: =RC[-3]*RC[-2] -> 208630
A7: 19 | B7: 010404001014 | C7: 直形墙 | D7: C35现浇砼直形墙 | E7: m3 | F7: 88.37 | G7: 0 | H7: 88.37 | I7: 0 | J7: 457.47 | K7: =SUM(RC[-4]*RC[-1]) -> 0 | L7: =RC[-3]*RC[-2] -> 0
A8: 21 | B8: 010405003016 | C8: 平板 | D8: C30现浇砼平板 | E8: m3 | F8: 6500.17 | G8: 850 | H8: 5750.17 | I8: 500 | J8: 418.48 | K8: =SUM(RC[-4]*RC[-1]) -> 355708 | L8: =RC[-3]*RC[-2] -> 209240
A9: 22 | B9: 010405003017 | C9: 平板 | D9: C30素砼翻边 | E9: m3 | F9: 34.32 | G9: 3 | H9: 31.32 | I9: 3 | J9: 418.48 | K9: =SUM(RC[-4]*RC[-1]) -> 1255.44 | L9: =RC[-3]*RC[-2] -> 1255.44
A10: 25 | B10: 010406001004 | C10: 直形楼梯 | D10: C30现浇砼直形楼梯 | E10: m2 | F10: 1142.38 | G10: 0 | H10: 1142.3800000000001 | I10: 0 | J10: 103.91 | K10: =SUM(RC[-4]*RC[-1]) -> 0 | L10: =RC[-3]*RC[-2] -> 0
A11: 29 | B11: 010408001001 | C11: 后浇带 | D11: C35现浇砼梁后浇带；混凝土拌和料 要求：采用微膨胀砼（膨胀剂按45kg /m3考虑） | E11: m3 | F11: 22.99 | G11: 22.29 | H11: 0 | I11: 12.99 | J11: 465.41 | K11: =SUM(RC[-4]*RC[-1]) -> 10373.9889 | L11: =RC[-3]*RC[-2] -> 6045.6759000000002
A12: 30 | B12: 010408001002 | C12: 后浇带 | D12: C35现浇砼板后浇带；混凝土拌和料 要求：采用微膨胀砼（膨胀剂按45kg /m3考虑） | E12: m3 | F12: 82.95 | G12: 82.95 | H12: 0 | I12: 42.95 | J12: 465.41 | K12: =SUM(RC[-4]*RC[-1]) -> 38605.7595 | L12: =RC[-3]*RC[-2] -> 19989.359500000002
A13: 31 | B13: 010416001007 | C13: 现浇混凝土钢筋 | D13: 一级圆钢(HPB300)综合，包括墙体拉 结筋；包括钢筋制作安装，非绑扎接 头的安装(如焊接和机械连接) | E13: t | F13: 51.271 | G13: 5 | H13: 46.271000000000001 | I13: 0 | J13: 4039.21 | K13: =SUM(RC[-4]*RC[-1]) -> 20196.05 | L13: =RC[-3]*RC[-2] -> 0
A14: 32 | B14: 010416001008 | C14: 现浇混凝土钢筋 | D14: 三级螺纹钢(HRB400E)综合；包括钢 筋制作安装，非绑扎接头的安装(如 焊接和机械连接) | E14: t | F14: 2512.763 | G14: 200 | H14: 2312.7600000000002 | I14: 100 | J14: 3657.01 | K14: =SUM(RC[-4]*RC[-1]) -> 731402 | L14: =RC[-3]*RC[-2] -> 365701
A15: 33 | B15: 010417002004 | C15: 预埋铁件 | D15: 预埋铁件，含防锈漆 | E15: t | F15: 5.325 | G15: 1 | H15: 4.3250000000000002 | I15: 1 | J15: 7679.36 | K15: =SUM(RC[-4]*RC[-1]) -> 7679.36 | L15: =RC[-3]*RC[-2] -> 7679.36
A16: 合 计 | K16: =SUM(R[-11]C:R[-1]C) -> 1632487.7583999999 | L16: =SUM(R[-11]C:R[-1]C) -> 848760.63539999991
B18: 项目经理： | D18: 日期： | G18: 监理审核人： | J18: 日期：

Sheet: 后勤服务楼
A1: 表1-2 分部分项工程量清单及计价表( 号清单)
A2: 单位及专业工程名称：后勤服务楼-建筑工程
A3: 序号 | B3: 项目编码 | C3: 项目名称 | D3: 项目特征 描述 | E3: 计量 单位 | F3: 清单工程量 | G3: 上报完成工程量 | H3: 至上月累计审核工程量 | I3: 监理审核工程量 | J3: 综合单价 (元) | K3: 合价(元)
K4: 申报合价 | L4: 监理审核
A5: 6 | B5: 010402001025 | C5: 矩形柱 | D5: C30现浇砼矩形柱 | E5: m3 | F5: 157.14 | G5: 79 | H5: 78.14 | I5: 79 | J5: 443.91 | K5: =SUM(RC[-4]*RC[-1]) -> 35068.89 | L5: =RC[-3]*RC[-2] -> 35068.89
A6: 7 | B6: 010402001026 | C6: 矩形柱 | D6: C35现浇砼矩形柱 | E6: m3 | F6: 2.5 | G6: 0 | H6: 2.5 | I6: 0 | J6: 464.92 | K6: =SUM(RC[-4]*RC[-1]) -> 0 | L6: =RC[-3]*RC[-2] -> 0
A7: 8 | B7: 010403002012 | C7: 矩形梁 | D7: C30现浇砼矩形梁 | E7: m3 | F7: 491.34 | G7: 246 | H7: 245.34 | I7: 246 | J7: 417.26 | K7: =SUM(RC[-4]*RC[-1]) -> 102645.95999999999 | L7: =RC[-3]*RC[-2] -> 102645.95999999999
A8: 9 | B8: 010403004008 | C8: 圈梁 | D8: C25现浇砼圈梁 | E8: m3 | F8: 16.9 | G8: 0 | H8: 0 | I8: 0 | J8: 422.28 | K8: =SUM(RC[-4]*RC[-1]) -> 0 | L8: =RC[-3]*RC[-2] -> 0
A9: 10 | B9: 010403005007 | C9: 过梁 | D9: C25现浇砼过梁 | E9: m3 | F9: 3.52 | G9: 0 | H9: 0 | I9: 0 | J9: 422.28 | K9: =SUM(RC[-4]*RC[-1]) -> 0 | L9: =RC[-3]*RC[-2] -> 0
A10: 11 | B10: 010404001023 | C10: 直形墙 | D10: C30现浇砼直形墙 | E10: m3 | F10: 47.09 | G10: 23 | H10: 24.09 | I10: 23 | J10: 436.46 | K10: =SUM(RC[-4]*RC[-1]) -> 10038.58 | L10: =RC[-3]*RC[-2] -> 10038.58
A11: 12 | B11: 010405003027 | C11: 平板 | D11: C30现浇砼板 | E11: m3 | F11: 381 | G11: 191 | H11: 190 | I11: 171 | J11: 418.48 | K11: =SUM(RC[-4]*RC[-1]) -> 79929.680000000008 | L11: =RC[-3]*RC[-2] -> 71560.08
A12: 13 | B12: 010405003028 | C12: 平板 | D12: C20素砼翻边 | E12: m3 | F12: 0.4 | G12: 0.4 | H12: 0 | I12: 0.4 | J12: 388.34 | K12: =SUM(RC[-4]*RC[-1]) -> 155.33600000000001 | L12: =RC[-3]*RC[-2] -> 155.33600000000001
A13: 14 | B13: 010405003029 | C13: 平板 | D13: C30素砼翻边 | E13: m3 | F13: 0.44 | G13: 0 | H13: 0.44 | I13: 0 | J13: 418.48 | K13: =SUM(RC[-4]*RC[-1]) -> 0 | L13: =RC[-3]*RC[-2] -> 0
A14: 15 | B14: 010405006007 | C14: 栏板 | D14: C30现浇砼栏板 | E14: m3 | F14: 15.34 | G14: 0 | H14: 0 | I14: 0 | J14: 486.43 | K14: =SUM(RC[-4]*RC[-1]) -> 0 | L14: =RC[-3]*RC[-2] -> 0
A15: 16 | B15: 010405008007 | C15: 雨篷、阳台板 | D15: C30现浇砼雨篷板 | E15: m3 | F15: 0.75 | G15: 0 | H15: 0 | I15: 0 | J15: 438.8 | K15: =SUM(RC[-4]*RC[-1]) -> 0 | L15: =RC[-3]*RC[-2] -> 0
A16: 17 | B16: 010406001008 | C16: 直形楼梯 | D16: C30现浇砼直形楼梯 | E16: m2 | F16: 108.27 | G16: 54.27 | H16: 54 | I16: 54.27 | J16: 103.91 | K16: =SUM(RC[-4]*RC[-1]) -> 5639.1957000000002 | L16: =RC[-3]*RC[-2] -> 5639.1957000000002
A17: 21 | B17: 010416001015 | C17: 现浇混凝土钢筋 | D17: 一级圆钢（HPB300）综合，包括墙体 拉结筋；包括钢筋制作安装，非绑扎 接头的安装（如焊接和机械连接） | E17: t | F17: 5.581 | G17: 3 | H17: 2.581 | I17: 2 | J17: 4039.21 | K17: =SUM(RC[-4]*RC[-1]) -> 12117.630000000001 | L17: =RC[-3]*RC[-2] -> 8078.42
A18: 22 | B18: 010416001016 | C18: 现浇混凝土钢筋 | D18: 三级螺纹钢（HRB400E）综合；包括 钢筋制作安装，非绑扎接头的安装（ 如焊接和机械连接） | E18: t | F18: 171.455 | G18: 86 | H18: 85.454999999999998 | I18: 80 | J18: 3657.01 | K18: =SUM(RC[-4]*RC[-1]) -> 314502.86000000004 | L18: =RC[-3]*RC[-2] -> 292560.80000000005
A19: 23 | B19: 010417002008 | C19: 预埋铁件 | D19: 预埋铁件，含防锈漆 | E19: t | F19: 0.35 | G19: 0 | H19: 0.35 | I19: 0 | J19: 7679.36 | K19: =SUM(RC[-4]*RC[-1]) -> 0 | L19: =RC[-3]*RC[-2] -> 0
A20: 合 计 | K20: =SUM(R[-15]C:R[-1]C) -> 560098.13170000003 | L20: =SUM(R[-15]C:R[-1]C) -> 525747.26170000003
B22: 项目经理： | D22: 日期： | G22: 监理审核人： | J22: 日期：

Sheet: 高压氧仓楼
A1: 表1-2 分部分项工程量清单及计价表( 号清单)
A2: 单位及专业工程名称：高压氧仓楼-建筑工程
A3: 序号 | B3: 项目编码 | C3: 项目名称 | D3: 项目特征 描述 | E3: 计量 单位 | F3: 清单工程量 | G3: 上报完成工程量 | H3: 至上月累计审核工程量 | I3: 监理审核工程量 | J3: 综合单价 (元) | K3: 合价(元)
K4: 申报合价 | L4: 监理审核
A5: 1 | B5: 010302001036 | C5: 实心砖墙 | D5: 200厚KP5型页岩砖（MU7.5），M5.0 混合砂浆砌筑，砌体容重≤14KN/m3 | E5: m3 | F5: 101.38 | G5: 101.38 | H5: 0 | I5: 101.38 | J5: 375.18 | K5: =SUM(RC[-4]*RC[-1]) -> 38035.748399999997 | L5: =RC[-3]*RC[-2] -> 38035.748399999997
A6: 2 | B6: 010302001037 | C6: 实心砖墙 | D6: 100厚KP5型页岩砖（MU7.5），M5.0 混合砂浆砌筑，砌体容重≤14KN/m3 | E6: m3 | F6: 4.87 | G6: 4.87 | H6: 0 | I6: 4.87 | J6: 399.87 | K6: =SUM(RC[-4]*RC[-1]) -> 1947.3669 | L6: =RC[-3]*RC[-2] -> 1947.3669
A7: 3 | B7: 010302001038 | C7: 实心砖墙 | D7: 240厚KP5型页岩砖（MU10），M7.5水 泥砂浆砌筑，砌体容重≤14KN/m3 | E7: m3 | F7: 30.42 | G7: 30.42 | H7: 0 | I7: 30.42 | J7: 390.3 | K7: =SUM(RC[-4]*RC[-1]) -> 11872.926000000001 | L7: =RC[-3]*RC[-2] -> 11872.926000000001
A8: 4 | B8: 010402001022 | C8: 矩形柱 | D8: C25现浇砼构造柱 | E8: m3 | F8: 5.58 | G8: 5.58 | H8: 0 | I8: 5.58 | J8: 473.24 | K8: =SUM(RC[-4]*RC[-1]) -> 2640.6792 | L8: =RC[-3]*RC[-2] -> 2640.6792
A9: 8 | B9: 010404001022 | C9: 直形墙 | D9: C30现浇砼女儿墙 | E9: m3 | F9: 18.96 | G9: 18.96 | H9: 0 | I9: 18.96 | J9: 436.46 | K9: =SUM(RC[-4]*RC[-1]) -> 8275.2816000000003 | L9: =RC[-3]*RC[-2] -> 8275.2816000000003
A10: 10 | B10: 010405003026 | C10: 平板 | D10: C20素砼翻边 | E10: m3 | F10: 0.83 | G10: 0.83 | H10: 0 | I10: 0.83 | J10: 388.34 | K10: =SUM(RC[-4]*RC[-1]) -> 322.32219999999995 | L10: =RC[-3]*RC[-2] -> 322.32219999999995
A11: 11 | B11: 010405006006 | C11: 栏板 | D11: C30现浇砼栏板 | E11: m3 | F11: 1.46 | G11: 1.46 | H11: 0 | I11: 1.46 | J11: 486.43 | K11: =SUM(RC[-4]*RC[-1]) -> 710.18780000000004 | L11: =RC[-3]*RC[-2] -> 710.18780000000004
A12: 合 计 | K12: =SUM(R[-7]C:R[-1]C) -> 63804.5121 | L12: =SUM(R[-7]C:R[-1]C) -> 63804.5121