Sheet: Z21表1-3-C地下室建筑
A1: 表1-3-C 技术措施项目清单及计价表
A2: 工程名称：杭州市中医院丁桥分院工程
A3: 单位及专业工程名称：地下室-建筑工程
A4: 序号 | B4: 项目编码 | C4: 项目名称 | D4: 项目特征 描述 | E4: 计量 单位 | F4: 清单工程量 | G4: 上报完成工程量 | H4: 至上月累计审核工程量 | I4: 监理审核工程量 | J4: 综合单价 (元) | K4: 合价(元)
K5: 申报合价 | L5: 监理审核
C6: T.2特、大型机械进出场及安拆费
A7: 3 | B7: 000002001011 | C7: 塔式起重机基础费用 | E7: 项 | F7: 1.00 | G7: 0 | H7: 25690.2 | I7: 0 | K7: 0 | L7: 0
A8: 4 | B8: 000002002011 | C8: 施工电梯固定基础费用 | E8: 项 | F8: 1.00 | G8: 32500 | H8: 32500 | I8: 0 | K8: 0 | L8: 0
A9: 5 | B9: 000002003011 | C9: 特、大型机械安拆费 | D9: 特、大型机械安拆费 | E9: 项 | F9: 1.00 | G9: 87721.87 | H9: 207722 | I9: 0 | K9: 87721.87 | L9: 13000
A10: 6 | B10: 000002004011 | C10: 特、大型机械进出场费 | D10: 特、大型机械进出场费 | E10: 项 | F10: 1.00 | G10: 53013.55 | H10: 173014 | I10: 0 | K10: 53013.55 | L10: 5875
C11: A.9混凝土、钢筋混凝土模板及支架工程
A12: 14 | B12: 010902001037 | C12: 柱模板 | D12: 矩形柱模板（层高6.6m以内） | E12: m2 | F12: 5211.3500000000004 | G12: 120 | H12: 5211.3500000000004 | I12: 0 | J12: 38.04 | K12: =SUM(RC[-4]*RC[-1]) -> 4564.8 | L12: =RC[-3]*RC[-2] -> 0
A13: 16 | B13: 010902002044 | C13: 梁模板 | D13: 矩形梁模板（层高4.6m以内） | E13: m2 | F13: 26.27 | G13: 1.6 | H13: 26.27 | I13: 0 | J13: 43.74 | K13: =SUM(RC[-4]*RC[-1]) -> 69.984000000000009 | L13: =RC[-3]*RC[-2] -> 0
A14: 17 | B14: 010902002045 | C14: 梁模板 | D14: 矩形梁模板（层高5.6m以内） | E14: m2 | F14: 16480.29 | G14: 1200 | H14: 16480.29 | I14: 0 | J14: 47.19 | K14: =SUM(RC[-4]*RC[-1]) -> 56628 | L14: =RC[-3]*RC[-2] -> 0
A15: 18 | B15: 010902002046 | C15: 梁模板 | D15: 矩形梁模板（层高6.6m以内） | E15: m2 | F15: 14762.37 | G15: 700 | H15: 14762.37 | I15: 0 | J15: 50.64 | K15: =SUM(RC[-4]*RC[-1]) -> 35448 | L15: =RC[-3]*RC[-2] -> 0
A16: 20 | B16: 010902003022 | C16: 墙模板 | D16: 直形墙模板（层高3.6m以内） | E16: m2 | F16: 141.19 | G16: 14.119 | H16: 141.19 | I16: 0 | J16: 25.39 | K16: =SUM(RC[-4]*RC[-1]) -> 358.48140999999998 | L16: 0
A17: 21 | B17: 010902003023 | C17: 墙模板 | D17: 直形墙模板（层高4.6m以内） | E17: m2 | F17: 132.51 | G17: 10.250999999999999 | H17: 132.51 | I17: 0 | J17: 27.37 | K17: =SUM(RC[-4]*RC[-1]) -> 280.56986999999998 | L17: =RC[-3]*RC[-2] -> 0
A18: 22 | B18: 010902003024 | C18: 墙模板 | D18: 直形墙模板（层高5.6m以内） | E18: m2 | F18: 22030.42 | G18: 1400 | H18: 22030.42 | I18: 0 | J18: 29.35 | K18: =SUM(RC[-4]*RC[-1]) -> 41090 | L18: =RC[-3]*RC[-2] -> 0
A19: 23 | B19: 010902003025 | C19: 墙模板 | D19: 直形墙模板（层高6.6m以内） | E19: m2 | F19: 20752.22 | G19: 1600 | H19: 20752.22 | I19: 0 | J19: 31.33 | K19: =SUM(RC[-4]*RC[-1]) -> 50128 | L19: =RC[-3]*RC[-2] -> 0
A20: 24 | B20: 010902003026 | C20: 墙模板 | D20: 直线加速器区域直形墙模板（ 层高6.6m以内）；施工单位自 行设计专项方案并考虑相应报 价 | E20: m2 | F20: 654.74 | G20: 65.474000000000004 | H20: 654.74 | I20: 0 | J20: 576.16999999999996 | K20: =SUM(RC[-4]*RC[-1]) -> 37724.154580000002 | L20: 0
A21: 25 | B21: 010902004034 | C21: 板模板 | D21: 平板模板（层高4.6m以内） | E21: m2 | F21: 126.93 | G21: 10 | H21: 126.93 | I21: 0 | J21: 31.86 | K21: =SUM(RC[-4]*RC[-1]) -> 318.60000000000002 | L21: =RC[-3]*RC[-2] -> 0
A22: 26 | B22: 010902004035 | C22: 板模板 | D22: 平板模板（层高5.6m以内） | E22: m2 | F22: 19140.650000000001 | G22: 1500 | H22: 19140.650000000001 | I22: 0 | J22: 34.979999999999997 | K22: =SUM(RC[-4]*RC[-1]) -> 52469.999999999993
A23: 27 | B23: 010902004036 | C23: 板模板 | D23: 平板模板（层高6.6m以内） | E23: m2 | F23: 12376.1 | G23: 900 | H23: 12376.1 | I23: 0 | J23: 38.119999999999997 | K23: =SUM(RC[-4]*RC[-1]) -> 34308 | L23: =RC[-3]*RC[-2] -> 0
A24: 28 | B24: 010902004037 | C24: 板模板 | D24: 直线加速器区域平板模板（层 高6.6m以内）；施工单位自行 设计专项方案并考虑相应报价 | E24: m2 | F24: 105.84 | G24: 10.5 | H24: 105.84 | I24: 0 | J24: 190.51 | L24: 0
A25: 30 | B25: 010902007010 | C25: 楼梯模板 | D25: 直形楼梯模板 | E25: m2 | F25: 722.51 | G25: 300 | H25: 1222.51 | I25: -500 | J25: 111.75 | K25: =SUM(RC[-4]*RC[-1]) -> 33525 | L25: =RC[-3]*RC[-2] -> -55875
A26: 36 | B26: 011301001001 | C26: 洞库照明费 | D26: 建筑面积为39723.11m2 | E26: 项 | F26: 1.00 | G26: 300000 | H26: 347487 | I26: 0 | J26: 647486.68999999994 | K26: 300000 | L26: 50000
B27: 合计 | K27: =SUM(R[-20]C:R[-1]C) -> 787649.00985999999 | L27: =SUM(R[-20]C:R[-1]C) -> 13000
A28: 项目经理 日期 监理审核人 日期

Sheet: 3#病房楼
A1: 表1-3-C 技术措施项目清单及计价表
A2: 工程名称：杭州市中医院丁桥分院工程
A3: 单位及专业工程名称：3#病房楼
A4: 序号 | B4: 项目编码 | C4: 项目名称 | D4: 项目特征 描述 | E4: 计量 单位 | F4: 清单工程量 | G4: 上报完成工程量 | H4: 至上月累计审核工程量 | I4: 监理审核工程量 | J4: 综合单价 (元) | K4: 合价(元)
K5: 申报合价 | L5: 监理审核
A6: 5 | B6: 010902001009 | C6: 柱模板 | D6: 构造柱模板 | E6: m2 | F6: 1071.6400000000001 | G6: 871.64 | H6: 0 | I6: 671.64 | J6: 32.03 | K6: =SUM(RC[-4]*RC[-1]) -> 27918.629199999999 | L6: =RC[-3]*RC[-2] -> 21512.629199999999
A7: 7 | B7: 010902001011 | C7: 柱模板 | D7: 矩形柱模板（层高4.6m以内） | E7: m2 | F7: 3400.22 | G7: 100 | H7: 3300.22 | I7: 100 | J7: 34.04 | K7: =SUM(RC[-4]*RC[-1]) -> 3404 | L7: =RC[-3]*RC[-2] -> 3404
A8: 9 | B8: 010902002011 | C8: 梁模板 | D8: 矩形梁模板（层高3.6m以内） | E8: m2 | F8: 411.43 | G8: 100 | H8: 311.43 | I8: 100 | J8: 40.299999999999997 | K8: =SUM(RC[-4]*RC[-1]) -> 4029.9999999999995 | L8: =RC[-3]*RC[-2] -> 4029.9999999999995
A9: 12 | B9: 010902002014 | C9: 梁模板 | D9: 圈梁模板 | E9: m2 | F9: 133.1 | G9: 103.1 | H9: 0 | I9: 83.1 | J9: 28.86 | K9: =SUM(RC[-4]*RC[-1]) -> 2975.4659999999999 | L9: =RC[-3]*RC[-2] -> 2398.2659999999996
A10: 13 | B10: 010902002015 | C10: 梁模板 | D10: 过梁模板 | E10: m2 | F10: 127.66 | G10: 107.66 | H10: 0 | I10: 77.66 | J10: 28.86 | K10: =SUM(RC[-4]*RC[-1]) -> 3107.0675999999999 | L10: =RC[-3]*RC[-2] -> 2241.2675999999997
A11: 14 | B11: 010902003007 | C11: 墙模板 | D11: 直形墙模板（层高4.6m以内） | E11: m2 | F11: 6526.12 | G11: 200 | H11: 6326.12 | I11: 200 | J11: 27.37 | K11: =SUM(RC[-4]*RC[-1]) -> 5474 | L11: =RC[-3]*RC[-2] -> 5474
A12: 16 | B12: 010902003009 | C12: 墙模板 | D12: 女儿墙模板 | E12: m2 | F12: 734.33 | G12: 734.33 | H12: 0 | I12: 734.33 | J12: 25.39 | K12: =SUM(RC[-4]*RC[-1]) -> 18644.638700000003 | L12: =RC[-3]*RC[-2] -> 18644.638700000003
A13: 17 | B13: 010902004009 | C13: 板模板 | D13: 平板模板（层高3.6m以内） | E13: m2 | F13: 48.26 | G13: 10 | H13: 38.26 | I13: 10 | J13: 28.72 | K13: =SUM(RC[-4]*RC[-1]) -> 287.2 | L13: =RC[-3]*RC[-2] -> 287.2
A14: 20 | B14: 010902004012 | C14: 板模板 | D14: 翻边模板 | E14: m2 | F14: 399.08 | G14: 40 | H14: 359.08 | I14: 0 | J14: 28.72 | K14: =SUM(RC[-4]*RC[-1]) -> 1148.8 | L14: =RC[-3]*RC[-2] -> 0
A15: 21 | B15: 010902005003 | C15: 栏板模板 | D15: 栏板模板 | E15: m2 | F15: 131.37 | G15: 40 | H15: 81.37 | I15: 50 | J15: 28.59 | K15: =SUM(RC[-4]*RC[-1]) -> 1143.5999999999999 | L15: =RC[-3]*RC[-2] -> 1429.5
A16: 24 | B16: 010902008003 | C16: 雨篷、阳台板模板 | D16: 雨篷模板 | E16: m2 | F16: 2.52 | G16: 2.52 | H16: 2.52 | I16: 0 | J16: 68.67 | K16: =SUM(RC[-4]*RC[-1]) -> 173.04840000000002 | L16: =RC[-3]*RC[-2] -> 0
A17: 25 | B17: 010902009003 | C17: 其他构件模板 | D17: 窗台板模板 | E17: m2 | F17: 420.61 | G17: 160 | H17: 260.61 | I17: 0 | J17: 44.45 | K17: =SUM(RC[-4]*RC[-1]) -> 7112 | L17: =RC[-3]*RC[-2] -> 0
A18: 26 | B18: 011001002003 | C18: 建筑物综合脚手架 | D18: 檐高41.05m；层高6m以内 | E18: m2 | F18: 16623.93 | G18: 1300 | H18: 16623.93 | I18: 0 | J18: 27.45 | K18: =SUM(RC[-4]*RC[-1]) -> 35685 | L18: =RC[-3]*RC[-2] -> 0
A19: 29 | B19: 011101002007 | C19: 建筑物垂直运输 | D19: 檐高41.05m；层高3.9m | E19: m2 | F19: 11672.08 | G19: 7500 | H19: 4172.08 | I19: 2000 | J19: 23 | K19: =SUM(RC[-4]*RC[-1]) -> 172500 | L19: =RC[-3]*RC[-2] -> 46000
A20: 30 | B20: 011101002008 | C20: 建筑物垂直运输 | D20: 檐高41.05m；层高4.2m | E20: m2 | F20: 3325.43 | G20: 2000 | H20: 1325.43 | I20: 0 | J20: 23.73 | K20: =SUM(RC[-4]*RC[-1]) -> 47460 | L20: =RC[-3]*RC[-2] -> 0
A21: 31 | B21: 011101002009 | C21: 建筑物垂直运输 | D21: 檐高41.05m；层高5.1m | E21: m2 | F21: 1626.42 | G21: 1626.42 | H21: 0 | I21: 526.41999999999996 | J21: 25.9 | K21: =SUM(RC[-4]*RC[-1]) -> 42124.277999999998 | L21: =RC[-3]*RC[-2] -> 13634.277999999998
A22: 32 | B22: 011201001003 | C22: 建筑物超高人工降效增 加费 | D22: 檐高41.05m | E22: 项 | F22: 1.00 | G22: 1 | H22: 0 | I22: 0.5 | J22: 119701.51 | K22: =SUM(RC[-4]*RC[-1]) -> 119701.51 | L22: =RC[-3]*RC[-2] -> 59850.754999999997
A23: 33 | B23: 011201002003 | C23: 建筑物超高机械降效增 加费 | D23: 檐高41.05m | E23: 项 | F23: 1.00 | G23: 1 | H23: 0 | I23: 0.5 | J23: 11063.8 | K23: =SUM(RC[-4]*RC[-1]) -> 11063.8 | L23: =RC[-3]*RC[-2] -> 5531.9
A24: 34 | B24: 011201003007 | C24: 建筑物超高加压水泵台 班及其他费用 | D24: 檐高41.05m；层高3.9m | E24: m2 | F24: 11672.08 | G24: 11672.08 | H24: 0 | I24: 5672.08 | J24: 6.19 | K24: =SUM(RC[-4]*RC[-1]) -> 72250.175199999998 | L24: =RC[-3]*RC[-2] -> 35110.175200000005
A25: 35 | B25: 011201003008 | C25: 建筑物超高加压水泵台 班及其他费用 | D25: 檐高41.05m；层高4.2m | E25: m2 | F25: 3325.43 | G25: 3325.43 | H25: 0 | I25: 2325.4299999999998 | J25: 6.22 | K25: =SUM(RC[-4]*RC[-1]) -> 20684.174599999998 | L25: =RC[-3]*RC[-2] -> 14464.174599999998
A26: 36 | B26: 011201003009 | C26: 建筑物超高加压水泵台 班及其他费用 | D26: 檐高41.05m；层高5.1m | E26: m2 | F26: 1626.42 | G26: 1626.42 | H26: 0 | I26: 626.41999999999996 | J26: 6.31 | K26: =SUM(RC[-4]*RC[-1]) -> 10262.7102 | L26: =RC[-3]*RC[-2] -> 3952.7101999999995
B27: 合计 | K27: =SUM(R[-21]C:R[-1]C) -> 607150.09790000005 | L27: =SUM(R[-21]C:R[-1]C) -> 237965.4945
B29: 项目经理： | E29: 日期： | I29: 监理审核人： | K29: 日期：

Sheet: 2#病房楼
A1: 表1-3-C 技术措施项目清单及计价表
A2: 工程名称：杭州市中医院丁桥分院工程
A3: 单位及专业工程名称：2#病房楼-建筑工程
A4: 序号 | B4: 项目编码 | C4: 项目名称 | D4: 项目特征 描述 | E4: 计量 单位 | F4: 清单工程量 | G4: 上报完成工程量 | H4: 至上月累计审核工程量 | I4: 监理审核工程量 | J4: 综合单价 (元) | K4: 合价(元)
K5: 申报合价 | L5: 监理审核
A6: 5 | B6: 010902001005 | C6: 柱模板 | D6: 构造柱模板 | E6: m2 | F6: 1282.81 | G6: 782.81 | H6: 0 | I6: 782.81 | J6: 32.03 | K6: =SUM(RC[-4]*RC[-1]) -> 25073.404299999998 | L6: =RC[-3]*RC[-2] -> 25073.404299999998
A7: 9 | B7: 010902002006 | C7: 梁模板 | D7: 矩形梁模板（层高3.6m以内） | E7: m2 | F7: 411.43 | G7: 50 | H7: 361.43 | I7: 50 | J7: 40.299999999999997 | K7: =SUM(RC[-4]*RC[-1]) -> 2014.9999999999998 | L7: =RC[-3]*RC[-2] -> 2014.9999999999998
A8: 12 | B8: 010902002009 | C8: 梁模板 | D8: 圈梁模板 | E8: m2 | F8: 133.1 | G8: 83.1 | H8: 0 | I8: 73.099999999999994 | J8: 28.86 | K8: =SUM(RC[-4]*RC[-1]) -> 2398.2659999999996 | L8: =RC[-3]*RC[-2] -> 2109.6659999999997
A9: 13 | B9: 010902002010 | C9: 梁模板 | D9: 过梁模板 | E9: m2 | F9: 407.96 | G9: 307.95999999999998 | H9: 0 | I9: 207.96 | J9: 28.86 | K9: =SUM(RC[-4]*RC[-1]) -> 8887.7255999999998 | L9: =RC[-3]*RC[-2] -> 6001.7255999999998
A10: 16 | B10: 010902003006 | C10: 墙模板 | D10: 女儿墙模板 | E10: m2 | F10: 734.33 | G10: 734.33 | H10: 0 | I10: 734.33 | J10: 25.39 | K10: =SUM(RC[-4]*RC[-1]) -> 18644.638700000003 | L10: =RC[-3]*RC[-2] -> 18644.638700000003
K11: =SUM(RC[-4]*RC[-1]) -> 0 | L11: =RC[-3]*RC[-2] -> 0
A12: 17 | B12: 010902004005 | C12: 板模板 | D12: 平板模板（层高3.6m以内） | E12: m2 | F12: 48.26 | G12: 8 | H12: 40.26 | I12: 8 | J12: 28.72 | K12: =SUM(RC[-4]*RC[-1]) -> 229.76 | L12: =RC[-3]*RC[-2] -> 229.76
A13: 20 | B13: 010902004008 | C13: 板模板 | D13: 翻边模板 | E13: m2 | F13: 405.21 | G13: 85 | H13: 320.20999999999998 | I13: 85 | J13: 28.72 | K13: =SUM(RC[-4]*RC[-1]) -> 2441.1999999999998 | L13: =RC[-3]*RC[-2] -> 2441.1999999999998
A14: 21 | B14: 010902005002 | C14: 栏板模板 | D14: 栏板模板 | E14: m2 | F14: 131.37 | G14: 131.37 | H14: 0 | I14: 131.37 | J14: 28.59 | K14: =SUM(RC[-4]*RC[-1]) -> 3755.8683000000001 | L14: =RC[-3]*RC[-2] -> 3755.8683000000001
A15: 22 | B15: 010902006002 | C15: 檐沟、挑檐板模板 | D15: 挑檐板模板 | E15: m2 | F15: 4852.46 | G15: 4852.46 | H15: 0 | I15: 0 | J15: 37.799999999999997 | K15: =SUM(RC[-4]*RC[-1]) -> 183422.98799999998 | L15: =RC[-3]*RC[-2] -> 0
A16: 27 | B16: 011002002002 | C16: 满堂脚手架 | D16: 工作面高度3.6-5.2m | E16: m2 | F16: 16623.93 | G16: 500 | H16: 15723.93 | I16: 900 | J16: 8.09 | K16: =SUM(RC[-4]*RC[-1]) -> 4045 | L16: =RC[-3]*RC[-2] -> 7281
A17: 29 | B17: 011101002004 | C17: 建筑物垂直运输 | D17: 檐高41.05m；层高3.9m | E17: m2 | F17: 11672.08 | G17: 7000 | H17: 4672 | I17: 3000 | J17: 23 | K17: =SUM(RC[-4]*RC[-1]) -> 161000 | L17: =RC[-3]*RC[-2] -> 69000
A18: 30 | B18: 011101002005 | C18: 建筑物垂直运输 | D18: 檐高41.05m；层高4.2m | E18: m2 | F18: 3325.43 | G18: 2000 | H18: 1325.43 | I18: 0 | J18: 23.73 | K18: =SUM(RC[-4]*RC[-1]) -> 47460 | L18: =RC[-3]*RC[-2] -> 0
A19: 31 | B19: 011101002006 | C19: 建筑物垂直运输 | D19: 檐高41.05m；层高5.1m | E19: m2 | F19: 1626.42 | G19: 1626.42 | H19: 0 | I19: 626.41999999999996 | J19: 25.9 | K19: =SUM(RC[-4]*RC[-1]) -> 42124.277999999998 | L19: =RC[-3]*RC[-2] -> 16224.277999999998
A20: 32 | B20: 011201001002 | C20: 建筑物超高人工降效增 加费 | D20: 檐高41.05m | E20: 项 | F20: 1.00 | G20: 1 | H20: 0 | I20: 0.5 | J20: 124148.04 | K20: =SUM(RC[-4]*RC[-1]) -> 124148.04 | L20: =RC[-3]*RC[-2] -> 62074.02
A21: 33 | B21: 011201002002 | C21: 建筑物超高机械降效增 加费 | D21: 檐高41.05m | E21: 项 | F21: 1.00 | G21: 1 | H21: 0 | I21: 0.5 | J21: 11031.37 | K21: =SUM(RC[-4]*RC[-1]) -> 11031.37 | L21: =RC[-3]*RC[-2] -> 5515.6850000000004
A22: 34 | B22: 011201003004 | C22: 建筑物超高加压水泵台 班及其他费用 | D22: 檐高41.05m；层高3.9m | E22: m2 | F22: 11672.08 | G22: 11672.08 | H22: 0 | I22: 5672.08 | J22: 6.19 | K22: =SUM(RC[-4]*RC[-1]) -> 72250.175199999998 | L22: =RC[-3]*RC[-2] -> 35110.175200000005
A23: 35 | B23: 011201003005 | C23: 建筑物超高加压水泵台 班及其他费用 | D23: 檐高41.05m；层高4.2m | E23: m2 | F23: 3325.43 | G23: 3325.43 | H23: 0 | I23: 2325.4299999999998 | J23: 6.22 | K23: =SUM(RC[-4]*RC[-1]) -> 20684.174599999998 | L23: =RC[-3]*RC[-2] -> 14464.174599999998
A24: 36 | B24: 011201003006 | C24: 建筑物超高加压水泵台 班及其他费用 | D24: 檐高41.05m；层高5.1m | E24: m2 | F24: 1626.42 | G24: 1626.42 | H24: 0 | I24: 626.41999999999996 | J24: 6.31 | K24: =SUM(RC[-4]*RC[-1]) -> 10262.7102 | L24: =RC[-3]*RC[-2] -> 3952.7101999999995
B25: 合计 | K25: =SUM(R[-19]C:R[-1]C) -> 739874.59889999998 | L25: =SUM(R[-19]C:R[-1]C) -> 273893.30589999992
B27: 项目经理： | E27: 日期： | I27: 监理审核人： | K27: 日期：

Sheet: 1#病房楼
A1: 表1-3-C 技术措施项目清单及计价表
A2: 工程名称：杭州市中医院丁桥分院工程
A3: 单位及专业工程名称：1#病房楼-建筑工程
A4: 序号 | B4: 项目编码 | C4: 项目名称 | D4: 项目特征 描述 | E4: 计量 单位 | F4: 清单工程量 | G4: 上报完成工程量 | H4: 至上月累计审核工程量 | I4: 监理审核工程量 | J4: 综合单价 (元) | K4: 合价(元)
K5: 申报合价 | L5: 监理审核
A6: 5 | B6: 010902001001 | C6: 柱模板 | D6: 构造柱模板 | E6: m2 | F6: 1342.82 | G6: 642.82000000000005 | H6: 0 | I6: 642.82000000000005 | J6: 32.03 | K6: =SUM(RC[-4]*RC[-1]) -> 20589.524600000001 | L6: =RC[-3]*RC[-2] -> 20589.524600000001
A7: 6 | B7: 010902001002 | C7: 柱模板 | D7: 矩形柱模板（层高3.6m以内） | E7: m2 | F7: 2.92 | G7: 1 | H7: 1.92 | I7: 1 | J7: 32.03 | K7: =SUM(RC[-4]*RC[-1]) -> 32.03 | L7: =RC[-3]*RC[-2] -> 32.03
A8: 7 | B8: 010902001003 | C8: 柱模板 | D8: 矩形柱模板（层高4.6m以内） | E8: m2 | F8: 3406.67 | G8: 406 | H8: 3000.67 | I8: 406 | J8: 34.04 | K8: =SUM(RC[-4]*RC[-1]) -> 13820.24 | L8: =RC[-3]*RC[-2] -> 13820.24
A9: 9 | B9: 010902002001 | C9: 梁模板 | D9: 矩形梁模板（层高3.6m以内） | E9: m2 | F9: 411.43 | G9: 100 | H9: 311.43 | I9: 100 | J9: 40.299999999999997 | K9: =SUM(RC[-4]*RC[-1]) -> 4029.9999999999995 | L9: =RC[-3]*RC[-2] -> 4029.9999999999995
A10: 10 | B10: 010902002002 | C10: 梁模板 | D10: 矩形梁模板（层高4.6m以内） | E10: m2 | F10: 12214.06 | G10: 2000 | H10: 11214.06 | I10: 1000 | J10: 43.74 | K10: =SUM(RC[-4]*RC[-1]) -> 87480 | L10: =RC[-3]*RC[-2] -> 43740
A11: 12 | B11: 010902002004 | C11: 梁模板 | D11: 圈梁模板 | E11: m2 | F11: 133.1 | G11: 83.1 | H11: 0 | I11: 63.1 | J11: 28.86 | K11: =SUM(RC[-4]*RC[-1]) -> 2398.2659999999996 | L11: =RC[-3]*RC[-2] -> 1821.066
A12: 13 | B12: 010902002005 | C12: 梁模板 | D12: 过梁模板 | E12: m2 | F12: 407.96 | G12: 307.95999999999998 | H12: 0 | I12: 207.96 | J12: 28.86 | K12: =SUM(RC[-4]*RC[-1]) -> 8887.7255999999998 | L12: =RC[-3]*RC[-2] -> 6001.7255999999998
A13: 14 | B13: 010902003001 | C13: 墙模板 | D13: 直形墙模板（层高4.6m以内） | E13: m2 | F13: 6506.55 | G13: 700 | H13: 5850.55 | I13: 656 | J13: 27.37 | K13: =SUM(RC[-4]*RC[-1]) -> 19159 | L13: =RC[-3]*RC[-2] -> 17954.72
A14: 16 | B14: 010902003003 | C14: 墙模板 | D14: 女儿墙模板 | E14: m2 | F14: 734.33 | G14: 0 | H14: 0 | I14: 734.33 | J14: 25.39 | K14: =SUM(RC[-4]*RC[-1]) -> 0 | L14: =RC[-3]*RC[-2] -> 18644.638700000003
I15: 0 | K15: =SUM(RC[-4]*RC[-1]) -> 0 | L15: =RC[-3]*RC[-2] -> 0
A16: 17 | B16: 010902004001 | C16: 板模板 | D16: 平板模板（层高3.6m以内） | E16: m2 | F16: 48.26 | G16: 20 | H16: 28.26 | I16: 20 | J16: 28.72 | K16: =SUM(RC[-4]*RC[-1]) -> 574.4 | L16: =RC[-3]*RC[-2] -> 574.4
A17: 18 | B17: 010902004002 | C17: 板模板 | D17: 平板模板（层高4.6m以内） | E17: m2 | F17: 12997.09 | G17: 2097 | H17: 10900.09 | I17: 2097 | J17: 31.86 | K17: =SUM(RC[-4]*RC[-1]) -> 66810.42 | L17: =RC[-3]*RC[-2] -> 66810.42
A18: 20 | B18: 010902004004 | C18: 板模板 | D18: 翻边模板 | E18: m2 | F18: 430.48 | G18: 50 | H18: 380.48 | I18: 0 | J18: 28.72 | K18: =SUM(RC[-4]*RC[-1]) -> 1436 | L18: =RC[-3]*RC[-2] -> 0
A19: 23 | B19: 010902007001 | C19: 楼梯模板 | D19: 直形楼梯模板 | E19: m2 | F19: 675.17 | G19: 75 | H19: 600.16999999999996 | I19: 75 | J19: 111.75 | K19: =SUM(RC[-4]*RC[-1]) -> 8381.25 | L19: =RC[-3]*RC[-2] -> 8381.25
A20: 26 | B20: 011001002001 | C20: 建筑物综合脚手架 | D20: 檐高41.05m；层高6m以内 | E20: m2 | F20: 16623.93 | G20: 1623.93 | H20: 15000.93 | I20: 1623 | J20: 27.45 | K20: =SUM(RC[-4]*RC[-1]) -> 44576.878499999999 | L20: =RC[-3]*RC[-2] -> 44551.35
A21: 27 | B21: 011002002001 | C21: 满堂脚手架 | D21: 工作面高度3.6-5.2m | E21: m2 | F21: 16623.93 | G21: 1123.93 | H21: 14500.93 | I21: 2123 | J21: 8.09 | K21: =SUM(RC[-4]*RC[-1]) -> 9092.5937000000013 | L21: =RC[-3]*RC[-2] -> 17175.07
A22: 28 | B22: 011002003001 | C22: 电梯井脚手架 | D22: 电梯井脚手架；高度51.28m | E22: 座 | F22: 7 | G22: 1 | H22: 6 | I22: 1 | J22: 4401.17 | K22: =SUM(RC[-4]*RC[-1]) -> 4401.17 | L22: =RC[-3]*RC[-2] -> 4401.17
A23: 29 | B23: 011101002001 | C23: 建筑物垂直运输 | D23: 檐高41.05m；层高3.9m | E23: m2 | F23: 11672.08 | G23: 8000 | H23: 2172.08 | I23: 5000 | J23: 23 | K23: =SUM(RC[-4]*RC[-1]) -> 184000 | L23: =RC[-3]*RC[-2] -> 115000
A24: 30 | B24: 011101002002 | C24: 建筑物垂直运输 | D24: 檐高41.05m；层高4.2m | E24: m2 | F24: 3325.43 | G24: 2325.4299999999998 | H24: 0 | I24: 2325.4299999999998 | J24: 23.73 | K24: =SUM(RC[-4]*RC[-1]) -> 55182.4539 | L24: =RC[-3]*RC[-2] -> 55182.4539
A25: 31 | B25: 011101002003 | C25: 建筑物垂直运输 | D25: 檐高41.05m；层高5.1m | E25: m2 | F25: 1626.42 | G25: 1626.42 | H25: 0 | I25: 626.41999999999996 | J25: 25.9 | K25: =SUM(RC[-4]*RC[-1]) -> 42124.277999999998 | L25: =RC[-3]*RC[-2] -> 16224.277999999998
A26: 32 | B26: 011201001001 | C26: 建筑物超高人工降效增 加费 | D26: 檐高41.05m | E26: 项 | F26: 1.00 | G26: 1 | H26: 0 | I26: 0.5 | J26: 125283.32 | K26: =SUM(RC[-4]*RC[-1]) -> 125283.32 | L26: =RC[-3]*RC[-2] -> 62641.66
A27: 33 | B27: 011201002001 | C27: 建筑物超高机械降效增 加费 | D27: 檐高41.05m | E27: 项 | F27: 1.00 | G27: 1 | H27: 0 | I27: 0.5 | J27: 11059.76 | K27: =SUM(RC[-4]*RC[-1]) -> 11059.76 | L27: =RC[-3]*RC[-2] -> 5529.88
A28: 34 | B28: 011201003001 | C28: 建筑物超高加压水泵台 班及其他费用 | D28: 檐高41.05m；层高3.9m | E28: m2 | F28: 11672.08 | G28: 11672.08 | H28: 0 | I28: 5672.08 | J28: 6.19 | K28: =SUM(RC[-4]*RC[-1]) -> 72250.175199999998 | L28: =RC[-3]*RC[-2] -> 35110.175200000005
A29: 35 | B29: 011201003002 | C29: 建筑物超高加压水泵台 班及其他费用 | D29: 檐高41.05m；层高4.2m | E29: m2 | F29: 3325.43 | G29: 3325.43 | H29: 0 | I29: 2325.4299999999998 | J29: 6.22 | K29: =SUM(RC[-4]*RC[-1]) -> 20684.174599999998 | L29: =RC[-3]*RC[-2] -> 14464.174599999998
A30: 36 | B30: 011201003003 | C30: 建筑物超高加压水泵台 班及其他费用 | D30: 檐高41.05m；层高5.1m | E30: m2 | F30: 1626.42 | G30: 1626.42 | H30: 0 | I30: 626.41999999999996 | J30: 6.31 | K30: =SUM(RC[-4]*RC[-1]) -> 10262.7102 | L30: =RC[-3]*RC[-2] -> 3952.7101999999995
B31: 合计 | K31: =SUM(R[-25]C:R[-1]C) -> 812516.37029999995 | L31: =SUM(R[-25]C:R[-1]C) -> 576632.93680000002
B33: 项目经理： | E33: 日期： | I33: 监理审核人： | K33: 日期：

Sheet: 行政科研楼
A1: 表1-3-C 技术措施项目清单及计价表
A2: 工程名称：杭州市中医院丁桥分院工程
A3: 单位及专业工程名称：行政科研楼-建筑工程
A4: 序号 | B4: 项目编码 | C4: 项目名称 | D4: 项目特征 描述 | E4: 计量 单位 | F4: 清单工程量 | G4: 上报完成工程量 | H4: 至上月累计审核工程量 | I4: 监理审核工程量 | J4: 综合单价 (元) | K4: 合价(元)
K5: 申报合价 | L5: 监理审核
A6: 5 | B6: 010902001021 | C6: 柱模板 | D6: 构造柱模板 | E6: m2 | F6: 1755.94 | G6: 955.94 | H6: 0 | I6: 1055.94 | J6: 32.03 | K6: =SUM(RC[-4]*RC[-1]) -> 30618.758200000004 | L6: =RC[-3]*RC[-2] -> 33821.758200000004
A7: 6 | B7: 010902001022 | C7: 柱模板 | D7: 矩形柱模板（层高3.6m以内） | E7: m2 | F7: 2650.22 | G7: 150 | H7: 2500.2199999999998 | I7: 150 | J7: 32.03 | K7: =SUM(RC[-4]*RC[-1]) -> 4804.5 | L7: =RC[-3]*RC[-2] -> 4804.5
A8: 9 | B8: 010902002026 | C8: 梁模板 | D8: 矩形梁模板（层高3.6m以内） | E8: m2 | F8: 16094.19 | G8: 94 | H8: 16000.19 | I8: 94 | J8: 40.299999999999997 | K8: =SUM(RC[-4]*RC[-1]) -> 3788.2 | L8: =RC[-3]*RC[-2] -> 3788.2
A9: 14 | B9: 010902003014 | C9: 墙模板 | D9: 直形墙模板（层高3.6m以内） | E9: m2 | F9: 3743.17 | G9: 100 | H9: 3743.17 | I9: 0 | J9: 25.39 | K9: =SUM(RC[-4]*RC[-1]) -> 2539 | L9: =RC[-3]*RC[-2] -> 0
K10: =SUM(RC[-4]*RC[-1]) -> 0 | L10: =RC[-3]*RC[-2] -> 0
A11: 18 | B11: 010902004020 | C11: 板模板 | D11: 平板模板（层高3.6m以内） | E11: m2 | F11: 12512.11 | G11: 500 | H11: 12012.11 | I11: 500 | J11: 28.72 | K11: =SUM(RC[-4]*RC[-1]) -> 14360 | L11: =RC[-3]*RC[-2] -> 14360
A12: 22 | B12: 010902005005 | C12: 栏板模板 | D12: 栏板模板 | E12: m2 | F12: 166.15 | G12: 166.15 | H12: 0 | I12: 166.15 | J12: 28.59 | K12: =SUM(RC[-4]*RC[-1]) -> 4750.2285000000002 | L12: =RC[-3]*RC[-2] -> 4750.2285000000002
A13: 24 | B13: 010902008006 | C13: 雨篷、阳台板模板 | D13: 雨篷模板 | E13: m2 | F13: 19.399999999999999 | G13: 19.399999999999999 | H13: 0 | I13: 0 | J13: 68.67 | K13: =SUM(RC[-4]*RC[-1]) -> 1332.1979999999999 | L13: =RC[-3]*RC[-2] -> 0
A14: 25 | B14: 010902009005 | C14: 其他构件模板 | D14: 窗台板模板 | E14: m2 | F14: 394.57 | G14: 394.57 | H14: 0 | I14: 244.57 | J14: 44.45 | K14: =SUM(RC[-4]*RC[-1]) -> 17538.636500000001 | L14: =RC[-3]*RC[-2] -> 10871.136500000001
A15: 31 | B15: 011101002017 | C15: 建筑物垂直运输 | D15: 檐高46.15m；层高3.6m | E15: m2 | F15: 11804 | G15: 8000 | H15: 3804 | I15: 4000 | J15: 22.28 | K15: =SUM(RC[-4]*RC[-1]) -> 178240 | L15: =RC[-3]*RC[-2] -> 89120
A16: 32 | B16: 011101002018 | C16: 建筑物垂直运输 | D16: 檐高46.15m；层高4.2m | E16: m2 | F16: 2706 | G16: 1700 | H16: 1006 | I16: 1000 | J16: 23.73 | K16: =SUM(RC[-4]*RC[-1]) -> 40341 | L16: =RC[-3]*RC[-2] -> 23730
A17: 33 | B17: 011101002019 | C17: 建筑物垂直运输 | D17: 檐高46.15m；层高5.1m | E17: m2 | F17: 1288 | G17: 500 | H17: 718 | I17: 370 | J17: 25.9 | K17: =SUM(RC[-4]*RC[-1]) -> 12950 | L17: =RC[-3]*RC[-2] -> 9583
I18: 0 | K18: =SUM(RC[-4]*RC[-1]) -> 0 | L18: =RC[-3]*RC[-2] -> 0
A19: 37 | B19: 011201001004 | C19: 建筑物超高人工降效增 加费 | D19: 檐高46.15m | E19: 项 | F19: 1.00 | G19: 1 | H19: 0 | I19: 1 | J19: 122343.81 | K19: =SUM(RC[-4]*RC[-1]) -> 122343.81 | L19: =RC[-3]*RC[-2] -> 122343.81
A20: 38 | B20: 011201002004 | C20: 建筑物超高机械降效增 加费 | D20: 檐高46.15m | E20: 项 | F20: 1.00 | G20: 1 | H20: 0 | I20: 1 | J20: 12643.29 | K20: =SUM(RC[-4]*RC[-1]) -> 12643.29 | L20: =RC[-3]*RC[-2] -> 12643.29
A21: 39 | B21: 011201003010 | C21: 建筑物超高加压水泵台 班及其他费用 | D21: 檐高46.15m；层高3.6m | E21: m2 | F21: 11804 | G21: 11804 | H21: 0 | I21: 5804 | J21: 6.16 | K21: =SUM(RC[-4]*RC[-1]) -> 72712.639999999999 | L21: =RC[-3]*RC[-2] -> 35752.639999999999
A22: 40 | B22: 011201003011 | C22: 建筑物超高加压水泵台 班及其他费用 | D22: 檐高46.15m；层高4.2m | E22: m2 | F22: 2706 | G22: 2706 | H22: 0 | I22: 1706 | J22: 6.22 | K22: =SUM(RC[-4]*RC[-1]) -> 16831.32 | L22: =RC[-3]*RC[-2] -> 10611.32
A23: 41 | B23: 011201003012 | C23: 建筑物超高加压水泵台 班及其他费用 | D23: 檐高46.15m；层高5.1m | E23: m2 | F23: 1288 | G23: 1288 | H23: 0 | I23: 588 | J23: 6.31 | K23: =SUM(RC[-4]*RC[-1]) -> 8127.28 | L23: =RC[-3]*RC[-2] -> 3710.2799999999997
B24: 合计 | K24: =SUM(R[-18]C:R[-1]C) -> 543920.86119999993 | L24: =SUM(R[-18]C:R[-1]C) -> 379890.16320000001
B26: 项目经理： | E26: 日期： | I26: 监理审核人： | K26: 日期：

Sheet: 门诊医技楼
A1: 表1-3-C 技术措施项目清单及计价表
A2: 工程名称：杭州市中医院丁桥分院工程
A3: 单位及专业工程名称：门诊医技楼-建筑工程
A4: 序号 | B4: 项目编码 | C4: 项目名称 | D4: 项目特征 描述 | E4: 计量 单位 | F4: 清单工程量 | G4: 上报完成工程量 | H4: 至上月累计审核工程量 | I4: 监理审核工程量 | J4: 综合单价 (元) | K4: 合价(元)
K5: 申报合价 | L5: 监理审核
A6: 6 | B6: 010902001014 | C6: 柱模板 | D6: 矩形柱模板（层高3.6m以内） | E6: m2 | F6: 1414.18 | G6: 200 | H6: 1214.18 | I6: 200 | J6: 32.03 | K6: =SUM(RC[-4]*RC[-1]) -> 6406 | L6: =RC[-3]*RC[-2] -> 6406
A7: 9 | B7: 010902002016 | C7: 梁模板 | D7: 矩形梁模板（层高3.6m以内） | E7: m2 | F7: 5403.16 | G7: 1000 | H7: 4403.16 | I7: 1000 | J7: 40.299999999999997 | K7: =SUM(RC[-4]*RC[-1]) -> 40300 | L7: =RC[-3]*RC[-2] -> 40300
A8: 17 | B8: 010902004013 | C8: 板模板 | D8: 平板模板（层高3.6m以内） | E8: m2 | F8: 3661.66 | G8: 1000 | H8: 2661.66 | I8: 1000 | J8: 28.72 | K8: =SUM(RC[-4]*RC[-1]) -> 28720 | L8: =RC[-3]*RC[-2] -> 28720
A9: 18 | B9: 010902004014 | C9: 板模板 | D9: 平板模板（层高4.6m以内） | E9: m2 | F9: 34656.559999999998 | G9: 2000 | H9: 32656.560000000001 | I9: 2000 | J9: 31.86 | K9: =SUM(RC[-4]*RC[-1]) -> 63720 | L9: =RC[-3]*RC[-2] -> 63720
A10: 20 | B10: 010902004016 | C10: 板模板 | D10: 翻边模板 | E10: m2 | F10: 126.44 | G10: 30 | H10: 96.44 | I10: 0 | J10: 28.72 | K10: =SUM(RC[-4]*RC[-1]) -> 861.59999999999991 | L10: =RC[-3]*RC[-2] -> 0
A11: 21 | B11: 010902005004 | C11: 栏板模板 | D11: 栏板模板 | E11: m2 | F11: 152.68 | G11: 50 | H11: 52.68 | I11: 0 | J11: 28.59 | K11: =SUM(RC[-4]*RC[-1]) -> 1429.5 | L11: =RC[-3]*RC[-2] -> 0
A12: 25 | B12: 011001002004 | C12: 建筑物综合脚手架 | D12: 檐高18m；层高6m以内 | E12: m2 | F12: 4951.6000000000004 | G12: 0 | H12: 4951.6000000000004 | I12: 0 | J12: 15.7 | K12: =SUM(RC[-4]*RC[-1]) -> 0 | L12: =RC[-3]*RC[-2] -> 0
A13: 26 | B13: 011001002005 | C13: 建筑物综合脚手架 | D13: 檐高13.8m；层高6m以内 | E13: m2 | F13: 56008.44 | G13: 0 | H13: 56008.44 | I13: 0 | J13: 15.7 | K13: =SUM(RC[-4]*RC[-1]) -> 0 | L13: =RC[-3]*RC[-2] -> 0
A14: 28 | B14: 011002002004 | C14: 满堂脚手架 | D14: 工作面高度3.6-5.2m | E14: m2 | F14: 60960.04 | G14: 500 | H14: 56460.04 | I14: 4500 | J14: 8.09 | K14: =SUM(RC[-4]*RC[-1]) -> 4045 | L14: =RC[-3]*RC[-2] -> 36405
A15: 29 | B15: 011002003004 | C15: 电梯井脚手架 | D15: 电梯井脚手架；高度28.95m | E15: 座 | F15: 6 | G15: 0 | H15: 6 | I15: 0 | J15: 2342.2399999999998 | K15: =SUM(RC[-4]*RC[-1]) -> 0 | L15: =RC[-3]*RC[-2] -> 0
A16: 30 | B16: 011002003005 | C16: 电梯井脚手架 | D16: 电梯井脚手架；高度23.8m | E16: 座 | F16: 8 | G16: 0 | H16: 8 | I16: 0 | J16: 2342.2399999999998 | K16: =SUM(RC[-4]*RC[-1]) -> 0 | L16: =RC[-3]*RC[-2] -> 0
A17: 31 | B17: 011101002010 | C17: 建筑物垂直运输 | D17: 檐高18m；层高3.6m以内 | E17: m2 | F17: 4951.6000000000004 | G17: 4400 | H17: 551.6 | J17: 10.5 | K17: =SUM(RC[-4]*RC[-1]) -> 46200 | L17: =RC[-3]*RC[-2] -> 0
A18: 32 | B18: 011101002011 | C18: 建筑物垂直运输 | D18: 檐高13.8m；层高4.2m | E18: m2 | F18: 56008.44 | G18: 45000 | H18: 6508.44 | I18: 4000 | J18: 11.36 | K18: =SUM(RC[-4]*RC[-1]) -> 511200 | L18: =RC[-3]*RC[-2] -> 45440
A19: 33 | B19: 011101002012 | C19: 建筑物垂直运输 | D19: 檐高9.45m；层高5.1m | E19: m2 | F19: 1810.14 | G19: 0 | H19: 1810.14 | I19: 0 | J19: 12.66 | K19: =SUM(RC[-4]*RC[-1]) -> 0 | L19: =RC[-3]*RC[-2] -> 0
B20: 合计 | K20: =SUM(R[-14]C:R[-1]C) -> 702882.1 | L20: =SUM(R[-14]C:R[-1]C) -> 220991
B22: 项目经理： | E22: 日期： | I22: 监理审核人： | K22: 日期：

Sheet: 发热门诊楼
A1: 表1-3-C 技术措施项目清单及计价表
A2: 工程名称：杭州市中医院丁桥分院工程
A3: 单位及专业工程名称：发热门诊楼-建筑工程
A4: 序号 | B4: 项目编码 | C4: 项目名称 | D4: 项目特征 描述 | E4: 计量 单位 | F4: 清单工程量 | G4: 上报完成工程量 | H4: 至上月累计审核工程量 | I4: 监理审核工程量 | J4: 综合单价 (元) | K4: 合价(元)
K5: 申报合价 | L5: 监理审核
A6: 7 | B6: 010901001002 | C6: 基础模板 | D6: 桩承台基础 | E6: m2 | F6: 267 | G6: 267 | H6: 0 | I6: 267 | J6: 25.19 | K6: =SUM(RC[-4]*RC[-1]) -> 6725.7300000000005 | L6: =RC[-3]*RC[-2] -> 6725.7300000000005
A7: 8 | B7: 010901001003 | C7: 基础模板 | D7: 带形基础模板 | E7: m2 | F7: 171.84 | G7: 171.84 | H7: 0 | I7: 171.84 | J7: 26.63 | K7: =SUM(RC[-4]*RC[-1]) -> 4576.0991999999997 | L7: =RC[-3]*RC[-2] -> 4576.0991999999997
A8: 9 | B8: 010901002002 | C8: 垫层模板 | D8: 垫层模板 | E8: m2 | F8: 59.8 | G8: 59.8 | H8: 0 | I8: 59.8 | J8: 30.23 | K8: =SUM(RC[-4]*RC[-1]) -> 1807.7539999999999 | L8: =RC[-3]*RC[-2] -> 1807.7539999999999
B9: 合计 | K9: =SUM(R[-3]C:R[-1]C) -> 13109.583200000001 | L9: =SUM(R[-3]C:R[-1]C) -> 13109.583200000001

Sheet: 后勤服务楼
A1: 表1-3-C 技术措施项目清单及计价表
A2: 工程名称：杭州市中医院丁桥分院工程
A3: 单位及专业工程名称：后勤服务楼-建筑工程 | J3: 第 1 页 共1 页
A4: 序号 | B4: 项目编码 | C4: 项目名称 | D4: 项目特征 描述 | E4: 计量 单位 | F4: 清单工程量 | G4: 上报完成工程量 | H4: 至上月累计审核工程量 | I4: 监理审核工程量 | J4: 综合单价 (元) | K4: 合价(元)
K5: 申报合价 | L5: 监理审核
A6: 5 | B6: 010901002001 | C6: 垫层模板 | E6: m2 | F6: 54.8 | G6: 0 | H6: 54.8 | I6: 0 | J6: 30.23 | K6: =SUM(RC[-4]*RC[-1]) -> 0 | L6: =RC[-3]*RC[-2] -> 0
A7: 7 | B7: 010902001028 | C7: 柱模板 | D7: 矩形柱模板（层高4.6m以内） | E7: m2 | F7: 453.97 | G7: 453.97 | H7: 0 | I7: 453.97 | J7: 34.04 | K7: =SUM(RC[-4]*RC[-1]) -> 15453.138800000001 | L7: =RC[-3]*RC[-2] -> 15453.138800000001
A8: 8 | B8: 010902001029 | C8: 柱模板 | D8: 矩形柱模板（层高5.6m以内） | E8: m2 | F8: 719.37 | G8: 0 | H8: 719.37 | I8: 0 | J8: 36.03 | K8: =SUM(RC[-4]*RC[-1]) -> 0 | L8: =RC[-3]*RC[-2] -> 0
A9: 9 | B9: 010902002033 | C9: 梁模板 | D9: 矩形梁模板（层高4.6m以内） | E9: m2 | F9: 300.74 | G9: 300.74 | H9: 0 | I9: 300.74 | J9: 43.74 | K9: =SUM(RC[-4]*RC[-1]) -> 13154.367600000001 | L9: =RC[-3]*RC[-2] -> 13154.367600000001
A10: 10 | B10: 010902002034 | C10: 梁模板 | D10: 矩形梁模板（层高5.6m以内） | E10: m2 | F10: 3037.8 | G10: 3037.8 | H10: 3037.8 | I10: 0 | J10: 47.19 | K10: =SUM(RC[-4]*RC[-1]) -> 143353.78200000001 | L10: =RC[-3]*RC[-2] -> 0
A11: 14 | B11: 010902004026 | C11: 板模板 | D11: 平板模板（层高4.6m以内） | E11: m2 | F11: 66.650000000000006 | G11: 66.650000000000006 | H11: 0 | I11: 66.650000000000006 | J11: 31.86 | K11: =SUM(RC[-4]*RC[-1]) -> 2123.4690000000001 | L11: =RC[-3]*RC[-2] -> 2123.4690000000001
A12: 15 | B12: 010902004027 | C12: 板模板 | D12: 平板模板（层高5.6m以内） | E12: m2 | F12: 2417.6 | G12: 300 | H12: 2117.6 | I12: 300 | J12: 34.979999999999997 | K12: =SUM(RC[-4]*RC[-1]) -> 10493.999999999998 | L12: =RC[-3]*RC[-2] -> 10493.999999999998
A13: 18 | B13: 010902007008 | C13: 楼梯模板 | D13: 直形楼梯模板 | E13: m2 | F13: 108.27 | G13: 50 | H13: 58.27 | I13: 50 | J13: 111.75 | K13: =SUM(RC[-4]*RC[-1]) -> 5587.5 | L13: =RC[-3]*RC[-2] -> 5587.5
A14: 21 | B14: 011001002011 | C14: 建筑物综合脚手架 | D14: 檐高9.85m；层高6m以内 | E14: m2 | F14: 2996.85 | G14: 1596.85 | H14: 1596.85 | I14: 1400 | J14: 12.98 | K14: =SUM(RC[-4]*RC[-1]) -> 20727.113000000001 | L14: =RC[-3]*RC[-2] -> 18172
A15: 22 | B15: 011002002009 | C15: 满堂脚手架 | D15: 工作面高度3.6-5.2m | E15: m2 | F15: 2443.5700000000002 | G15: 1200 | H15: 1243.57 | I15: 1000 | J15: 8.09 | K15: =SUM(RC[-4]*RC[-1]) -> 9708 | L15: =RC[-3]*RC[-2] -> 8090
A16: 23 | B16: 011002003009 | C16: 电梯井脚手架 | D16: 电梯井脚手架；高度13.63m | E16: 座 | F16: 2 | G16: 1 | H16: 1 | I16: 1 | J16: 986.48 | K16: =SUM(RC[-4]*RC[-1]) -> 986.48 | L16: =RC[-3]*RC[-2] -> 986.48
A17: 24 | B17: 011002003010 | C17: 电梯井脚手架 | D17: 电梯井脚手架；高度9.83m | E17: 座 | F17: 2 | G17: 1 | H17: 1 | I17: 1 | J17: 986.48 | K17: =SUM(RC[-4]*RC[-1]) -> 986.48 | L17: =RC[-3]*RC[-2] -> 986.48
A18: 25 | B18: 011101002021 | C18: 建筑物垂直运输 | D18: 檐高9.85m；层高3.9m | E18: m2 | F18: 87.5 | G18: 87.5 | H18: 0 | I18: 0 | J18: 10.86 | K18: =SUM(RC[-4]*RC[-1]) -> 950.25 | L18: =RC[-3]*RC[-2] -> 0
A19: 26 | B19: 011101002022 | C19: 建筑物垂直运输 | D19: 檐高9.85m；层高4.8m | E19: m2 | F19: 1429.4 | G19: 1429.4 | H19: 0 | I19: 0 | J19: 12.15 | K19: =SUM(RC[-4]*RC[-1]) -> 17367.210000000003 | L19: =RC[-3]*RC[-2] -> 0
A20: 27 | B20: 011101002023 | C20: 建筑物垂直运输 | D20: 檐高9.85m；层高5.1m | E20: m2 | F20: 1429.4 | G20: 1429.4 | H20: 0 | I20: 0 | J20: 12.58 | K20: =SUM(RC[-4]*RC[-1]) -> 17981.852000000003 | L20: =RC[-3]*RC[-2] -> 0
B21: 合计 | K21: =SUM(R[-15]C:R[-1]C) -> 258873.64240000007 | L21: =SUM(R[-15]C:R[-1]C) -> 75047.435399999988
B23: 项目经理： | E23: 日期： | I23: 监理审核人： | K23: 日期：

Sheet: 高压氧仓楼
A1: 表1-3-C 技术措施项目清单及计价表
A2: 工程名称：杭州市中医院丁桥分院工程
A3: 单位及专业工程名称：高压氧舱楼-建筑工程 | J3: 第 1 页 共 2 页
A4: 序号 | B4: 项目编码 | C4: 项目名称 | D4: 项目特征 描述 | E4: 计量 单位 | F4: 清单工程量 | G4: 上报完成工程量 | H4: 至上月累计审核工程量 | I4: 监理审核工程量 | J4: 综合单价 (元) | K4: 合价(元)
K5: 申报合价 | L5: 监理审核
A6: 8 | B6: 010902002032 | C6: 梁模板 | D6: 圈梁模板 | E6: m2 | F6: 55.38 | G6: 55.38 | H6: 0 | I6: 55.38 | J6: 28.86 | K6: =SUM(RC[-4]*RC[-1]) -> 1598.2668000000001 | L6: =RC[-3]*RC[-2] -> 1598.2668000000001
A7: 9 | B7: 010902003018 | C7: 墙模板 | D7: 女儿墙模板 | E7: m2 | F7: 316.08 | G7: 316.08 | H7: 0 | I7: 316.08 | J7: 25.39 | K7: =SUM(RC[-4]*RC[-1]) -> 8025.2712000000001 | L7: =RC[-3]*RC[-2] -> 8025.2712000000001
A8: 11 | B8: 010902004025 | C8: 板模板 | D8: 翻边模板 | E8: m2 | F8: 3.15 | G8: 3.15 | H8: 0 | I8: 3.15 | J8: 28.72 | K8: =SUM(RC[-4]*RC[-1]) -> 90.467999999999989 | L8: =RC[-3]*RC[-2] -> 90.467999999999989
A9: 12 | B9: 010902005006 | C9: 栏板模板 | D9: 栏板模板 | E9: m2 | F9: 29.15 | G9: 29.15 | H9: 0 | I9: 0 | J9: 28.59 | K9: =SUM(RC[-4]*RC[-1]) -> 833.3984999999999 | L9: =RC[-3]*RC[-2] -> 0
A10: 14 | B10: 010902009006 | C10: 其他构件模板 | D10: 窗台板模板 | E10: m2 | F10: 18.54 | G10: 18.54 | H10: 0 | I10: 0 | J10: 44.45 | K10: =SUM(RC[-4]*RC[-1]) -> 824.10300000000007 | L10: =RC[-3]*RC[-2] -> 0
A11: 15 | B11: 011001002010 | C11: 建筑物综合脚手架 | D11: 檐高6.9m，层高6m以内 | E11: m2 | F11: 539.62 | G11: 100 | H11: 439.62 | I11: 100 | J11: 10.64 | K11: =SUM(RC[-4]*RC[-1]) -> 1064 | L11: =RC[-3]*RC[-2] -> 1064
A12: 17 | B12: 011101002020 | C12: 建筑物垂直运输 | D12: 檐高6.9m；层高5.7m | E12: m2 | F12: 539.62 | G12: 539.62 | H12: 0 | I12: 0 | J12: 13.45 | K12: =SUM(RC[-4]*RC[-1]) -> 7257.8890000000001 | L12: =RC[-3]*RC[-2] -> 0
B13: 合计 | K13: =SUM(R[-7]C:R[-1]C) -> 19693.396499999999 | L13: =SUM(R[-7]C:R[-1]C) -> 10778.006000000001