Sheet: 3.表1-1-1工程项目报价汇总表
A1: 表1-1-1 工程项目报价汇总表
A2: 工程名称：杭州市中医院丁桥分院工程
A3: 序号 | B3: 内容 | C3: 报价(元) | D3: 至上期累计完成工程量（元） | E3: 至本期累计完成百分比 | F3: 本期完成百分比 | G3: 本期完成(元) | H3: 监理审核（元）
A4: 一 | B4: 单位工程费合计 | C4: 317222936 | D4: 199880938 | E4: =(RC[3]+RC[-1])/RC[-2] -> 0.64813646072552589 | F4: =RC[1]/RC[-3] -> 3.9901285700224401E-2 | G4: =SUM(R[1]C:R[12]C) -> 12657603 | H4: =SUM(R[1]C:R[12]C) -> 5722813 | K4: =(RC[-3]+RC[-7])/RC[-8] -> 0.64813646072552589
A5: 1 | B5: 1#病房楼 | C5: 16513869 | D5: =2276222+1519064+1698894+1825634 -> 7319814 | E5: =(RC[3]+RC[-1])/RC[-2] -> 0.53564061819795228 | F5: =RC[2]/RC[-3] -> 9.2388101177258944E-2 | G5: 2400288 | H5: 1525685 | I5: =RC[-5]+RC[-1] -> 8845499 | J5: =R[12]C[4]*RC[3] -> 222004.33412406864 | K5: =R[-1]C[-4]/R[-1]C[-8] -> 3.9901285700224401E-2 | L5: =RC[-3]+RC[-2] -> 9067503.3341240678 | M5: 5.21E-2
A6: 2 | B6: 2#病房楼 | C6: 16286106 | D6: =4054055+1268021+1583465+1142143 -> 8047684 | E6: =(RC[3]+RC[-1])/RC[-2] -> 0.54698084367128641 | F6: =RC[2]/RC[-3] -> 5.2836694050744849E-2 | G6: 2121523 | H6: 860504 | I6: =RC[-5]+RC[-1] -> 8908188 | J6: =R[11]C[4]*RC[3] -> 218595.4383985551 | L6: =RC[-3]+RC[-2] -> 9126783.4383985549 | M6: 5.1299999999999998E-2
A7: 3 | B7: 3#病房楼 | C7: 16023684 | D7: =7500455+1409501 -> 8909956 | E7: =(RC[3]+RC[-1])/RC[-2] -> 0.59813342549690818 | F7: =RC[2]/RC[-3] -> 4.2084267263383379E-2 | G7: 1641409 | H7: 674345 | I7: =RC[-5]+RC[-1] -> 9584301 | J7: =R[10]C[4]*RC[3] -> 215186.54267304158 | L7: =RC[-3]+RC[-2] -> 9799487.542673042 | M7: 5.0500000000000003E-2
A8: 4 | B8: 门诊医技楼 | C8: 53346288 | D8: 22086372 | E8: =(RC[3]+RC[-1])/RC[-2] -> 0.43177538425916345 | F8: =RC[2]/RC[-3] -> 1.7756474452355522E-2 | G8: 2482568 | H8: 947242 | I8: =RC[-5]+RC[-1] -> 23033614 | J8: =R[9]C[4]*RC[3] -> 716720.32628921955 | L8: =RC[-3]+RC[-2] -> 23750334.326289218 | M8: 0.16819999999999999
A9: 5 | B9: 后勤值班楼 | C9: 1065629 | D9: 231271 | E9: =(RC[3]+RC[-1])/RC[-2] -> 0.21702768974943437 | F9: =RC[2]/RC[-3] -> 0 | G9: 0 | H9: 0 | I9: =RC[-5]+RC[-1] -> 231271 | J9: =R[8]C[4]*RC[3] -> 14487.8068334325 | L9: =RC[-3]+RC[-2] -> 245758.80683343249 | M9: 3.3999999999999998E-3
A10: 6 | B10: 行政科研楼 | C10: 16142655 | D10: =4293533+1462302+1714438+848463 -> 8318736 | E10: =(RC[3]+RC[-1])/RC[-2] -> 0.58949621360302873 | F10: =RC[2]/RC[-3] -> 7.4169831418685467E-2 | G10: 1172420 | H10: 1197298 | I10: =RC[-5]+RC[-1] -> 9516034 | J10: =R[7]C[4]*RC[3] -> 216890.99053579834 | L10: =RC[-3]+RC[-2] -> 9732924.9905357976 | M10: 5.0900000000000001E-2
A11: 7 | B11: 高压氧舱楼 | C11: 615632 | D11: 347330 | E11: =(RC[3]+RC[-1])/RC[-2] -> 0.56418444785196353 | F11: =RC[2]/RC[-3] -> 0 | G11: 0 | H11: 0 | I11: =RC[-5]+RC[-1] -> 347330 | J11: =R[6]C[4]*RC[3] -> 8096.1273480946329 | L11: =RC[-3]+RC[-2] -> 355426.12734809465 | M11: 1.9E-3
A12: 8 | B12: 后勤服务楼 | C12: 3590283 | D12: =886391+640672 -> 1527063 | E12: =(RC[3]+RC[-1])/RC[-2] -> 0.42533220918796649 | F12: =RC[2]/RC[-3] -> 0 | G12: 0 | H12: 0 | I12: =RC[-5]+RC[-1] -> 1527063 | J12: =R[5]C[4]*RC[3] -> 48150.652122878608 | L12: =RC[-3]+RC[-2] -> 1575213.6521228787 | M12: 1.1299999999999999E-2
A13: 9 | B13: 发热门诊楼 | C13: 1565609 | D13: =284213 -> 284213 | E13: =(RC[3]+RC[-1])/RC[-2] -> 0.1815351087021089 | F13: =RC[2]/RC[-3] -> 0 | G13: 0 | H13: 0 | I13: =RC[-5]+RC[-1] -> 284213 | J13: =R[4]C[4]*RC[3] -> 20879.48631877037 | L13: =RC[-3]+RC[-2] -> 305092.48631877039 | M13: 4.8999999999999998E-3
A14: 10 | B14: 垃圾房 | C14: 78457 | D14: 0 | E14: =(RC[3]+RC[-1])/RC[-2] -> 0 | F14: =RC[2]/RC[-3] -> 0 | G14: 0 | H14: 0 | J14: =R[3]C[4]*RC[3] -> 852.22393137838253 | M14: 2.0000000000000001E-4
A15: 11 | B15: 地下室 | C15: 149467359 | D15: 100285891 | E15: =(RC[3]+RC[-1])/RC[-2] -> 0.67441902148013466 | F15: =RC[2]/RC[-3] -> 3.4638934110021976E-3 | G15: 1902246 | H15: 517739 | I15: =RC[-5]+RC[-1] -> 100803630 | J15: =R[2]C[4]*RC[3] -> 2007839.582327469 | L15: =RC[-3]+RC[-2] -> 102811469.58232747 | M15: 0.47120000000000001
A16: 12 | B16: 基坑围护 | C16: 42527366 | D16: 42522608 | E16: =(RC[3]+RC[-1])/RC[-2] -> 0.99988811909959341 | F16: =RC[2]/RC[-3] -> 0 | G16: 937149 | H16: 0 | I16: =RC[-5]+RC[-1] -> 42522608 | J16: =R[1]C[4]*RC[3] -> 571416.14598920546 | L16: =RC[-3]+RC[-2] -> 43094024.145989202 | M16: 0.1341
A17: 二 | B17: 未纳入单位工程费的其他费用[（一）+（二）+（三）+（四）] | C17: 17587307 | D17: 4204716 | E17: =(RC[3]+RC[-1])/RC[-2] -> 0.24228380484243053 | F17: =RC[2]/RC[-3] -> 3.2070661467336723E-3 | G17: =R[1]C+R[4]C+R[5]C+R[9]C -> 546493.79891615594 | H17: =R[1]C+R[5]C+R[9]C -> 56403.656891912142 | N17: =RC[-10]+RC[-6] -> 4261119.6568919122
A18: （一） | B18: 整体措施项目清单（1+2） | C18: 5078600 | D18: =3738711+71155 -> 3809866 | E18: =(RC[3]+RC[-1])/RC[-2] -> 0.75906037096837708 | F18: =RC[2]/RC[-3] -> 8.8800063009490809E-3 | G18: =R[1]C -> 527020 | H18: =R[1]C -> 45098
A19: 1 | B19: 组织措施项目清单 | C19: 5078600 | D19: =R[-1]C -> 3809866 | E19: =(RC[3]+RC[-1])/RC[-2] -> 0.75906037096837708 | F19: =RC[2]/RC[-3] -> 8.8800063009490809E-3 | G19: 527020 | H19: 45098
A20: 2 | B20: 技术措施项目清单
A21: （二） | B21: 整体其他项目清单 | C21: 11882000 | D21: 0 | E21: =(RC[3]+RC[-1])/RC[-2] -> 0 | F21: =RC[2]/RC[-3] -> 0 | G21: 0 | H21: 0
A22: （三） | B22: 整体措施项目规费[3+4+5] | C22: 19335 | D22: 12183 | E22: =(RC[3]+RC[-1])/RC[-2] -> 0.64813646072552589 | F22: =RC[2]/RC[-3] -> 1.8035607350816822E-2 | G22: =R[1]C+R[2]C+R[3]C -> 600.80279999999993 | H22: =R[3]C -> 348.71846812804324
A23: 3 | B23: 排污费、社保费、公积金
A24: 4 | B24: 危险作业意外伤害保险费
A25: 5 | B25: 农民工工伤保险费{[（一）+（二）+3+4]*费率} | C25: 19335 | D25: 12183 | E25: =(RC[3]+RC[-1])/RC[-2] -> 0.64813646072552589 | F25: =RC[2]/RC[-3] -> 1.8035607350816822E-2 | G25: =(R[-7]C+R[-4]C+R[-2]C+R[-1]C)*0.114% -> 600.80279999999993 | H25: =R[-21]C[3]*RC[-5]-RC[-4] -> 348.71846812804324
A26: （四） | B26: 税金{[（一）+（二）+（三）]*费率} | C26: 607372 | D26: 382703 | E26: =(RC[3]+RC[-1])/RC[-2] -> 0.64813646072552589 | F26: =RC[2]/RC[-3] -> 1.8039913634122252E-2 | G26: =(R[-8]C+R[-5]C+R[-4]C)*3.577% -> 18872.996116155995 | H26: =R[-22]C[3]*RC[-5]-RC[-4] -> 10956.9384237841
B27: 总报价[一+二] | C27: 334810243 | D27: 204085654 | E27: =(RC[3]+RC[-1])/RC[-2] -> 0.62681735414197559 | F27: =RC[2]/RC[-3] -> 1.7261170402399884E-2 | G27: =R[-23]C+R[-10]C -> 13204096.798916155 | H27: =R[-23]C+R[-10]C -> 5779216.6568919122 | I27: =RC[-5]+RC[-1] -> 209864870.65689191
A28: 总报价(大写)： | B28: =R[-1]C[5] -> 13204096.798916155 | G28: 元整
B31: 项目经理： | C31: 日期： | E31: 监理审核人： | G31: 日期：

Sheet: 4.表1-3-A组织措施项目（整体）清单及计价表
A1: 表1-3-A 组织措施项目(整体)清单及计价表
A2: 工程名称：杭州市中医院丁桥分院工程 | D2: 第 1 页 共 1 页
A3: 序号 | B3: 项 目 名 称 | C3: 单位 | D3: 数量 | E3: 金 额(元) | F3: 至上期累计支付（元） | G3: 本期上报金额 | H3: 监理审核 | I3: 备注
A4: 一 | B4: 安全文明施工措施项目 | C4: 项 | D4: 1 | E4: 4288600 | F4: 1080899 | G4: 495420 | H4: =0.4*RC[-3]*R[3]C[4]-RC[-2] -> 30877.664000000106 | L4: 0.04
A5: 二 | B5: 检验试验费 | C5: 项 | D5: 1 | E5: 790000 | F5: 497779 | G5: =RC[-2]*R[-1]C[5] -> 31600 | H5: =RC[-3]*R[2]C[4]-RC[-2] -> 14220 | I5: 按进度比例支付
A6: 三 | B6: 其他组织措施项目 | C6: 项 | D6: 1
A7: 1 | B7: 提前竣工增加费 | C7: 项 | D7: 1 | L7: 0.64810000000000001
A8: 2 | B8: 已完工程及设备保护费 | C8: 项 | D8: 1
A9: 3 | B9: 二次搬运费 | C9: 项 | D9: 1
A10: 4 | B10: 夜间施工增加费 | C10: 项 | D10: 1
A11: 5 | B11: 冬雨季施工增加费 | C11: 项 | D11: 1
A12: 6 | B12: 行车、行人干扰增加费 | C12: 项 | D12: 1
A13: 合计 | E13: 5078600 | F13: =SUM(R[-9]C:R[-1]C) -> 1578678 | G13: =SUM(R[-9]C:R[-1]C) -> 527020 | H13: =R[-9]C+R[-8]C -> 45097.664000000106
B15: 项目经理： | C15: 日期： | F15: 监理审核人： | H15: 日期：

Sheet: 工程进度完成情况
A1: 工程2016年5月份形象进度完成情况
A2: 序号 | B2: 单位项目 | C2: 施工完成情况 | D2: 监理审核情况
A3: 1 | B3: 地下室工程 | C3: 地下室砌体完成至95%，后浇带全部闭合，局部粉刷、油漆班进场施工准备 | D3: 地下室砌体完成约95%，后浇带全部闭合
A4: 2 | B4: 3#病房楼 | C4: 结构封顶，砌体至8层 | D4: 结构封顶，砌体2层至9层（5层暂未砌筑）
A5: 3 | B5: 2#病房楼 | C5: 结构封顶，砌体至7层 | D5: 结构封顶，砌体2层至7层
A6: 4 | B6: 1#病房楼 | C6: 结构封顶，砌体至7层 | D6: 结构封顶，砌体2层至6层
A7: 5 | B7: 行政科研楼 | C7: 结构封顶，砌体至9层 | D7: 结构封顶，砌体2层至9层
A8: 6 | B8: 门诊医技楼 | C8: 结构封顶，室内翻边施工，二次结构待隔墙图及配套图纸齐全后施工，目前处于停工状态。 | D8: 除9号区块设备层屋面未浇筑砼，其他区块结构封顶，室内翻边施工。
A9: 7 | C9: 安装预埋工作施工，地下室局部墙体线管开槽预埋施工 | D9: 安装预埋工作施工，地下室局部墙体线管开槽预埋施工
C11: 项目经理： 日期： | D11: 监理审核人： 日期：

Sheet: 汇总表（土建+安装）
A1: 杭州市中医院丁桥分院项目
A2: 2015年12月份工程进度款汇总
A3: 序号 | B3: 项目 | C3: 申报完成工程量(元) | D3: 监理审核工程量（元） | E3: 备注
A4: 1 | B4: 土建工程 | C4: 24843292
A5: 2 | B5: 安装工程 | C5: 1522470
A6: 合计 | C6: =SUM(R[-2]C:R[-1]C) -> 26365762
A8: 施工单位签章： | D8: 监理单位签章：